new_id,row_id,author,subreddit,id,text,dataset,video_id,reply_date,category,valid_annotations
8855948b-9217-44fb-b88e-d720fb1b85f1,6007,dangerousbiz,,17915002831199749,"@paraonde Yup, there’s definitely something satisfying about seeing something for yourself, no matter how many photos by other people you’ve seen.",instagram,,,,3
39e5a2fb-4e56-4b77-8863-55db946afc4b,5354,wander.horizons,,17965977100226603,@frauvdh that's one big step you took!🙏 and it makes it way easier when you realize your substitutes are working and turn out even better 😊,instagram,,,,3
bb9e9522-b23b-4eb9-a76d-e32e83cfe9f4,593,taylor_lmaoo,subway,j2t0bal,yes. all the meat is prepackaged. and it takes 3 min for me to make a sub if it’s not complicated. just a slightly healthier fast food place,reddit,,,,3
07b9268a-5012-4097-97a4-2ade0dab6c88,1253,newmumonline,,17955054460129204,@candy_the_clothes_pony oh I love that feel good in the hood. I'm gonna start creating mine. So glad I found you. One day you'll have to tell us your romance story sounds great x,instagram,,,,3
160d0ee4-c2ad-48fe-bc78-79f7ef00b902,4379,turtleengine,StLouis,g5ibwqk,"yes it is relatively safe. yes it is a good neighborhood, lots of restaurants and bars. Pretty walk able neighborhood too.",reddit,,,,4
9269c4ae-2c93-4638-9113-75094fb778dd,2997,practicalbydefault,,17934681274202323,@allthehomeschoolthings 🤣 we use  brown gray so beef based is normal. I am not a fan of gray either but you'll have to give it a shot 😘,instagram,,,,1
2ca48e43-23b6-4611-911b-f643e405b89e,7261,wildlings_forestschool,,17967543220029310,@wovenspirit I was thinking of you as I entered the competition Mietta. When the timing is right we’ll just have to go to another one :),instagram,,,,2
31d8abad-eccf-49a9-b1ca-d31b842d9726,3526,mari_unfiltered,,17878873735174194,@fancyfrogzshop I gotta say I love who you are as well even though we've never met you radiate strong beautiful vibes,instagram,,,,4
42389652-a3e5-4a7c-905a-c5a67f4886a0,1497,the_forest_cantina,,17864859067275634,@tessamaddock thank you Tessa ☺️ what a blessing google maps is for people like us huh! Love to travel and feeling prepared certainly helps makes the experience joyful ☺️,instagram,,,,2
7c4a2257-7e57-466e-80f0-e1d7fc69b37d,2582,studiobicyclette,,17850025909261525,"@sailorparc Aw, thank you so much for this, what a lovely message, with so much truth in it. Cheers to following your love! ✨",instagram,,,,3
3a86f631-ab1b-4571-9a2a-f2e19b42a884,3351,PhoenixApok,NoStupidQuestions,kdnvtbz,"Probably almost all of it. Most spices are basically zero calories. At the very least too small to be worth tracking. 

But this is kind of a weird behavior.",reddit,,,,3
587f2b16-19de-4126-8840-9343e6b9eb64,8377,beautystylelist,,17903682523171111,"@nsdianna thank you so much! I usually use 2 shades. 1 for the highlight areas of the face, and another for the outer areas/contour.",instagram,,,,1
77a0e18d-d018-4afd-8807-b0d36d6780bc,4832,withmylittleloves,,17956736581163505,@life.and.littles 😂😂😂 well that’s a bit awkward! I’m glad you realised and someone didn’t turn up thinking you were stealing their car 😂,instagram,,,,5
e4ff9618-bfc0-4fa6-9197-a53400c28aac,445,,,id_2202,This is not just a tool for engine bays. It can be taken all over the vehicle. Check out our other videos on our Mechanics Mate YouTube page,youtube,qBc1Ba-0o9E,2018-11-16T23:04:35Z,Autos & Vehicles,2
438c5e98-30be-4431-9992-dc77208c4bca,191,,,id_1102,"Go outside, go fishing, go for a walk, do something other than being on your phone. Enjoy life because it’s short man. Find Christ brother hes the answer.",youtube,wgbV-KCiwSU,2024-04-21T18:45:03Z,People & Blogs,3
febb6e33-2f4e-4005-a0b7-8318beb69905,522,,,id_522,@@davisng6982 I’ll make a more in depth tutorial soon on how to do it 😊,youtube,o30v-awPwmQ,2025-02-16T08:40:29Z,People & Blogs,2
ebb79819-ae51-4f9b-b14d-5ae3411ccfc0,2492,theconfusedmillennial,,17968030480089279,@martinadelreyann yeah I believe it! I always want to move to Cali but between real estate and your taxes I’m like 🤷🏻‍♀️🤦🏻‍♀️🙅🏻‍♀️,instagram,,,,4
822cd84e-7f47-4110-bf4b-c29e6c86f3b6,9833,tori.mccain,,17844509764410431,@theuphillslide thank you so much! I’m completely covered as well. It was definitely hard for me to accept them but once I did it made life so much easier! Well said 🥰,instagram,,,,5
379c90c9-f019-4a9a-a63c-d07b8b8a1cc4,1980,cheekymarxist,ChapoTrapHouse,eku05pg,"I would rather see a cabinet of republicans and democrats placed in a blender.

If not blended, how bout pureed?",reddit,,,,4
fbef82a6-2cd7-42ca-b802-2fe135ddf923,275,,,id_275,"i love that part too, le looks really in love :)",youtube,X4YK-DEkvcw,2018-11-30T02:14:20Z,Music,0
74936dfa-aaae-4f41-9915-e7b4c76e1506,43,,,id_954,LOL! I bet he was glad to have it! They don't give those away. Mine's still doing great. I'll be using it this week so I'll let you know. Thanks Tim.,youtube,0NZ7-2xgJ3c,2022-08-09T15:26:27Z,Education,1
e236af19-3c54-45e4-914b-9539ef60fde7,4387,chinnychinchin1975,antiwork,j4buuot,He’s so nasty he didn’t even wash his hands after all that SHIT! People are disgusting! I would have washed my hands and face and scrubbed my lip. Smh,reddit,,,,1
3985139e-3e49-442d-aa34-2c2f136e050f,1581,PommeDeSang,AmItheAsshole,i4v1tsz,"NTA. First of all you're not always going to be with your friends and even if you were, shit still happens. That is life.",reddit,,,,2
ef54feeb-4fd4-4dfb-b3df-d539232b001f,709,,,id_1620,"Oh, I’m not sure what’s going on. I tried to change the settings but according to Google, it should be available. If not, you can email me (my email is in the description box) and I can email you the PDF!",youtube,xg0F-bWLmMk,2021-02-24T04:04:55Z,Howto & Style,2
98fb4f05-1a1b-4524-b438-1982cae2fc31,6000,iambravemarisolvasquez,,17958796276112918,@brokemillennialblog I hear you! I’m kind of cheap too so paying for extra data would deter from checking it 😉,instagram,,,,3
5c8a26fc-42b7-4527-8f89-b2943d9f991b,1774,Thethirdtoken,AskReddit,ewu2ur2,"The world would be a much better place if people just lowered their expectations, it's an unpopular opinion, because nobody likes negativity, but so much sadness and depression could be avoidable if we were just more realistic about our lives.",reddit,,,,5
ff071f70-2352-47a1-80b0-e62b9a355ddb,618,,,id_1529,"Nope...ethan said himself that he's drooping down stakes after having a negative $1,000,000 2023",youtube,CrBpfq-Hb7Y,2024-02-10T06:33:10Z,Gaming,2
d873affb-b38d-40f2-8fa2-f683adf99d85,2086,TheIncredibleBanner,marvelstudios,d6mkzpp,"That university seen where blonsky is running TOWARDS the hulk is amazing. Dude puts it all on the line. Seriously looked and felt a bit like shadow of the colossus.

On the other hand, Liv Tyler.",reddit,,,,3
d680a71c-53db-4f13-9063-50a4b088128d,3277,gnomieathomie,quilting,feertge,I just bought a peanut butter and jelly colored fat quarter bundle from cottoneer. OOPS!! No idea what to do with it. Any suggestions for fun fat quarter friendly quilt patterns?,reddit,,,,3
ac30d876-f31e-485b-b8bf-f8f545e7bec4,9738,corinneevans,,18019465399069186,@mermaid_angelwings I hear you on the feeling weak situation. It’s all about taking time and listening to our bodies. Food effort on the run .. I hate running haha,instagram,,,,1
eaa53c4c-cf2f-4433-8a63-48293da1b345,3033,deepthaw,marvelstudios,deok05r,"Upon his death, David Bowie's essence scattered itself across space and time. Two sparks of the Ziggy Stardust era coalesced into the Collector and Grandmaster.

Just wait for Thor: Moonage Daydream",reddit,,,,3
60dbdfaf-b74c-46ec-8465-8eebe5730650,3465,Chasing9,GreenBayPackers,dx3j17j,Cheesehead in Kentucky here. There's no way in hell I'm getting tickets to that first home game is there? ಠ_ಠ,reddit,,,,3
72fc8f31-5a1a-4c61-ba56-381e24444f01,6268,britstrawbridge,,17876745610315132,@this_beauty_full_life so happy to have photos like this! I’m glad you have one too! Glad you are okay mama! Thanks for your kind words!,instagram,,,,4
fe4cf28e-8784-4df7-a99f-93f211725984,755,,,id_1666,"DDLC is much more accessible to a general audience, which is the most important thing when it comes to popularity.",youtube,krq6-1ht_kk,2018-04-05T01:39:56Z,Gaming,4
fb7a1d5c-d914-49b0-a0f2-02765579d6cd,3086,shadesofblueinteriors,,17868683251184154,"@sue_ives did you check my blog post? I explain where I got them, what they are called and I even link to them! :)",instagram,,,,3
6d902ef7-01a9-4c64-bbd5-1f031103edb0,9367,sweetersidemom,,18037308919127538,@thepearlcurriculum ahahaha yesssss so glad you love the idea as much as I do lol. It was one of those ideas that I was like “please PLEASE work” lol,instagram,,,,4
cf7e7c1b-ba27-4c28-8988-6c5ba84c7d65,3694,Lilbitch-gotnochill,vegan,hpnxzcl,"Haven’t touched meat my entire life, my great grandparents never ate meat their entire life either they were 102 years and 96 years at the time of their death.",reddit,,,,0
6fe9fa48-104a-45f9-b86c-da1cbeee4da9,1,yuckylavado,,17939869570051845,@kinuko.0901 I love London! One of my favorites. Genuinely. I was just thinking the other day I would like to go to Tokyo one day! I will have to ask you for advice when I go. P.S. thank you for your checkin.... email coming your way soon. You badass 😉,instagram,,,,3
3c7f49bd-9348-46a9-89f2-570866cf8cf2,2039,howjendoesit,,17851302787345416,@soulaa68 I’m so sorry that you are feeling discouraged. Please know that you are loved and God hears you and knows your struggles. Hugs,instagram,,,,4
e67e027f-73a8-4e91-bf9e-40d2a9caa8aa,2160,Automaticman01,Disney_Infinity,g76tkh3,Marvel Battlegrounds seems to be the hardest/most expensive playset to get. I feel like I also had to wait a while to get the Spiderman playset at a decent price.,reddit,,,,3
35b79e14-1d66-46ae-b633-3086a83984d4,893,,,id_893,"Relax, he was invited by the wardens.  These events keep the prison a safer place genius as the prisoners aren't as resentful.  Good thing clowns like you aren't in charge.",youtube,7e2B-thaJG0,2019-10-02T17:11:30Z,Music,2
df3f549b-83dc-49bb-afe6-b0ddffda5be9,3,,,id_3,I've learned all my patience from Amiga. Other computer fanatics have failed at that. They do not know what is patience.,youtube,PrZ8-TorUXA,2023-08-29T21:26:00Z,Science & Technology,3
6a64b082-f26f-43d5-9ebf-3d1dfe53cc61,233,,,id_1990,"Hell yeah, another funks fan, i was immediately like yup ill be seeing this in a day or two",youtube,RXUj-9V2-lY,2022-09-01T00:30:39Z,Howto & Style,1
50bd31a7-f153-407f-be59-808e670e53d8,2374,sclort,Shamchat,dxftlby,"they come and go in waves almost, but since the captcha is so easy to bypass now, they might just keep increasing.",reddit,,,,3
451bfafd-c303-45d5-8fe7-ee17961c72d4,87,,,id_1844,Can you help with the reliable source I would really appreciate it. Many people talk about mushrooms and psychedelics but nobody talks about where to get them. Very hard to get a reliable source here in Australia. Really need!,youtube,Fg7U-BhiZGE,2025-05-23T03:58:30Z,People & Blogs,3
ff60222e-3d62-4982-b93e-b707f4eb9a1c,2462,LostMyLid,dndmemes,hs8anzw,"But that's what the one level of rogue is for.  
sweet, sweet +8 to stealth, am the stealthiest even in my gleaming full plate armor.",reddit,,,,3
622b424d-a348-4f38-8e05-a28d7f7a39eb,209,,,id_1966,On last rep I feel that my core  is giving out not my legs.Always think that you spread the floor apart with the legs to generate as much force as possible with the legs,youtube,dzb5-kUJ1qY,2021-10-15T08:24:12Z,People & Blogs,2
6b148d72-7406-4ab7-bf03-a4f6a5bcb107,790,DrPepperThanks,ukpolitics,gmkr8vb,"Her administration was based on a confidence trick in which the voting public weren't given a wage increase, but they were given access to cheap credit which allowed them to fund their lifestyles for around 35 years",reddit,,,,2
ad257275-8598-46a9-8c53-ac2df6d1c3fe,9236,middleofadventure,,17920546888139336,@newgirlintoon Thank you!! It annoyed me so much 😂 And I shall - I've been there a few times and love it so much. Can't wait to explore more! ❤️,instagram,,,,4
c5182d13-e2c2-4a2c-a847-1113baf93cd8,9841,nourish.with.sanity,,17869044082369420,"@streetsmart.rd in the instance where sustained weight loss can only be maintained with restriction and rigid approaches, I don't think there is any benefit that outweighs the risks of health impacts that result when restriction is primary. But in some cases, sustained weight loss can be possible without being more rigid and without restriction. There are examples of that possibility, but it's definitely another point where we have to tease apart the message and make it individual as you mentioned. Isolation, restriction, rigid approaches, all of those things are not positive and if that's the only way to sustain weight loss then no, it isn't inclusive of mental/social/emotional health.",instagram,,,,3
c471dece-d56b-48ac-b56f-b5a40428fe4c,722,,,id_722,"Kamala never received one vote , she is unworthy she always will be unworthy because she was installed. Only the Democrats can complain about their choice forced on them by dictators of the Democratic Party",youtube,i09U-eoq-bk,2024-08-04T20:35:43Z,Sports,3
75644b3d-78b0-42bd-b5a8-4f6628ba9ee7,9879,livelaughlove_beyou,,17979050380145697,@lcq33185 oh lady you know I’m all about eating whatever you like want and crave!! I love Oreos too. I get it 😂. And changing it up is definitely important not only to enjoy more foods. It also so you don’t start to get on a comfort zone and fear other foods!,instagram,,,,2
957e911e-df98-40b2-b7f8-ce226f28e8e2,4288,xd_Twitched,MovieDetails,fk1mevd,Found this in The Harry Potter film wizardry book- it is an amazing boon and I really recommend it :),reddit,,,,3
59c6266b-209e-404b-81ce-bd2a43e537fa,745,magdalenschkova,,17885457772058209,@madesintya hahaha stop the spam 😂🙏🏻 I will post that video for my birthday this year 💘 you still have it ? 🙅🏼,instagram,,,,0
526e4003-880a-431b-9f77-93d6467a189c,564,ZJS102,NASCAR,gydcuh6,"As much as I liked looking at Rick Hendrick's back, I would've liked to have seen all 4 Hendrick cars cross the line Fox",reddit,,,,2
93a1ed11-4dbb-4c58-aab4-441c8f438660,7155,livinleggings,,17952460837169356,"@foxyogamom ah thank you lovely! And I hear you, it took me so so long to be even find a moment of balance here when other shapes I was starting to have confident holds in! I don’t see why it’s SO different 😂🤷🏼‍♀️",instagram,,,,3
ebccd832-1e8e-432a-865a-08ac7410f01f,149,,,id_1060,"By buying the license, the copyright claims don't affect your channel; it just makes it unmonetized.",youtube,H_e2c3-X2JA,2023-01-27T13:20:24Z,People & Blogs,3
336064ca-6225-4f4d-b494-d491f5374791,292,yessybuttons,,17966963236055608,@dilligent_koa thank you so v much!! I need all the happy/positive vibes 💛🙃 I need a good hike far away lol just music and nature. But it’s so darn hot in az right now lol. But thank you for all the kind words 💗😃♥️,instagram,,,,2
3e0c7cda-8749-4b88-b7c4-1d17e6869c9c,252,,,id_252,More than one million dead and counting around the world can't be wrong. What did any of this garbage have to do with the song?,youtube,X4YK-DEkvcw,2020-10-14T14:35:25Z,Music,2
96794ad5-f662-4265-8dd5-682785a8ed5e,1240,TubbleRole,Paladins,djokrnu,"I want to say this,for people mentioning and people asking for it

First of all,it's a fictional drawing,why does the age of a fictional drawing matter?We don't need to ascribe age to something fictional...",reddit,,,,3
fa3fc350-cf86-4723-bf41-59d80846d961,3697,Ok_Panic3397,RustConsole,kamu7my,"Last wipe I raided every 1x2 near me. Ended wipe with disposable MP5’s, Tommy’s SAR’s and a 2 boxes full of AK’s. Not one of them was crafted by me. I’d raid it",reddit,,,,5
ae0493ca-ec1a-4f78-8557-41a231645f1a,2040,12crowsinatrenchcoat,AskReddit,g5x4pal,i wouldn't because i know the people of this country aren't ready for that. I'll just be here helping my own community until i get dragged away by MAGAts.,reddit,,,,5
dfd4f9cf-06d3-4716-9a61-8af2bdab28c7,676,delightnoted,,18002725675178378,"@overflowingcottage thank you! I do! The chairs were from @birchlane , the pitcher was from Goodwill (last year) and the greenery I believe I found at Michaels!",instagram,,,,4
94baa392-a042-43e6-84ef-8f86cc755d5a,562,,,id_562,"She didn’t know the name, it was a miscarriage baby and the name was never said",youtube,MlLKVG-y95k,2024-06-06T22:17:53Z,Entertainment,2
12e8ba99-b730-4360-ba48-41a0fecb340c,9985,sarahkirbyblog,,17845209988327357,@morethangreens they’re worth trying! If you look on their Twitter account page they have tweeted a list of the 900 stores selling them. We had to travel a bit to get one as none of our local shops were on the list xx,instagram,,,,1
9232b064-c542-421f-9bd9-ac73860f6617,3252,thejanuaryfallen,AssassinsCreedOdyssey,g3hjo11,"SHE'S A BITCH!!! Congrats!!! This boss fight took me a VERY long time to beat. Weeks if not a month of taking breaks, trying again, taking breaks, trying again. 

Congrats!!!",reddit,,,,5
bf8642d9-c81a-4678-a1aa-69d364b54b39,225,aristailona,,17956588330098436,"@9mm__nina oh love!! I’m sending you so much strength to push through that with compassion towards yourself. If you ever need deeper support, I’m here 🙏 know that it can be healed and shifted. You are not alone",instagram,,,,2
9fea6488-10f5-4622-af74-996e4e8fd114,3737,castironandpearls,,17987127826069684,@restandriesling I’ve only been to @snoozeameatery and the @theviewhouse in Littleton. I’ll check out @workandclassdenver! If you are still in town @unomaspearlstreet is great. And they have @maskaosdenver too with both pizza and tacos!!!,instagram,,,,1
722fb3f6-00b3-4297-891e-909c43aaa672,616,,,id_616,No because I don’t know what stranger things are or is,youtube,Ux4x-pH2RdY,2020-03-15T06:21:15Z,Entertainment,1
27166f6c-6288-402d-997d-e2853b216e4a,184,,,id_1941,"NTSC is 60i fps and PAL is 50i fps. You're probably confusing it with the traditional framerate of film, which is 24 fps. TV broadcasts have always supported HFR, but the actual content being broadcast would have been (and still is) anywhere from 24 fps to 60 fps.",youtube,aqz-KE-bpKQ,2014-11-28T21:11:13Z,Film & Animation,3
cf5d89ce-f4e0-4df6-ba7a-dce7daf39912,3002,smallstuffemily,,17997400969158214,@christileeplusthree sharing rooms was fun! We have one brother so he always got his own. I’m so glad to connect with you! I think a lot of organizing and DIY is gaining confidence one little project at a time!,instagram,,,,5
641d88c1-6814-49a5-bc0e-60a150f2a3b1,4510,getfatwithnat,,17908347178203011,"@loves2brunch honestly, what an embarrassment. I know how frustrating and exhausting this experience was for just us two adults, let alone the thought of having two children! I really feel for you! 
The rest of the trip was amazing - our destination wedding could not have been more perfect and the Egyptian portion was just incredible thanks to bench Africa/Kanoo Travel who organised the whole thing.",instagram,,,,4
82affecf-5ffe-49dd-a295-8868942edd7d,36,,,id_1793,"As the brother of 3 sisters, I can tell you firsthand that it's not about her being accountable, but being safe.

A lot of people are GREAT when the relationship first starts, and then their true colors start to show.

They become dangerous, and it becomes dangerous for them to break up with someone, especially if they become abusive.

Some even begin making veiled threats about what would happen if she ever left him - narcissistic emotional manipulation. 

You know how many times between me and my dad my sister's exes just broke up with them for no reason?

They didn't need to be accountable... they had accountability at home.",youtube,bzXw-Vs_8mY,2025-04-26T15:10:34Z,Entertainment,1
8c35b951-26ea-4c2c-9c89-4354368e9e93,688,,,id_1599,Replace the foam or rubber edge that surrounds the cone...the sooner the better.,youtube,Ro4P-9-v1k0,2024-10-08T18:27:04Z,People & Blogs,4
f363cce5-b706-41ec-9cb1-c14dff3bd2d1,509,dahliaflat,SuicideWatch,fwvjjzb,"Privilege doesn’t matter, ok? Everything you feel is valid and don’t let anyone tell you otherwise. Have you talked with your parents about anything?",reddit,,,,4
f506f5eb-49f7-4f01-8763-9ef54d1f1cee,3155,pixelamb,AskReddit,f36ga6j,I’m going to refer you to r/outoftheloop . It’s a subreddit meant for posts exactly like this if you feel uninformed about anything,reddit,,,,2
6760ff67-8d4d-4df3-b4be-7efde21d57f7,3806,Mr_Flint_Stone,isopodexchange,hlwbnv0,"It looks like Battlenet is having a Black Friday sale right now, too. I'd be trading in your favor so this could really sweeten the deal",reddit,,,,3
74db770f-dbf2-48f7-a436-59c949f2e34a,6108,dobiesisters,,17952635356258855,"@kai.the.golden.retriever thank you Kai! As much as we usually like snow, we’re ready to warm up and thaw out!! Likewise, thanks for always being so sweet and kind! Sending you lots of love too!! 🐾❤️",instagram,,,,5
9dd6521f-df1f-437f-89b5-b6b0ea6a132a,7132,saammiieex,,17887113043242410,"@jemma_slimmingworld_diary hiya, really want to try this out but I’ve never really used my slow cooker for much other then a stew. When you say you put the chicken in over night do you had water or anything? Probably such a stupid question x",instagram,,,,2
c5b78593-6188-45d3-9d03-e065cc469bfe,2100,CleaningBeret83,dyinglight,gincgcz,Anybody know why you can’t punch them sometimes. Like why the prompt just doesn’t appear then you’re looking at them. It’s really frustrating.,reddit,,,,2
ce02da34-e0b6-4dae-9981-417a9a9b8422,991,CrutchTouch,darksouls,epi2bfm,"I rarely ever use the silver pendant either, find its usage during the fight cumbersome and just heal through the magic attacks that I can’t fully dodge through.",reddit,,,,4
7c536ca3-fa0f-4df5-8883-61c4bd3da314,3910,fitbyfifty.us,,18051658780048023,"@liftingweightsnotwine Thank you so much Angie 😘and I totally understand that .  I have a tendency to go “ALL IN “ and sometimes it can be a bit much but I knew what I was getting myself into and I know this is only for 12 weeks .  After that , it’s back to just living the #fitnesslifestyle and having more balance .  Keep doing your thang and avoid letting it add stress !",instagram,,,,2
cd95d685-d636-43d1-a00f-aa30dd77e7fa,2410,aboutthishaus,,17877879814302039,"@designhunter_uk It’s a beautiful finish, I love it. I just wish it was harder wearing, I find it leaves a grey cast rather quickly. Not sure if it’s what I’ve used and maybe I should try another brand before using something else. Is there a particular brand you like using? X",instagram,,,,2
480a4fb0-e1ec-4550-aa2e-d4c3b03ad983,2797,Jabaskunda,CitiesSkylines,k5p71i2,CS2 is a an astonishing simulation while CS is good for build a city but not so good if you want to manage a city,reddit,,,,3
70751bde-8a1a-4fee-a564-7ccb861870ec,296,,,id_296,Lucky you. I work with no escalators with walls as views.,youtube,X4YK-DEkvcw,2016-05-29T15:41:30Z,Music,2
2fed3c62-427b-4b0b-ab6f-634b85503d8c,1818,kingbitchtits,CryptoCurrency,hq4qcur,Yeah but it could be used as currency for the entire country therfore it will be regulated. On that note which federally approved network is the USADD gonna run on.,reddit,,,,2
8badf6a2-602e-4358-bc00-860b47279c9f,297,,,id_2054,But this last for 6 years and you own it and its your private gym.,youtube,hZhI-iTdIWg,2025-01-31T21:57:28Z,People & Blogs,2
a7da4f56-5ef5-413d-9d54-e84cdab395fc,7308,exploringdomesticity,,17976959728110802,"@kimchapman6718 I really like it, but it does take up space on the counter right now. As I get better at it and use it more, I almost think we could replace our toaster oven, but I'm not sure yet. I think they do have very small ones... I'll keep you posted!!",instagram,,,,3
7a3ad8c8-ed2e-4272-90ca-278ac142a60a,286,,,id_2043,You can do a ton of exercises with these. What are you talking about?,youtube,hZhI-iTdIWg,2025-02-11T08:40:54Z,People & Blogs,3
b21c68d3-e72c-422c-b7d1-962cceb6f896,7633,sanne_reads,,17883761290174385,"@booksandrachel hahaha aaw, l've been feeling doomed for a while now on BG so nu surprise there..😆 You're absolutely right though, it takes so much time (take pictures, write captions, like, comment etc). And of course we need time to READ.💃 I honestly don't know how they do it either.😂",instagram,,,,6
22b48f5f-2336-4098-8571-7f91f2d15b3f,2793,00tool,funny,icjwk7r,"just take a hammer and pull out the rollers out of the guides, the door will roll down without falling if the steel cable us still attached. 
the door is fine looks like the roller is broken. 10$ fix.",reddit,,,,4
faa51582-e33a-4738-b64e-05b56ea8d41b,6960,justafewchanges,,17952891652087549,"@_homebirds_ oh no, wishing you a speedy recovery! This was round one, three bags of clothes for the homeless of Essex and I’m planning round two at the weekend! X",instagram,,,,1
1b0c9e94-0706-42fa-8924-6cf7d5b23ea5,9871,yoitsmaddyob,,17907850675097903,"@crystalseaver good for you! I failed to mention my advice was from learning at 12 years old, probably not quite as quick a learner as you are now! Glad you're having fun on this new adventure!",instagram,,,,4
dc6f01ab-eefc-4f0e-b773-e4dba7e4e8fa,1091,daniellellp,,17911239619088435,"@pebbles_and_peanuts Hehe.. thank you, he definitley doesn’t question, he’s just baffled sometimes😂. I won’t do both as it would be too dark, prob just paint the walls!😉xxx",instagram,,,,2
42195a80-55d5-407a-9517-e7ed6f83c76e,1067,Genetiker27,minnesotavikings,ix5obfr,"Guys it’s fine, as long as all our playoff games are at noon it’s all good. I’ll start the petition now for Super Bowl to kick off at 12 CST",reddit,,,,3
