new_id,row_id,author,subreddit,id,text,dataset,video_id,reply_date,category,valid_annotations
265ea968-ecad-42ca-92b0-1207ea00ad98,285,RudeBlueJeans,ask,kbe2cd2,"I was only approached 1 time.  I love him so much.  And I was a beautiful girl when I was younger.  Just very introverted, short and with dark hair.  If that has something to do with it. Oh well.",reddit,,,,2
95ae8f2e-c9e3-4acf-859c-b146955605c1,182,,,id_1093,That's unfortunate. Where do you live? Hope you find an aat soon. Is online an option?,youtube,0WX6-qOYFvY,2014-05-29T05:32:03Z,Entertainment,5
4de8d3ac-1266-454e-95b1-c21913430e97,263,,,id_1174,"Be grateful you do not relate! In my life, addiction has caused a great deal of suffering ❤",youtube,Fg7U-BhiZGE,2025-05-23T15:23:37Z,People & Blogs,1
7f213f5b-3a41-44d0-b96f-e796b67c42c6,7285,polcat625,,17985528115077597,@dave7herave it’s amazing. Spoon of almond butter and a sprinkle of nutty granola on top if you’re feeling fancy!! So good,instagram,,,,4
b18b9dbd-a343-41bd-9655-c833fd912221,1112,thehealthylifeisgood,,17897313607175449,"@brandi_rambling yay! Hi!! I'm excited for you to read and follow along. It's such a good book, with realistic principles to live by- life long. Let me know if you watch it! Love to know your thoughts:)",instagram,,,,2
16a3e7be-5a2d-41e0-afab-becaea61b42a,22,,,id_933,"I think your dealer pricing is highway robbery. My K1100 was costing less to run than equivalent Honda and Kawasaki, never found out about Yamaha, but probably the same. I have had the clutch replaced with original parts for approximately $2000 Australian dollars. A complete tear down of the K100 was $1700 to replace all gearbox seals and the input shaft, at about 200,000 Km. Anyone familiar with the K100 knows this is inevitable on K100 bikes. My K100&K1100 both made 300,000 Km before selling. Been pretty happy with K series but K1600 is too heavy for an old blighter like me(nearly 70!).",youtube,X7J3-4mC6ws,2022-01-31T14:57:40Z,Autos & Vehicles,2
e92677c4-48c1-4749-bc6a-ffd0d9e29414,228,,,id_1139,By the looks of it sounds like people who where almost blackout drunk daily/ more than once a week,youtube,Fg7U-BhiZGE,2025-06-11T14:12:07Z,People & Blogs,3
9937e61a-0f51-4b9e-990a-cdf66f988106,413,,,id_1324,"@Charlie Hebdo thank you Charlie. It's just that I read on Google that its not illegal, but immoral. Go God's law above man's law. So I'm not sure. I'll ask my priest too",youtube,JgtJ-sFzWww,2021-06-03T22:18:53Z,Entertainment,2
3ab8ecba-d8e0-4073-bd67-3b34fbeeb5e2,316,,,id_2073,Hello My friend thank you for watching.No nothing wrong with crawling my friend in that part everyone need safety first.There’s a full episode of this was uploaded 3months ago.. Thank you for watching my friend.,youtube,O_4uU6-6jC8,2022-10-26T05:56:02Z,Gaming,4
2edad23c-4230-4ebd-ad70-8171a09b8b78,547,,,id_547,"She genuinely waited 4 months to finally ""say something"" like bruh you could've done that when they announced the name",youtube,MlLKVG-y95k,2024-09-01T15:20:37Z,Entertainment,1
e723b569-4fb3-4723-9eec-0649e1605626,6480,thechillmom,,18011900371111335,@mary_anne_lin Thank you Mary. It’s my pleasure to have met you and being able to call you my friend now. ☺️,instagram,,,,1
3e4eb78c-03ee-469a-bcac-046af516ee8d,1484,panache_mania,,17980959370173336,@ankitashalini25 Awwwwww 😙😙😙😙💕 Love you Anki with all my ❤  and so glad to have you in my journey and sharing such amazing memories. Cheers to the good days 🥂🎉💕,instagram,,,,3
b1f9448c-bafa-4180-9a99-2afb84ec2ebe,2841,laurelryser,,17894705581215918,@pataraelephantfarm that is amazing to  hear! I want to come back soon❤️ expect me! And of course you can repost.,instagram,,,,5
f65909c2-a39b-4f85-9c53-102fb10fc978,771,ignorantnormie,bettafish,jcrh5of,"This is why I mix in distilled water when I add new water to ""replace"" the water that evaporated (and left behind minerals)",reddit,,,,2
a3e88127-2f73-4d93-af8e-a7e2863ed0bd,1563,Arnold_3135,u_Forsage_io,guek77o,"Useful information, I did not think that a closed wallet is more dangerous than an open one, and in general I somehow did not ask this question",reddit,,,,2
61d9ce88-49af-405d-9fc9-74f230a7ea6a,312,,,id_312,"Honestly, I don't see that besides some structure relevance. Other than that, the instruments, atmosphere, vocals, and lyrics are so different. The structure is even fairly different to me.",youtube,X4YK-DEkvcw,2014-11-11T02:52:31Z,Music,2
3f9a4dc8-59c9-4b63-a63f-5ba17c728ea7,1827,thefashionfitnessfoodie,,17924483905220532,@jbecker63012 I’m so sorry to hear you want through this. The healthcare system is flawed in so many ways. This is a comment on representation. I am not minimising your struggles. ❤️,instagram,,,,1
81b778ef-ff52-439e-a368-c4971dc2d06a,2720,eaustin86,,17915130937189142,@heyitsok.holly I’m with you sister! Haha! I never get anything done! Sometimes finding the time to get showered and dressed is a struggle hahaha! Xxxxx,instagram,,,,4
d697e47f-e538-40e4-bf64-1e79ef99d959,2862,Fatgrandma24,antiMLM,gf8jh9a,This makes me so angry.  There have been many times in my life I didn't have 2 dollars let alone 20.  Asshat.,reddit,,,,5
5259da0f-8882-4dd2-809e-288d9ea48a98,8338,eclectic_twist,,17857752625264919,@blissfully_eclectic oooohhh so excited to see what you are up to sweets! Hope you're having a great time on vacay!! ❤❤,instagram,,,,1
d78bb9e3-60ee-4774-88a5-7045334e9fcd,7725,khan_plastic_surgery,,17886998698282534,@planomoms no problem! Would love to host an info night for the Plano moms group...even better we are having a grand opening on December 8th for the Plano office so would love to invite you and the rest of the group. I will DM you the invite :)),instagram,,,,5
b7ae16d3-b04e-4a6c-ac63-0cc3e3f97d02,2716,Teleclast,pcmasterrace,e0mlty7,"Nope. I’m still enjoying the few games that give me thousands of hours of gameplay like PoE, Minecraft, Factorio, Forts, etc. 

Moddavle and enjoyable. I got no money for upgrades or games man lmao",reddit,,,,2
20830b8b-4df8-4203-b156-77874020278f,1485,crystalseaver,,17885002132188856,"@kelli_nz I’m totally okay with sweat 💦 my buns off 😂. I’m aiming my for 80 - but, it will depend on how Mother Nature plays - we have a blizzard forecast for tomorrow followed by even colder temperatures so we will see. What are you aiming for..?",instagram,,,,1
fdcf27e9-0f92-4f2e-a07a-a3eaec2353fb,6653,rachdsilly,,17916475837168552,"@juleenmad hahaha I will miss that too, and promise to make you thanksgiving sweet potatoes when you visit the US!",instagram,,,,2
1b44001d-2862-4a2a-af05-b867a4deb6f9,5457,jennrichardson.xo,,17922478489249926,"@jarnadrj2001 noooo YOU are the exception. Honest to God. I have prayed for this miracle for you and Jr for years and you have no idea how HAPPY my heart is seeing this happen to you! Please keep sharing with me, you’re a true light in my life!!!",instagram,,,,4
6b682936-874d-4fe9-920c-e159e09bcd0a,2536,ravnos04,buildapc,jxwf9t4,"I built my first one at the age of 12 in 1998 from old PC parts I found in my Dad’s Air Force dumpster behind the warehouse he worked at. 

It can be done and you can do it.",reddit,,,,5
3c7a1376-1e2b-419d-93bf-6d92c0ff09fc,2017,gbimmer,AskReddit,c881ude,"A buddy in college dated a chick who screamed out, ""I say GODDAMN!"" like a Southern preacher.

We all heard it.",reddit,,,,1
ead5703e-0940-4173-bd76-6e22ab074626,5603,cnmoseby,,17884782250147841,"@jkatarinajk you do realize that Christmas trees are grown for Christmas. Assigned especially for this. Like they ha e ""Christmas tree farmers""....",instagram,,,,0
e994806f-f1c0-4dd4-9850-b9ad0444a655,3019,TTPKMF,blackopscoldwar,ge9n67s,Looks like this is unpopular but I think they had it perfect in BO2. Make them a little better and make them primaries.,reddit,,,,3
d249ffeb-4782-4abd-84a4-c3d9897dd2bd,345,,,id_1256,I know bro! I once ate a gummy bear during the gym and i gained 10 pounds of pure fat!!,youtube,1SW7-xbBAKo,2015-05-08T01:12:22Z,Entertainment,3
77a74c12-3e3e-4adc-9f00-8e13e57fdc69,448,,,id_448,Emma Taylor haha I’m barely on here but I’m trying to be a little more consistent hehe xx,youtube,2q82-0varGc,2020-04-28T12:20:31Z,People & Blogs,5
5554515a-9489-48d2-b603-500b5735618d,1797,TehAlex94,hearthstone,ct46fzl,after removing it make sure you change your bnet password i lost my WoW account to a trojan a couple years back.,reddit,,,,5
4fe2dbef-c7f5-4ba7-b152-359cc144ea90,781,,,id_781,"Absolutely! Some of those high-speed chase shots feel straight out of a Hollywood blockbuster — the screeching tires, split-second decisions, and dramatic crashes keep you glued to the screen. Real-life adrenaline at its peak!",youtube,WhEeNh-o4XE,2025-06-18T03:24:24Z,Entertainment,4
99906810-85c3-4f81-8590-c1145f7a93bd,604,Knowbody2112,dating,hk8v2ue,"Probably. Time for you to spring go action and make sure rather than overthinking every movement and asking the internet about it. Hit her up, G",reddit,,,,5
dea9f715-ffae-44fe-a584-43a97a37e5ab,1645,putashirton123,canadatravel,hsoe3px,"As I understand it, you need to be double vaxxed and have a negative PCR test from with 72 hours of arrival at the border. Or you will be refused entry.",reddit,,,,0
d7d968a7-d369-4aa2-9ba3-a5ebe4bef0e6,4411,MightBeBren,AskReddit,grno180,I know a kid who thinks he got expelled for throwing his backpack... Its definitely not all the nazi racist shit he would do and be homophobic to an openly gay teacher,reddit,,,,1
9b6f4c28-9c91-4469-8378-c4cb4a06ce67,429,,,id_429,"generally this game is getting hate not because people are bad at it, but because this game(in peoples opinions) is not worth $80 and milestone is not listening to the community",youtube,7w3U-gl65_o,2019-02-11T08:33:30Z,Gaming,2
a7d84abd-4acd-40da-adf2-b9ab569b893f,1287,Davinator910,shitposting,i53p2s3,Most of you are so reactionary you can’t help but return to this “only 2 genders” shit😬time and time again,reddit,,,,1
4d443506-71ab-4b5d-91bc-51976d74be0d,87,snippetsofdesign,,17942856610041652,"@nicoletapuiu Thank you so much Nicoleta, I love your gallery as well.  It's been so very nice to meet you here on IG. ❤",instagram,,,,5
16389d80-4828-4199-91f7-b37398b5f658,3895,rebelbynam63,GoneMildPlus,h7ynb7u,"I don't know why as I think you look gorgeous, but I also think you're still wearing too much!  😉",reddit,,,,2
8c5148e0-d380-4ee8-bcab-d4cc3c649e28,441,,,id_2198,"Good point. I like to use a pressure gauge especially when using the air/hydraulic, electric or battery pumps. This way you can tell very quickly if something is not right. If using a hand pump you can feel if there is a problem.
You can imagine, I have done this may times. You do get a fell for it, just like you do swinging on the end of hand tools.",youtube,qBc1Ba-0o9E,2018-11-17T03:37:40Z,Autos & Vehicles,3
c2428c11-2844-4b5d-912f-e8af25270c0d,262,,,id_262,Yes! I was scrolling to see if anyone else knew Nick,youtube,X4YK-DEkvcw,2021-03-23T22:30:28Z,Music,1
dfecd88a-cf93-4747-bfc5-0c2ae98cf856,1267,Domingo-Carmona,amcstock,gsmveu8,Personally I am committed to travel with my family to St Jude Children Hospital headquarters or a subsidiary in Miami Florida to anonymously drop in my donation check there.,reddit,,,,2
4ad04e68-e700-4af8-82e8-efdd54e4c4e7,679,Schmiddo,soccer,k6z9f0p,"Even after the 2nd goal, there is no pressure from Freiburg. They play like they just dont want to get demolished",reddit,,,,4
e08b43c6-5d34-4afd-a28f-e12b336527cd,3029,montel19,Repsneakers,h2wcixz,"Ordered on June 4th QC on the 5th, Tracking info on the 8th and arrived this morning. Feels good to finally get my first pair",reddit,,,,2
4d35bef6-a0d5-48b9-adad-b18987e7f16b,726,,,id_1637,Maybe one of these newly minted NFL draftees. I love Daytonas but that's really a 15k watch in precious metal.,youtube,D2xWAS-ptK8,2025-05-04T19:10:28Z,Entertainment,4
a23c25f5-af4b-4394-9e4f-a0d4db342aab,525,Pelut,croatia,f0oz7tk,"It’s because of football. GNK Dinamo Zagreb is playing against Atalanta on Zagreb’s Maksimir stadium. 

Police is escorting Atalanta’s fans that are arriving from Italy.",reddit,,,,5
11d07e4f-cf5b-47e7-9183-be9e852f30f9,6,,,id_1763,"Remember when I first started youtube and you tried trolling me then ?? Haha 300k followers over 3 platforms, your to late , clearly know me but could never come say it to my face , just know that !! An I’m being paid now aswel haha 👊🏼🦍",youtube,XZ9p-f4Ppr4,2023-08-25T18:12:01Z,People & Blogs,3
6a38930c-7864-4324-8109-44f37e408fd4,414,,,id_1325,"It's a great way to honor Jesus, but it's not a requirement. I do it, however.",youtube,JgtJ-sFzWww,2021-05-26T13:23:11Z,Entertainment,5
f1e92313-dc8c-4e37-829d-defe6563e99a,8270,amanda_bo_,,17849503249246715,@ghplusseven hey! You mean that you're looking for recipe ideas? Or you need knowledge and how to plan what to eat in a meal?,instagram,,,,5
f00699bf-a4da-47d8-9819-f8eb7bf582ac,676,,,id_676,"They use it to show her fragility so we can empathise with a mean character, understanding that she is only as critical of others as she is of herself. I wouldn't go as far as to say they condemn the behaviour as they do not show us the extent of the harm it can cause, instead portraying it as one of the quirks of a neurotic character, although there is some awareness that it is not normal or healthy behaviour.

I'd say Mean Girls is similar in that the film is a general criticism of toxic feminity, and diet culture is part of that, although in mean girls they don't make this clear, you can figure it out from the characters moral downfall and resolution
 Idk if that makes sense.",youtube,7c-3YU-3u8M,2024-03-05T08:32:28Z,People & Blogs,1
f4ed74bb-4b92-4ecb-a441-754f79607152,8560,carleysianjeffery,,1.79959E+16,@christinabaker91  on a side note here.. if you had to have the needles after birth does this mean the kids are the opposite blood type to you? I can’t remember what my girls were but I was Negative and dad positive?,instagram,,,,1
ea36f9a8-e45f-4b33-9c9e-65830481af62,1912,Legitimate-Garlic959,futurerevolution,h1p4tkh,I kinda hope this is a pay one price type of game.  I wouldn’t mind just paying a flat 10$ bucks like some games .,reddit,,,,1
31938868-5769-4242-8da8-a382493ab206,73,,,id_984,"Do you also hold right when you are about to go into the air though? Because if you are then that alone is the reason why you are making it, and both the miniturbo and the hopping actually do not matter (besides helping with muscle memory of course). Proof that speed and momentum do not matter: https://gyazo.com/5410761cbe4836330d46c2e3e750dc78 If you do not hold right, however, could I see your footage of that? I've namely never been able to consistently get it by just hopping alone.",youtube,H1Kb-ODQ3lw,2021-10-27T16:29:39Z,Gaming,3
739b3112-17c0-4228-9310-af8313c71584,328,,,id_328,Rite I was lyke that's a pregnant woman's pizza hahaha 😆🤣😭,youtube,x4yk-LQhn_I,2025-04-15T21:40:20Z,People & Blogs,4
58126587-6142-4316-8447-bac8af4409d3,446,,,id_446,Are you applying the healing anti bacterial lotion at night before bed? This helps quicken the scab process. Washing your face slightly after 7 days if fine.,youtube,2q82-0varGc,2020-09-15T02:23:09Z,People & Blogs,2
7f353420-63e8-4291-bb2d-b5f4d2a6ef87,6237,renovating_pemberton_road,,18068399470011843,@all.things.homely oh I will thanks - that’s exactly my predicament so I’ve cancelled the worktop from wren order but need to find the quartz alternative. Thank you 😊,instagram,,,,3
806c6da8-17eb-4dd3-b3d8-83df9e733c43,358,,,id_1269,"Happy new year to all.

I'm guessing it's so that the video can be used for any day. God bless.",youtube,JgtJ-sFzWww,2025-01-01T15:36:14Z,Entertainment,5
0e1f4974-3fef-4d40-abc4-0f236694f411,1443,GitMadCuzBad,television,e9nzibl,"I miss when political discourse was free of name calling, arguments from authorty, and strawman arguments, which is precisely the kind of cesspool these ""comedians"" preside in.",reddit,,,,0
a6cae246-0df0-4d55-8a9e-766d24c90ba4,1260,nicole781718,,17982146971030614,@jaazzmary I get what you're saying. I don't think those pages need to post our kids. I don't follow them. I follow those that post our kids. Number of followers shouldn't be that important.,instagram,,,,2
3aea37ac-bc63-426b-9e5f-74ee876f8d46,3146,Jon230770,LoveIslandTV,igsyw0s,She’s a wolf in sheep’s clothing. I don’t buy her innocent little girly giggle act. She was a complete and under bitch to Danica,reddit,,,,4
03cba502-a89e-4841-ac44-a5ca5fdeec8e,388,,,id_2145,we also offer shorter cylinders. This tool is not just limited to under bonnet (hood) work.,youtube,qBc1Ba-0o9E,2018-11-20T04:34:35Z,Autos & Vehicles,2
9d93cd8c-6163-4743-a7a7-d259095d0ad6,8129,claudia.jeann,,17967871951067127,@heidisarahroxanne Awh thank you so much for your kind words! And I hope we can both combat the chilling out guilt! I think it will help if people stop glamourising over working like that whole “sleep when you’re dead” 😅!,instagram,,,,2
ee613555-e42b-429d-ab85-c925456cf40c,4097,hyrulian_princess,AskReddit,jskwbpc,I hate flowers but gifts and chocolates are nice but only if the chocolate is plain chocolate with nothing else in it,reddit,,,,2
7d86cc99-5199-43a0-bce7-7f576b5273e9,2920,alunderfullife,,17945788804203544,@enjoy.mamahood what a great idea! I never thought about a wine class - because of this you gave me the idea to get my grandma a wine and painting class gift card,instagram,,,,7
23906dd2-fd35-4752-bb82-843151d1f2ca,4342,CatfreshWilly,TESOfashion,hyvl8k1,"I realize this is a really old post but I'm just starting out and going for a Dr.Doom look myself. Could you let me know what armors you used if you can recall? Thank you. 

Looks amazing btw",reddit,,,,2
c967a471-adfd-4549-b5dc-1f6f85b880b4,911,Gingers_mom88,LPOTL,hs4h6tt,I went to school (Hoover and Mel High) with Ed and his sister. I feel just terrible for all that happened to him. I pray his life has gotten better and all his hopes and dreams have come true.,reddit,,,,2
21710864-d231-4a3c-8257-a6a255fa4276,736,,,id_1647,@@snakeman5250 its been good. My moms started playing zelda now and can use a full controller hahaha,youtube,krq6-1ht_kk,2022-08-20T16:09:18Z,Gaming,4
bdd2a97e-a3ea-4026-9b0a-6b52cc41d368,5091,lindaaabear,,17866998619241416,@raicee_ We met through mutual friends not too long ago! I’ll let my sister you said hi too. What would the feature be regarding?,instagram,,,,2
d5c15286-23ee-4d1f-917d-6dc2c645e5fe,675,,,id_675,"I‘m so sorry to hear that, it is cruel what some people say",youtube,7c-3YU-3u8M,2024-03-06T15:17:11Z,People & Blogs,1
570f45ef-8f9f-484f-9e9c-ef39ce5185dd,575,,,id_575,"@BigPP Johnson Brandon, Trump, Hillary, Bombama, Dubya ... All deserve to wear the orange jumpsuit.",youtube,pN-CD8z-15k,2022-05-25T05:37:50Z,News & Politics,4
c7f5deb2-d7f8-43f3-a460-0b8a1107039b,871,Yimpish,stlouiscitysc,jrfvz3e,"I prefer being underrated tbh, plus if you wanna see teams really underrated look at Real Salt Lake and Austin FC",reddit,,,,7
f969dd19-8018-4fca-87db-a69ba4e62ee6,4517,raysofdavies,tennis,e9zgehk,"Lendl needs to teach Zverev Murray’s second serve return technique of stepping forward as they look up. 

But holy shit he’s got the break. Novak wobbled first, didn’t anticipate that.",reddit,,,,0
d9569d0d-dc8b-487a-a633-67211c51506a,795,,,id_795,I think this is going to get views slowly but steadily trough the years but thats not the main point of this video. I just want to share the message of hydraulic pressing :D,youtube,L7rX-_iQdmY,2016-09-14T04:55:34Z,People & Blogs,5
7c54b9b0-0d85-4e52-8c4f-0bf2b57db69b,460,,,id_2217,It just a swear word like how is that funny new gen?,youtube,iVF0_i-ztqg,2025-05-10T05:19:19Z,Gaming,3
e1bba538-2a79-4274-a371-4b458fc5b3f4,281,,,id_2038,"TLDR: More band or rope stretches, the harder it is to pull, it should be hardest to pull when muscles in your arm are most extended instead it’s hardest to pull when the muscles are the most contracted meaning more energy for less muscle growth",youtube,hZhI-iTdIWg,2025-03-21T22:56:47Z,People & Blogs,2
f8cf7bc2-1501-4a87-b3da-65365e774acb,8855,amandamsheridan,,17900719858113984,@jesssouthern how many minutes do you use it for? @williapcy I don’t use mine either! I need a good tut on this thing!!,instagram,,,,2
2e460405-3814-48a9-be65-a0f565c3b4da,3183,chillmonkey88,AskReddit,iuwabku,Online opinions... people that are out of touch with the outside world and are only connected to people via the internet are mentally deranged.,reddit,,,,2
62809618-e8b3-4ed5-9fc9-40f128a116be,4462,punk_wytch1969,ask,johhrzi,"Fresh cut and strung green beans. 

Any fresh veggies from the garden really. Don't think you'll be able to find them anywhere just yet though.",reddit,,,,1
ddc2f955-9396-4558-9215-4c00bfcc10e1,239,,,id_1150,"Dude, some people just straight up talk fast. It's not that deep.",youtube,Fg7U-BhiZGE,2025-05-28T19:25:19Z,People & Blogs,3
e98c45af-b865-4173-b07d-59ee9231e9e4,382,,,id_2139,"show me some photos, and I'll see what we can do.",youtube,qBc1Ba-0o9E,2018-11-20T06:32:44Z,Autos & Vehicles,2
df49958e-ffba-40f0-8ccc-347842d27068,2876,ShamWowCunt,formula1,hoara3t,Well don't worry mate because I was booing and yelling all sorts of offensive stuff at Hamilton through my television. Also did some rituals. I'm down 2 fingers but it was worth it,reddit,,,,2
60ffd595-4bee-44f0-9254-6cb55c3d021a,668,,,id_1579,+THERHYD1Z3L it is free.  you do not have to buy a damn thing.  i have zero plans on paying for stupid cosmetic stuff.  its a fun free game.   maybe when its out of alpha ill buy something to give the devs some support.. but for now ill hold off and make sure they do not change it to a pay to win game.,youtube,D2dP--g7tXA,2015-08-29T20:03:31Z,Gaming,0
3adf6a22-a0f9-450b-917c-3f7939ad2516,279,,,id_2036,"When Nazi Germany occupied Belgium, why did the people resist?
Why weren't you the terrorists?
Simply because you are the oppressed
Believe me, my friend, I am from Syria, and what Israel is doing against the Syrian people is a crime against humanity. Almost every month, it sends its planes into Syrian territory to bomb airports and residential places.
So what about what they are doing in Palestine?
You should not take your information from the news
Read history and you will know who is right",youtube,Fk5F-u4r-Yk,2023-12-03T19:37:44Z,People & Blogs,1
05d46782-3835-45b3-8c30-422fd3bd8f3e,241,alyssagagarin,,17915660533004650,"@whole30unicorn what a great idea to use Potato! I was thinking almond meal as a binder, but potato would taste better, I think. I definitely want to test it out! Let me know if you test it too!",instagram,,,,3
c5ea6a47-be35-4bee-a6b6-9a8cf67ef369,19,,,id_1776,"And if we don't think like him, we're NOT a good man?",youtube,bzXw-Vs_8mY,2025-05-03T12:41:24Z,Entertainment,2
968d8cf3-bcf4-49df-8317-ff597ba5b289,8032,katieparient,,17893912558247320,"@laydeebug71 honey, you are like one of the last comments, that’s why I replied. I didn’t search for someone to argue with, and I don’t even plan to argue lmao. Sorry, sarcasm doesn’t always translate to Instagram😂 and also, on the Kardashian’s show, Kourtney has made comments about wanting another child but not a half sibling, she wants them full. And he’s made comments about more kids as well. So if she gets pregnant, that’s cool. If not, that’s cool too. It’s their lives. Scott also has always been a partier, even when his children were born. So that doesn’t change for him when he has kids. Lol I’m also sure people don’t date others just to date, they plan to start a life together. If they do, that’s awesome. They both deserve happiness",instagram,,,,7
9f308ca8-d387-4de8-a3a7-8e06adccc5d0,8494,caseymccain,,17866238671333478,"@goooooliaaa I see what you’re saying..but I feel like BlackRock is no different than ANY asset management firm such as Fidelity, Vanguard...they invest in almost ANY and ALL publicly traded companies. At least the CEO, Larry Fink, is a known lifelong democratic supporter",instagram,,,,3
2650e4d5-1418-4eb9-936f-c514bbab3385,6170,deepti.jagtap.52,,17942831806081435,@angelisborges oh my god.... Oh my god.... Oh my god.... A reply from the real Angelis Borges.... Is it real?.. I pinched myself and it is real... Thanx a ton... Your reply is really a booster for me to watch your videos..,instagram,,,,3
09831b27-d146-4461-8e2f-19aa562b81fb,2002,Herossaumure,KakosIndustries,cua05ol,"Thanks! If things break, please tell me bc most of this stuff isn't tested properly, so things can and will go wrong. (hopefully not though)",reddit,,,,4
b732dc5d-2672-45f3-86dc-a00ae1c43787,3227,HunterCovaMusic,OneyPlays,ju9v6bs,"I mean, dude has mentioned a couple times that he’s depressed and overtired. But let’s not forget that he’s still from the south so he could be a water person",reddit,,,,2
65da7159-da3b-494d-bbef-0d6e32119793,1803,Lipredstick,SuicideWatch,dimf7c8,"Same.

...I mean I don't really have anything supportive to say because I'm in the same situation but , at least you're not alone I guess?",reddit,,,,7
968e5909-2396-412f-ab31-2dbb3b92a338,25,,,id_936,"@Alfred Wedmore I see what you mean. I took ""horizontal"" to mean lengthwise.",youtube,X7J3-4mC6ws,2022-01-30T16:47:06Z,Autos & Vehicles,3
959d2431-b865-4258-9413-889fc2743005,4292,sophie.jaffe,,17887342783213115,@racheldoxzenyoga omg yes i drafted them last week they are going live any day now on my blog!!!! You read my mind x,instagram,,,,3
2f5f1fbe-e9d6-48c9-87d5-3cd32cf44d59,320,,,id_1231,Same here sober from alcohol and partying. Since 2011. Turns my stomach. Although I can now watch others indulge without being affected(or tempted) these days. That took about 7+ years of sobriety from alcohol and substance abuse.,youtube,Fg7U-BhiZGE,2025-05-22T12:14:34Z,People & Blogs,5
