new_id,row_id,author,subreddit,id,text,dataset,video_id,reply_date,category,valid_annotations
f6c0d93a-90b0-4f3c-8ffe-01d35a436b5d,842,,,id_1753,"Dumb, evil, corrupt, and entitled. A recipe for GOP prison sentence.",youtube,6awR-bmHmeQ,2020-05-25T06:03:56Z,News & Politics,3
7b4a1d2a-61c4-40dd-add8-a2d504e75284,3655,Bass_666,basspedals,jyldx09,"Nice, my first pedal back in the day was that Boss bass chorus. Don’t remember what I did with it. Must have traded it or something.",reddit,,,,2
7461f20a-6917-4897-bd2d-2c6adf5361bb,1862,EuRenideo,gwent,dht0b3b,"Open beta is gonna have a lot of rebalancing patches I'd assume. The overall design is great, but there are so many conditional swings that some of them are going to be out of whack, no matter what.",reddit,,,,4
7792bb12-cc9a-4a54-a887-8088d97b9372,828,ndncreek,scotus,jz60rud,"Then the question is can States now Criminally Charge those folks in Alabama for Laws interfering with Interstate Commerce.
Considering it is a Service being provided for monetary gain.",reddit,,,,0
f77d5253-3770-4cfe-af13-3f5f6d287e28,516,,,id_516,I think what you need is a financial  advisor assigned by a brokerage company that will trade for you and handle your capital professionally and give you weekly returns of investment without any extra fees attached,youtube,zRFBfT-4y08,2025-01-29T13:02:35Z,People & Blogs,4
fa42a2d7-8841-41dd-ace5-1213cc80950b,464,,,id_2221,I'm sooo sorry but realrosa must be crying rn bc all of u beat her world record😅😅😅,youtube,nHdx-ZqAotE,2025-06-09T09:40:45Z,Gaming,0
e3f64332-bb55-4574-a8ac-2402928a6d9f,34,A_Hatless_Casual,ageofsigmar,k22ppk0,It wont be delayed due to a new codex's release. World Eaters and Guard players only had a few months before the launch of 10th edition 40k.,reddit,,,,0
ebe65363-98d0-4992-8542-2be931cfecf6,294,,,id_294,"omg I'm so sorry for your loss, this comment saddened me so much",youtube,X4YK-DEkvcw,2016-06-10T03:42:00Z,Music,2
16de6450-e0c3-4fe1-a88e-6f9a3f83bea3,1216,Acayukes,Finland,jppas2p,"Becasue right-wing populist governement came to the power. It happened partly because of the war, partly because of the covid.",reddit,,,,3
bf030272-d403-4bd9-8a93-56e1eb63b803,7940,thejourneyjunkie,,18008020612109577,"@fra_symi you are definitely living your life and following your gut! It’s rare these days, thanks for leading the way 💫",instagram,,,,2
109f2160-605e-42ee-afb8-4950e3c4e3cc,50,,,id_1807,Psoriasis is different from cirrhosis. I’m just pointing out the difference. Rip to your father.,youtube,Fg7U-BhiZGE,2025-05-31T02:26:40Z,People & Blogs,4
cd7b8e04-1e56-4beb-b433-41ee001f0746,6415,themeparkhipster,,17967155437201659,"@lovelystep72 You’re welcome!!!! I’m excited for you all to be visiting Disney. If you have any questions, don’t hesitate to reach out 😁",instagram,,,,1
c38d0262-0d57-4e9d-9a55-22ea852fbf5e,450,,,id_1361,"Sir this video is used as a ""general"" rosary prayer a prayer to use any time no matter what day. You can find other videos explicitly for that day, god bless",youtube,JgtJ-sFzWww,2021-01-11T06:05:45Z,Entertainment,3
be560df8-266d-47c6-9b3f-dcdb95b2dbd2,3181,biffbobfred,Buttcoin,j8s7tty,"Bitcoin is fiat. There is no new tech in bitcoin, the innovation was paying the Bitcoin miners in Bitcoin, which has value “by fiat” because the Satoshis told you so.",reddit,,,,0
b94e390e-59e5-4c98-ab31-ba6eb3e13fea,9051,mgrec77,,17873020771147127,"@fixthisbuildthat the same way you do the side mount. It's easy, once you use them once you'll never use side mounts again.  Cleaner look and a lot more adjustments also. Let me know what you think when you give thed a try.  I use the blumotion or accuride. Both are good.",instagram,,,,2
c418b0a2-1f0e-49ba-b0e0-7b3367a1acc3,459,,,id_1370,"Haha when I was like 7 or 8, I used to remember there was this kids' place called Chuck-ee Cheese and I remember how awful one game was. I think it was called Simon Says and it was a Tic-Tac-Toe game. Terrible payout, but I had fun with my family at the time. That was soooo long ago. Now I see these 5 year olds spinning the Big Bass Wheel where I'm at and landing the 1000 ticket bonus and freaking out over it like they went over the moon. Haha, good times! Now if only I could apply these skills down by the casino. Fat chance! Lol! 🤣🤣 Thanks for dropping by! ✌️✌️",youtube,YusvIv-6Q24,2023-06-24T21:10:33Z,Entertainment,3
d17e3add-7ac8-40c6-af77-3565a069b667,89,,,id_1846,"Nice one Marcus, keep it up. YES, alcohol has destroyed so many lives whether taking alcohol or having suffered at the hands of the alcoholic, it can be truly an evil drink. There are plenty of other ways to enjoy life, alcohol is definitely not one of them. Wishing you all the very best of adventures, successes, love & luck Marcus, go you, proud of you! 🥰",youtube,Fg7U-BhiZGE,2025-05-27T18:51:23Z,People & Blogs,2
4610d349-d2cc-4a55-8fba-505110d0ae8a,4022,wanderrlex,,17882587783238979,@jessebleichh not to mention we have MUCH bigger threats to our country than people coming here seeking a better life. If you can't understand that then there isn't much hope for a conversation about this.,instagram,,,,4
0b75227e-4240-4d7c-ac4c-1d28a62daa82,105,,,id_1016,"You can go for it, but I would not be surprised if they find a way to reject your application because you are too useful as a rep.",youtube,R821Vy-GQHs,2025-03-06T22:30:35Z,Entertainment,1
f74c802b-a25d-4c00-bbfa-ab64105da990,3496,tplgigo,bayarea,i61y4pn,Above ground station to an underground one with a big curve to get there. The train has to slow down to make the curve.,reddit,,,,1
c99fbfd4-a8b4-4652-8665-37644f18c39f,737,,,id_1648,"Not to be confused with the famous predecessor to Super Mario Bros. 2, Doki Doki Literature Club.",youtube,krq6-1ht_kk,2022-06-23T07:05:18Z,Gaming,1
6e21172f-d60f-4d66-8215-d85f20fbbec3,2028,JungleSumTimes,HomeImprovement,h917ifw,"Looks like an overlay of previous rat slab. See what the engineer says, but I'd not worry about the crack as much as the acceleration of rust at the pole base by encapsulation",reddit,,,,7
718b5d62-e3de-4864-a4f9-b8b1deb4d4cc,1380,mario0x,hockey,gy9vwkm,Once again bruins about to be fucked by Lauzon more than once in a game this kid needs to be buried in the minors more control your fucking temper you scrub,reddit,,,,3
5987a00f-2393-467a-b4aa-317731da9ed2,1516,Calitude,reddit.com,c1ivwqd,What do you mean 'fixed'?  One pic has sky in it and the other has a mass-ton of buildings.  How about you aim your tripod 90* next time?,reddit,,,,3
265b2557-f3d3-4587-8259-3a67d7560a5f,517,RepresentativeBig258,AskReddit,hrcn0ex,My aunt didn’t care to find out which of my grandmother’s husbands were her father until my grandmother died and the unlikely grandfathers fortune was available through my grandmother’s death.,reddit,,,,3
9abbf663-f26a-46f0-b68b-26304a67add8,234,,,id_234,"He *is* Mormon, and they're boring like that, so it checks out.",youtube,X4YK-DEkvcw,2022-09-23T04:24:55Z,Music,3
be3c27f8-e587-450c-be81-c7e6e2cec608,6476,craigycavanagh,,17952275575117716,"@kristynadaly1986 ahhh babe what beautiful words. Boss year end to come for us, can I see you next Wednesday please? I'll come straight from work. Love you too kiddo Pavarotti xxxxxxxxxxx",instagram,,,,3
3acb4863-cc03-43f0-870d-8dbaf0e321b3,483,,,id_1394,"I agree 100%. People would cross oceans and continents to meet a woman like her. The body language is very positive and, to be honest, quite clear with IOIs. Kazuma: you need to arrange another meeting with this young lady.",youtube,SQxu_-l_p2c,2024-01-01T19:10:09Z,Entertainment,5
06aaac47-6dbb-431f-a397-d3d458a6ecaa,8346,fifilite,,17978689909107099,@ruccisalonspa lmao who cares how you idiots feel. Imagine typing this paragraph on his page. You’re the definition of PATHETIC,instagram,,,,3
5b75997d-0eec-46e3-a5ef-10bdda90e938,9101,willowandthelittlegypsies,,17979171280060013,@rockymtnmomma3 absolutely. We definitely need to learn to not sweat the small stuff as parents. It’s so hard because it changes you. You have other human beings to consider. But life’s too short. And my kids love the carefree me more than the person that stresses about everything and anything. It’s  a balancing game 🤷🏻‍♀️,instagram,,,,3
5ee6bc4a-8098-4936-bef5-4930306ac4a0,13,,,id_1770,"even though I agree with this for legendary armor and stuff like this, for this legendary or generation 3s this is not the case , as it only really requieres a bit of farming and map completion and once you are done you can do it over and over to make gold forever",youtube,0iZ5-evl_m0,2024-12-17T00:24:03Z,Gaming,3
c319a29b-31a1-4ec9-9612-abcb0dbf3151,1804,vxnessa_0901,unpopularopinion,f25hk7s,Guys think using face masks &amp; good hygiene is gay &amp; ridicule other men for it so i'm not surprised. Men hate each other yet claim women do,reddit,,,,3
c3ab2b89-824c-4c74-92f8-f90268296a2a,2141,three60fit,,17957550154080792,"@nicolettehermiz Yes, yes, and yes! Love to hear you finding the Lord in the midst of all this @gmflorio He always provides beauty for ashes.",instagram,,,,4
d3ff91b2-f704-4c28-b333-8cb1c325fc95,4079,_queenofthering,,17868856909216178,@makeartdamnit LMAO!!! This is got me so much more excited to watch the episode! Your face in between the two best dicks in the business! 😂,instagram,,,,3
fd0741e3-8673-4169-a886-d6db49d74d8f,2813,jmorgan1413,AskReddit,jnomnno,"Silver Linings Playbook. 

I think it’s because I read the book first and could not get over how they absolutely destroyed it.",reddit,,,,2
0dc6c761-a511-4cf4-bfa7-79ea52b6130b,836,,,id_1747,Hi Atom no because binder dries within a couple minutes. the surfaces needs to stay wet alowing for flake to stick and lay down flat,youtube,D6zX-hc4NZ8,2021-12-01T01:51:20Z,Autos & Vehicles,4
e1861131-b3be-4aef-9ac5-fa9a4033b349,2489,Hamlin_Bones,funkopop,fh8e2va,"Man, this better be shared, otherwise I may have to resort to begging a fellow redditor/collector to pick me up one.",reddit,,,,5
aeae8179-268c-472e-9ef2-7845d55f4c7c,957,Genderfluid_Cookies,AskReddit,iaal3ws,Not anything really. I’m too tired to most of the time and end up falling asleep in it. I would rather spend a few extra minutes in bed than have to wake up a few minutes earlier to shower,reddit,,,,2
c40fb145-d3be-4ca6-8c23-8b44a7fb894e,300,,,id_300,+Shane Hennenhoefer happily enough in real life the actress is neither poor or single and is dating a rich guy 20 years older than her,youtube,X4YK-DEkvcw,2016-01-31T16:34:39Z,Music,5
a1f69970-0a15-4261-b841-6c247e090a52,215,,,id_1126,"I just checked it out, I truly loved your take on it!! And thank you so much! 💕",youtube,9n42-rH1YmQ,2020-12-30T21:30:52Z,Music,3
a8348902-d5f4-4aba-9d08-b46c7d96a8a7,1133,nyuszicat,,18014418229185422,"@mrgeorgeclarke Absolutely, so why doesn’t it happen? You see self-builds all over Europe which is great because all the houses are individual!",instagram,,,,1
e5b12311-10a0-45c1-8cd5-5087a14c0184,5425,dora_c_degray,,18028873327102045,@the_mama_manual - personally I'm a morning person so by time mine used to sleep (cause now they sleep wayyy after I do) I used to use that time to relax especially since I was/am a working mum. But yes that works if you're the evening type 😊,instagram,,,,5
a91e41a7-c209-4b15-a474-0f847ae40f6b,1569,thenataliejoy,,17946055054213753,"Thank you so much Ashleigh. I really appreciate that, I know everything will level out but it’s easy for it to feel like too much sometimes. 💕",instagram,,,,3
e7990217-14e6-421b-8848-6e49b72fa887,2893,BoneOfProwl,Hamilton,hu4ej8g,Also try Lex is a queer centered app based around meeting others! It's no photos and kind works like posting old new paper personal ads q,reddit,,,,1
9ed2fadb-6095-483e-8317-8505441613cb,557,,,id_557,"But here’s the thing…. she didn’t even know because if she did, then she wouldn’t use that name.(and yes, I know there are malicious people that would do that but not everyone is like that.)",youtube,MlLKVG-y95k,2024-07-30T01:20:20Z,Entertainment,1
dacbec05-3453-4106-a5a4-0035368235de,2673,tom4dictator13,Superstonk,hp5uvf2,"This is good, there was another post about January 28th. I think it's great to revisit the days of max fuckery",reddit,,,,3
b0529112-a709-4cf9-b4fa-5a985650dece,4115,the.la.way,,17961162316059564,@scvlinci I’m so glad to hear and so sure you will fall in love too with @alternahaircare 💜 Let me know how you get on.,instagram,,,,3
a70e39cb-aa65-4de1-8d5c-f30026e0990a,8972,brogan.georgiou,,17981381560012565,"@life_inside_number_eighteen oh I bet they’re shattered! Yes you’re so right, I’m certain that he needs the nap I just don’t want him to have one 🙈😆💙 xx",instagram,,,,1
157c2385-8d51-4f75-982c-36c707cc037a,657,,,id_657,"ts bs ik , I am very skinny (not underweight) and as an Indian my body is nowhere near the standard but ppl dont care they bodyshame me calling me skinny flat , that i can fly away in the wind.. bullshit like u can be replaced as a skeleton. But whenever i TALK about it ppl say'' how can u be bullied'?Ur skinny u cant be bullied''
This is what they say , and im insecure asf to even stand infront of others bcz my arms and legs r so thin I feel like they are staring at me talking about how bad I look.
And when I talked about it to ppl they said u look fine , and u look good and that they want to have my body ..but those same ppl also bully me for my body. I just dont understand why they bully me if they want my body its as if they are jealous but i dont get it .. And ppl only take bodyshaming as fat ppl thing and never say skinny bodyshaming exists.",youtube,7c-3YU-3u8M,2024-07-20T18:41:03Z,People & Blogs,2
ee5862b6-2dcc-4b62-8fde-c44749b436b3,2712,FrankPapageorgio,NintendoSwitch,j218ulw,"I’d love it to just be named Nintendo Switch 2

It’s the most successful console they’ve every made. Please don’t innovate and confuse people.",reddit,,,,0
faaa3ae4-aa45-4622-86b0-962b3d49853e,2486,Lil-Yan42,teenagers,fcw8bcj,"I don’t like her. I mean she criticizes people for not doing something, but she has no solutions to the problems she points out.",reddit,,,,2
9f47edeb-b5cc-4d50-9e44-848f4e7858ad,746,,,id_746,"They NABJ said she couldn’t do a zoom call, she asked",youtube,i09U-eoq-bk,2024-08-01T23:22:01Z,Sports,4
4e99ac23-77eb-4386-a281-ec8c68e8b1db,708,,,id_1619,"Thank you so much! You can refer to this tiktok video where I show the measurements: 

https://www.tiktok.com/@downtowntailoring/video/6873307320894393601?lang=en",youtube,xg0F-bWLmMk,2021-02-24T04:06:02Z,Howto & Style,4
92a28a09-a7b8-4916-b665-5a3d593a17eb,9235,lauraashleyuk,,17920463920146180,"Thanks for sharing your #LauraAshley find. We’d love to feature your photo on the Laura Ashley site, emails and social media pages. Please reply #YESLauraAshley if we can use it. You can find our terms and conditions here: http://www.lauraashley.com/uk/terms-and-conditions/page/terms",instagram,,,,3
230a26d0-82be-49f3-ba09-f7c1d23b2c4e,225,,,id_1982,Was op last year too just cost a ton in speed with ball,youtube,1w0K-wMyxL8,2023-09-03T19:53:09Z,Gaming,3
6ff6a6ec-e6f8-4490-a03d-3469fe67d462,9498,lauriegteusaw,,17903861716269502,@vickibonner Go to the Sugarplum main blog page and click on Shop My Instagram. You should see the photo there.,instagram,,,,0
2a91338f-1f82-46b9-907b-1051e1892132,3478,The-Ravioli-Mage,TwoBestFriendsPlay,geb2u3g,I wonder if it’s going to be difficult for him looking back on roles when he was much more feminine.,reddit,,,,5
07a4a437-b538-476e-b1b0-957c5665c763,408,everyonceinastyle,,18034533526035640,"@hlcstudiosartwork there’s nothing quite like it right?? Just gives you a whole new perspective on life, especially when you see how resilient and positive these kids and families are 💗💗💗",instagram,,,,2
23ec3bcf-16b9-4fab-bc73-389031fa308a,1322,SpicyMealOutside,FortNiteBR,e0xyqm1,"I didn't read this deeply but there was a leak here awhile ago that it would be ancient civilization themed. So far, the leak has been correct based on the other leaks it mentioned.  (shrugs)",reddit,,,,1
34d7ea05-1eb6-4504-9cd9-e34a06061029,422,Larielia,zelda,ip2byv4,"I'd be fine with another one, maybe a proper prequel. Age of Calamity was fun, but it is really a spinoff.",reddit,,,,4
5b109327-6b1a-4489-9d8f-e2a16bd58ec5,2649,photoginmamaof2,,17986180573082252,"@kristinbelville i was going to say the same. I’m 5’4” and even on my tippy tippy toes there was a good 8” puddled on the floor. 😔 I’m afraid I’m going to have to send it back. But the girls at Vici were SO awesome and got it to me literally next day so that I could have it for a Christmas party so I was really trying to keep it but like you said, because of material, they want a lot to hem.",instagram,,,,2
da62ca85-d9d8-4248-9e06-89b414cf112a,2646,majesticpark,WTF,ceb0maw,"I rather think this is for you to extinguish your smoking material in if you come into this area, so you don't throw it onto the ground or in the plant bed.",reddit,,,,3
0b1fb664-471d-493a-b6fc-4efe00988d0d,1165,yorkspirate,childfree,jc994kt,Everytime I see a post like this it reinforces my distain for OLD - why else would my profile say something if it’s not to tell people who I am/what I want ?!,reddit,,,,2
25ef18e5-ee0e-4d85-90f5-058038af31c1,4,,,id_1761,"Well he didn’t do 33 did he you melt, he done 17 an he’ll be right back in there with the attitude he has, why’re you so bothered, go away lad 😂",youtube,XZ9p-f4Ppr4,2023-09-05T02:38:03Z,People & Blogs,3
41207e07-5960-4478-b192-5b45d7b266f1,4481,TheShippsn,DestinyTheGame,e9o39x5,"Yes it is. There's plenty of content without touching pvp. 

I personally only play pvp because I enjoy it more than pve and try to improve against other players. The loot you get from it isn't as important.",reddit,,,,5
5df74723-e6ae-4ca4-a5ac-ab57f33b1b31,1961,livid_vizard,Boise,gjzh8o2,"Beautiful shots! I can’t fathom being able to capture a bird in flight in frame, let alone in focus. Applause!",reddit,,,,1
26e7188e-5f1c-4ec0-8c91-eaf4d7bfa609,403,,,id_1314,So proud of you. God continue to bless and comfort you.,youtube,JgtJ-sFzWww,2024-05-27T09:28:44Z,Entertainment,5
3cb44f5b-fcb1-4367-bbad-8a1900148f7a,2477,artisnotsubjective,IdiotsInCars,igd8a0h,"Cringe to read everyone trying so hard to be a comedian in the comments and fail, yet get thousands of upvotes.",reddit,,,,5
e255993d-b17e-4034-bbdb-3b995d3e5918,2771,jennyeclark,,17940603640227456,@jonelleyoga I should be yes and then going to Sri Lanka 9th April need to get some tips from you! 🙏❤️,instagram,,,,0
65e97fdf-1e43-45ae-a3ff-00cd630efc74,140,Saniiro,Maplestory,eqjueqk,If my weapon got destroyed during Star Force enhancement how many stars do i start from again? Planning to try attempt 22*,reddit,,,,1
b269e2e7-e0a9-403f-b6a5-0a86cbda2d6f,270,,,id_2027,"lol You are the one who doesn't know history, before 1948, there were the British, and before them the Ottomans.. Palestine never existed.",youtube,Fk5F-u4r-Yk,2024-03-03T09:45:04Z,People & Blogs,1
062c336b-644c-4b69-ae7b-fcc7bf4041e9,1993,preppybohemianathome,,17945945473013566,@thefitgnome I'm a fan of accent walls behind the bed. you could do a mural or stencil or peel & stick wallpaper. it'll make a huge impact in the room. hope that helps!,instagram,,,,3
55bc8d4a-2f9a-4c2c-8220-b8144cb59c03,523,,,id_1434,"He is brazilian, here red onion is called ""cebola roxa"" = purple onion, this might be the reason.",youtube,Ryh1-GBUT_E,2020-05-27T14:58:19Z,Entertainment,3
56697747-91f3-4b5c-846c-7ad8f0df521e,731,,,id_1642,They sell to each other because they don’t have to pay any taxes when selling to other dealers. These other dealers that vookum and Moses sell to then sell to the general public at a higher price to accommodate tax and it not being at wholesale.  These are quick and easy flips,youtube,D2xWAS-ptK8,2025-04-21T21:57:44Z,Entertainment,2
4c6f1502-99f2-4c93-bbb8-4b1dbbbb0805,4807,veganpumpkins,,17953570750053513,"@paris_on_the_cake exactly! And that’s so great - veganism will open your eyes to so many reasons once you take the first steps, weather it’s for health or the animals! And yes comfort food is a must because you can’t have a healthy body if you have an unhealthy mind! ☺️🙌🏼💫",instagram,,,,4
f052e783-6f44-4020-8fe3-8f082aab5e6e,2280,SgtSabitch,texts,k64789s,"Either secret lesbian crush, or known lesbian, or jealous as F friend who wants her new dude.

No matter what - she needs to go.",reddit,,,,5
2a38bcb4-59f2-4dca-a26d-bf46e1ccaff3,1583,motherofbabies,,17903518363037113,"@mmmorganne you get me, Morganne! Yes, that would be wonderful!! ☕️ Good company,  good food and drinks, the fireplace going, while the kids play sounds like a great fall get together. 🍂🍁",instagram,,,,3
2224909f-a347-4216-9d89-475a4f8e1f98,832,,,id_1743,"though, like Undertale, there's a bit mre TO that...also like FNAF in a way.",youtube,krq6-1ht_kk,2018-02-07T17:48:03Z,Gaming,0
90abe2ec-23a7-4c84-b900-7a478c0adcc5,343,,,id_343,"It is not PERSONAL information in the PUBLIC sector that YOU provided...
How much dirt from your past (and present) do you want me to tell you about yourself?",youtube,JgncST-h55U,2024-07-18T16:07:39Z,People & Blogs,5
caf602b0-2302-4afc-9725-b21d99851405,651,,,id_651,"yes I have heard of many fat old people. Are you living under a rock? 

And we know being obese isn't healthy. But all the people being referred to here are NOT fat. Oprah looked fit. Kourtney just had a baby and it's absolutely normal to have a belly after giving birth. What do you expect? Her to have abs?? And you're here defending this. His comment was absolutely disgusting. Mature up",youtube,7c-3YU-3u8M,2024-04-06T11:20:57Z,People & Blogs,8
0c63fb9d-9c54-4a06-a9cc-5bc086c8bb43,3813,adon732,DogShowerThoughts,dt6rkas,"Hooman and doggos can't get sick from each other, donut wory. Hooman will be OK eventually. Keep guarding, cates mite try to take advantage of ur hooman bein sick!",reddit,,,,4
cf60c4d8-3acc-4618-a678-844f51dd36a3,8366,katie_baki,,18006649177130238,"@tammyfowlerfoster omg Tammy, I love this story and I’m really glad you shared bc it makes me feel so much better. I’m trying not freak out lol and I know it’ll all work out too ❤️",instagram,,,,1
783a87ea-44bf-453b-94cd-83050f26bba3,1646,NegativeKarma4Me2013,newworldgame,hpjru11,"LMAO, try them first. GA needed nerfing, these don't. GA is still strong you just need to actually learn to play now.",reddit,,,,1
006a252f-118d-433c-b55d-866cf0520b8c,2624,mclohessy99,SquaredCircle,g8c7rs8,Its a shitty situation that guys have to spend christmas away from home if they are to make Wrestle Kingdom,reddit,,,,2
02541e52-7829-405b-9341-668c96480402,152,,,id_1909,"It's insane how far Blender's come, now it's even moving into professional use and we even have a full feature movie made with it. Just heartwarming to see an open source tool like Blender getting mass industry recognition.",youtube,aqz-KE-bpKQ,2021-11-07T21:01:47Z,Film & Animation,2
01986d45-2e0c-477b-98b5-b89fb1dd2029,5442,oliviamccormick,,17954497702135692,@gretastravels I have a GoPro and hahahaha tried the balancing thing myself 😂 but thanks so much for the tips it’s so useful! Now I just need to book another beach getaway 😉 will pin your post to read then!,instagram,,,,2
8d8cd176-3836-4975-a2ff-4bfb4c97772b,435,,,id_2192,There are a lot of mechanics who would disagree with you on this one.,youtube,qBc1Ba-0o9E,2018-11-17T19:40:53Z,Autos & Vehicles,2
e2c4c2a4-a524-478d-bd70-7ca03c2eaa04,119,,,id_1030,"And the more convincing her case is to HR. They might not care about her but if they think Sue hurting the business, it might be bye bye for her.",youtube,R821Vy-GQHs,2024-02-21T17:40:45Z,Entertainment,5
9b89f9b5-ea62-47a2-ba30-3129b0b8077f,5582,shaiwenley,,17938885864074666,@violetmartha47 oh no thank you so SO much for reconsidering your eating habits! It takes so much courage to admit to those things you just said and I applaud you for it. The animals would thank you if they could 💖💖💖💖,instagram,,,,4
0404ef1d-d00c-439e-a4d6-7a1fe006527e,213,,,id_1124,"I wish I could’ve met him too. He was a really great person. I really wish you the best, stay strong and stay positive❤️",youtube,F6ne-FU6znc,2023-02-13T08:23:50Z,Music,2
9bf60461-025a-4f13-b6a2-a9df31272327,2052,jessicasjungle,,17939284108228084,"@urbansplants OK, that’s really good to know, thank you! I might give it a little extra light with a grow light :-)",instagram,,,,1
a8e3570f-7470-422a-9b92-6be2f883780e,544,,,id_544,"Because if they commented in their native language you wouldn't understand them at all. Also, I'm not quite sure about your own grammar.",youtube,a6iW-8xPw3k,2014-03-15T19:15:32Z,Comedy,2
2d0ab5a6-733c-4280-b774-c9a3cff29857,385,PercyBluntz,CHIBears,j1iscwt,That’s why Velus is gonna be here for a while. He’s had a rough year but he’s got some serious talent,reddit,,,,5
659fd4bc-3ca7-4bf3-97d5-fc23fdc3ead4,3756,witandfolly,,17920080781052231,"@ana_svjetlicic aww Ana, thank you so much for sharing!! Those are all such beautiful things to remind ourselves of ❤️ I couldn’t agree more with you!! 😘😘✨",instagram,,,,0
969d919c-947d-4acd-985f-029967ddcd14,5987,thisisfarrah,,18016807516027095,@taraevelync omgoodness girl! You are the luckiest! I can’t wait to be able to use them with my future babies!,instagram,,,,1
576cc684-e1f7-450d-9a71-025b7ddc9069,712,,,id_1623,I’m so glad to hear that!! Thank you for letting me know :)),youtube,xg0F-bWLmMk,2021-02-11T20:47:54Z,Howto & Style,3
27e9e3b2-2227-4be9-9e9f-1b8337a250a7,554,,,id_554,"Given that she didn't know the name of the still birth, she didn't name her baby after it.

If you shouldn't use the same name as a dead person, all names will have to be made up and no one can ever use ""David"" or ""Mary"" again.",youtube,MlLKVG-y95k,2024-07-15T01:23:44Z,Entertainment,8
