new_id,row_id,author,subreddit,id,text,dataset,video_id,reply_date,category,valid_annotations
e0800a75-cbbb-44af-b56d-987c0732eacc,2645,emilysarmo,,17869201792273489,@yosoycandle Thank you so much.  Yes !!! I have a pair of light colored booties I could see with this. 🧡🧡,instagram,,,,6
ba7141b4-8b46-4d10-ad4c-8b16acd0e446,4424,duvetkemde,WTF,cyh84b9,"And still i want to one day get a shot at trying to reach the summit. Scary pictures, no doubt.",reddit,,,,1
0388f85a-c77f-4761-b20a-d57c3a60d50d,433,,,id_1344,"Child of God as I was praying. God ministered to me in a revelation as I view your profile, to see things around you, I saw blessings but spiritual attacks holding onto them, in prayers, i saw a woman in the realm of the spirit monitoring and plotting delay  in your life, with an evil mirror, with a motive to destroy. But as I speak to you now her time is up, for God immediate intervention in your life, Render a seed offering with Anything you can afford or give to the motherless, sow it to ( OJEABULU MOTHERLESS FOUNDATION ) in Edo state nigeria before 2DAYS with faith, as I Rise my hands towards heaven and pray for you they shall serve as point of contact wherever you are, you will receive double portion of grace to excel and total restoration of breakthrough in your life and in the life of your family.  Ask for their acct details and help, call the MD in charge of the orphanage to get their details on 
WhatsApp or call them now on 

+2349046099547

Tell him I sent you. For it is not by might nor by  power but of the spirit saith the lord ( i4:6). You shall testify to the Glory of God in your life. God bless you..",youtube,JgtJ-sFzWww,2021-02-08T07:27:10Z,Entertainment,3
d840a74a-05e7-4455-bc66-9d9ea955ce23,1279,C-o-f-f-e-e,AskReddit,cwqthzw,"Zero, but whatever. I mean you can't really prepare people to deal with adulthood completely, money, okay, maths, okay, but dealing with actual managing of being an adult. 

Its just something you get better at faking.",reddit,,,,5
1fde5f07-c8a8-44a6-9ad8-03727cd6c8b5,2755,Archaic_Avidity,SourceFed,ezg3nh9,"I'm sure it was just scheduling, they've each done a couple table talks with one another over the years. Reina had SPF until it ended, and Bree had Nuclear Family until that died too",reddit,,,,2
95ea17de-c44b-42f6-94db-980f62879e86,617,,,id_1528,All these guys at the table would would KEEP u felted,youtube,CrBpfq-Hb7Y,2024-04-24T15:30:22Z,Gaming,3
dced8c78-20fd-4bbe-976f-068cfe54fe58,224,,,id_1135,lmao in hm2 there's a level in the subways and the soundtrack is called run,youtube,Na2vMr-Yxhs,2023-10-17T21:05:00Z,Music,6
bac988ba-915d-4121-87bc-aabb296eeedb,1159,angeliquemiles,,17906880979260392,@sushigirl_atx @enzymedica has a product called Gluten Ease which may work for you if gluten is your only issue. The Digest Gold should do the trick also though. I carry it with me everywhere.,instagram,,,,7
5be11f5f-5886-4eff-9c3c-707640ec2279,3613,five_make_a_home,,17843692288367345,"@samanthavandepoll oh thank you 🧡 you’re so kind 🧡 it’s amazing how many backdrops you spot - but usually I miss the opportunity as I don’t have the Instagram husband/tripod/haven’t had a shower/screaming kids, etc 😂😂",instagram,,,,2
0c1eed8f-60fb-4d9b-bb57-47f7c5a4fad1,159,,,id_1916,The reason it wouldn’t play again is because it couldn’t comprehend the colossal size of big chungus,youtube,aqz-KE-bpKQ,2020-05-16T15:07:35Z,Film & Animation,5
70c95c0e-9b28-4d0c-be46-52f5ceb4e5d3,2496,Van_Inhale,science,ihqcnr4,I ain't a religious loon but it does seem we are becoming more self indulgent and selfish as time goes on,reddit,,,,7
44377e4c-cd4b-4d39-8a98-c933b60eb619,5658,nycxclothes,,17986778578036649,@fleurandrea I love what you said about focusing on what only makes me happy. Zeroing in on the essentials ❤️,instagram,,,,5
14ea34bf-b4ab-47f0-992a-857b835b00e8,7476,travel_mermaid,,18003515200141010,"@alexinwanderland 😁 I used to recite lessons to myself back in the day so I wouldn't forget anything! You'll be fine without the notes, just improvise if you forget what sequence you planned. No-one will notice anyway. Usually the best lessons are when you deviate from the plan and go with the flow once you feel what works. Trust your instincts and teach the yoga that you like to do. I hope it gets easier soon Alex! 😎 You've got this!",instagram,,,,3
