author,subreddit,id,hash,body,parent_id,link_id,length
KnownBridge5685,canada,ke2raqb,-3448180907488020000,Here we go. Another election wedge issue that liberal is propping up. This is trudeaus version of DACA,t3_18m92l8,t3_18m92l8,18
to11,arizona,g01wd5l,4786848047217721000,I moved here from CA and.... it's way too hot! :),t3_i22sjl,t3_i22sjl,11
gujsehambi,movies,k2r818x,-8262967982834420000,Dark Crystal: Age of Resistance tv show. It was a great show with great practical effects and puppetry and a very emotional season finale. It won an Emmy just one day before it was canned by Netflix!!,t3_16v8doo,t3_16v8doo,37
FreebaseMcGee,lakers,e2bh7yq,-3731317854182738000,"Eh, my wife wakes up at 4:30am to work out. 

Get your game up Bron! 

/s",t3_8yjv7r,t3_8yjv7r,16
Brewkahontas,streetwear,db9wkfm,-46310355203496000,"Oso set in intelligence, abyss gaiter. Hyped I finally got a W",t3_5ip5rr,t3_5ip5rr,12
pengie9290,danganronpa,hoic4r5,8558485645609105000,"Yes. And in my case, my partner wouldn't even have to like either franchise, since I already cover both bases.",t3_rg3qop,t3_rg3qop,20
cguru_polo,ethtrader,d02z9q8,4726700700452882000,"You can have your private pnd group and I am ok with that. But please leave this sub reddit free of these kind of posts , its not good to the ethereum community. Lets build a healthy community and lets not have a fontas among us please.",t3_466y9i,t3_466y9i,47
davine05,playblackdesert,ghrqpb6,5785165072527266000,"I been having the same problem, think i’m going to reconnect the Xbox one x, and afk fish on that.",t3_koht8a,t3_koht8a,20
VDKay,seduction,i4jd0kc,-2938326051424433000,"Yep!

Also helps if you are regular to some place and you know a few people (even by face). You'll feel a lot more comfortable.",t3_u29nn9,t3_u29nn9,25
Simoxs7,cars,jkp9a0h,-8598917485120172000,Still looks bad too me… looking forward to the Hyundai Pony Coupe…,t3_13kz2ic,t3_13kz2ic,12
TheBearProphet,AskReddit,cpj6qsa,-8271587356241321000,"When I was 8 I got to meet the Power Rangers at Universal Studios.  My favorite was the blue ranger.  We got to go on stage and shake their hands.

The Blue Ranger was the only fucker too busy waving to the crowd to shake my hand.  Fuck you Billy.",t3_2zhzzv,t3_2zhzzv,50
alexis_mightytravels,awardtravel,j6hlfko,1205449271875501000,"Have you looked into booking flights with Singapore Miles? Singapore Airlines is a United partner, and it can be an affordable way to book flights with United. What kind of itinerary are you looking for?",t3_10nvkug,t3_10nvkug,35
Mobile_Francis,ironscape,i9rknwm,403271299560297000,Maybe should have said bis DPS so all these neckbeards wouldn't pester you about guardian boots bos defence ely or bis fashopnscape lmao,t3_uvv934,t3_uvv934,23
logoth_d,PersonalFinanceCanada,j08nnen,-8140353497899440000,"I use KOHO. I haven't had any issues with it, but from what I've read (mostly here), if you do run into problems it's not great.  I haven't found anything better to replace it with though.

I also rarely use it, really only for ordering stuff online.",t3_zlmp18,t3_zlmp18,47
BebbZ,leagueoflegends,ckh8ajb,7741834590017205000,"Big fan here, I supported you last World's and will support you this year too. I will be proudly wearing your icon when it is released on live. Good luck to you all. You will finish first in group for sure :)",t3_2g8se0,t3_2g8se0,42
Whataloadofmoo,ChavGirls,dtumgnj,-4281389428026627000,"[1 more of her](https://imgur.com/OTXujSP). Can be found on Twitter (whether it's her account I don't know, but there's more pics of her there @char_sxo",t3_7vry71,t3_7vry71,24
QualityVote,BoneAppleTea,j2du9ue,531097781928006000,"If this post fits the purpose of the subreddit, **UPVOTE THIS COMMENT.** If not, **DOWNVOTE THIS COMMENT.** If this post breaks any rule(s), be sure to report this post and downvote this comment.

---

[Join our Discord server!](https://discord.gg/g6DUNQk) | [Message the Moderators](https://www.reddit.com/message/compose/?to=/r/BoneAppleTea)",t3_zzvxi5,t3_zzvxi5,42
hatturner,unpopularopinion,fah6ndc,8913742621737775000,"I felt like the books were good at the time, loved them. But I’m not sure how people are still so obsessed with it after all these years",t3_e98xdi,t3_e98xdi,28
Chuggles1,Fixxit,h6powpy,-6731290383224525000,"You can get some JB epoxy putty. Lather it on after draining the oil so it doesn't stay wet when curing. 

Also invest in a oil pan gaurd to prevent rocks or other objects from hitting the oil tank.",t3_osnwnq,t3_osnwnq,39
N0diggityN0doubt,sysadmin,gyus7bv,-4224365408334716000,"open browser tabs, mostly solved now though.  open files.  open terminal sessions.

we went to weekly forced reboots after voluntary shutdown/reboot each night was ignored.",t3_nh7qgh,t3_nh7qgh,25
Gaeus21,motorcycles,dbhyuh1,-2024120384511543000,"On one hand i love the idea, on the other... aren't you supposed to wear gloves?",t3_5joie7,t3_5joie7,16
ceestand,MuayThai,easf370,-4819795791048526000,"Based on my understanding of sizing Thai gear, these are a size 5XL.",t3_a1rhsk,t3_a1rhsk,13
Clicint,DnD,du3wri2,7737755988620896000,"I have a human barbarian named Fergus, and a Goblin bard named Diego. Fergus claims to be from Scotland, and Diego claims to be from Spain. They are the only two people in the entire setting that know what these places are, so now Scotland and Spain are spoken of like legends.",t3_7wu2d3,t3_7wu2d3,52
Jagermeister4,cringepics,cfjpc77,7078273939694863000,"Damn, can't afford to pay for a personal trainer or plastic surgery. Guess I'll have to rape a couple people to pay the bills",t3_1yd0qx,t3_1yd0qx,24
Gwywnnydd,nursing,jlskba2,6198117549709657000,"I always notice which units have a good EVS worker and which ones have a slacker. 
Sometimes I notice the good ones because ""Dammit, I didn't *want* that room turned over so fast! Now I gotta take an admit already!"" ;)",t3_13slk4q,t3_13slk4q,41
VagueFox,AskReddit,d1kb6j7,-197657657590460000,This thread is giving me rock solid abs from the giggles on the responses and also tons to tips on eating. Top notch.,t3_4cmfz4,t3_4cmfz4,23
BillWeldsAlt,neoconNWO,g99zn5f,-6651710365893460000,"/u/benjaminikuta

Don't shit where you eat - aka leave the girl alone. Give her a hug if she needs it but things will end badly if you try to sleep with her. 

Hope you're OK bud, if you need help please get it [here if you're in the US](https://www.nimh.nih.gov/health/find-help/index.shtml)",t3_jblisp,t3_jblisp,49
ukulelelizzy,starbucks,ffu3fsm,-3218038502299672000,"What? They're super cheap, your SM can just order more... My SM orders them quarterly and we decorate them with paint and stickers to personalize them. I have like 6 permanently decorated name tags of my own. I've never heard of sharing name tags before. What will happen if you suggest that everyone can keep their own?",t3_ev8o3p,t3_ev8o3p,57
MrBatmanSir,GXSeasonFour,cpurki7,-6776291240345256000,"This might not be the best option but since you can't publicly release it. Why not release to people via email? People sign up to the email and you send the subscribers an email with the episode in and viola, it's not being publicly released?",t3_30lu6d,t3_30lu6d,45
Lunar-Gooner,meme,ix0mg62,5571697300431718000,"I have a pet bunny and let me tell you I love her with every hair on my head, BUT rabbit is delicious and I would eat it again.",t3_yzhm0t,t3_yzhm0t,29
Hunminator,TeslaModel3,hi5oh33,-1232904757908850000,"Speed limit is 70 in fog.

In many EU countries I drove through they have specific speed limits for specific road conditions, eg. in France the top speed limit is 130 but 110 in rain. It’s awesome how the car just seamlessly swicthes its interpretation of road rules as it switches countries!",t3_qftino,t3_qftino,52
Thinkb4Jump,Payroll,j9wk3uz,-1712456350641263000,"What is the budget?  Biggest question.  If you're thinking payroll is static then the company is living in the dark ages on efficiency.

And spending time on saving money won't win.  Using time to grow and automation in non revenue tasks will produce a better bottom line

It kills me when companies spend so much time trying to save.",t3_11b08qa,t3_11b08qa,59
Golden_Miner_Mod,investing,gtw1gfg,-5477464783713133000,"I've been holding Jan 2022 47.50 and 50 calls for a few weeks now and am up a good bit. Always thought ""who the fuck doesn't want mac and cheese?""",t3_mmywpw,t3_mmywpw,30
lemmegetsomereps,teoriah,j65pg3a,-320076221559502000,maybe jaden? but do you know anyone going to the toronto concert? im trying to go with people but none of my friends are interested,t3_10al4r6,t3_10al4r6,25
Wes_Bugg,MawInstallation,fpta2vk,8092808454019921000,"Revan is awesome. He’s one of the most popular non film characters right there with Thrawn and Ahsoka. I know some people out there dislike him, but most people do like him",t3_gf4dhg,t3_gf4dhg,32
CIAgent42,Muse,dlrt7dv,-3510288332391111000,"I'd love to see any of those songs live, especially Showbiz and Glorious.",t3_6uae5q,t3_6uae5q,13
IcePlex103,AkshanMains,jao9pvg,-6969379804430187000,"Whenever Akshan is around Viego he doesn't even use his Viego voice line, he just refers to  him as someone who works for Viego",t3_11fuk7a,t3_11fuk7a,24
stinkeebong,fionnaandcake,k12lcp2,4472570212538836000,obviously the jake tattoo is so badass that it just needs to bust through the fabric of finn’s shirt. obviously.,t3_16lbrop,t3_16lbrop,20
PhysicsPhotographer,RocketLeagueEsports,imgw7nx,-7470278766334487000,"&gt;	2. Literally every player that legally played in the Rival Series
&gt;	3.	Atomic.

Lmao",t3_x1wiz8,t3_x1wiz8,16
Spider__Jerusalem,battlefield_one,diqh4pe,3079242542054842000,"""And free DLC!

Just kidding, go fuck yourselves!""

**EA. Because fuck you, pay me.**",t3_6ghr83,t3_6ghr83,14
kissingthebois,FishingOntario,k0ox0bl,8445334156489357000,I caught my pb wally on a red deep diving crankbait (idk what model or brand) and ive caught tons on top water. I love those cabins.,t3_16j0j60,t3_16j0j60,27
Financial_Shop1209,nvidia,k70ejfx,1354346241532677000,"can anyone share the save file for chapter Return 5: Old Gods pls , my game buged there and i didnt had any manual save so the autosave activated after the bug and now i cant progress the game the save file is in 

https://preview.redd.it/irbkvi4cs7xb1.png?width=610&format=png&auto=webp&s=edce9b5bd83c0c6aa3099bbacb68170b0b1cf857",t3_17iay2f,t3_17iay2f,45
Ipad207,todayilearned,cqy886m,-145403711664994000,Nearly one third of the American labor force is working for the weekend. Dun^dun dun,t3_34tj5n,t3_34tj5n,15
XennaNa,MonsterHunter,eywen4a,7708038212157113000,"Mixing things up,

What is a good SnS to go for early on in Freedom?",t3_cz5d99,t3_cz5d99,15
nevertruly,AskWomen,hm5eje6,9103175089341489000,Removed for specifying majority demographics. If you have any questions please message the moderators through the link on the sidebar.,t3_r2mjos,t3_r2mjos,20
Abarbrian,DirtyConfession,ezqo9b5,-5724636686270850000,Slip a pair of your panties in his pocket or sample case. That will get your point across nicely.,t3_d0z6k8,t3_d0z6k8,19
lord-bepis,destiny2,dm9qkrh,3765173262698483000,"Depends on the class' abilities or maybe exotic armour, like the warlock has Icarus dash on the dawnblade which is an ability that makes you dash while in the air. Hunter and Titan don't have any such ability yet.",t3_6wolrt,t3_6wolrt,39
hedyedy,Conservative,c1of73r,-121443984676809000,"Oh, Look! We forgot about those 7,500 votes for Prosser. Let's count those. (just in case he might be losing)",t3_gl2qk,t3_gl2qk,20
fcowell,AnimalCrossingTrading,ft2b3jg,-3680967013009109000,"Sherb and ""Sweetheart"". Haven't seen my boyfriend of three years in 2 months since COVID and he always calls me that. It's bittersweet.",t3_gxh8v7,t3_gxh8v7,23
TheWhisperingDeath,lakers,jb2ig4q,-9170957827798009000,"Ugh. Dumb shots. So dumb.

That Dennis 3 was poor decision by him.",t3_11j99he,t3_11j99he,13
ozzie107,rolltide,eayofkj,-3541166389758874000,So true....I can’t wait to show this at Christmas to my in-laws who are Georgia grads. Thx,t3_a2gizl,t3_a2gizl,17
raphrs,FFBraveExvius,dgc8oed,5424218511756737000,"Tilith, Rikku and Ashe. All 4* base units, so won't be THAT difficult to pull.",t3_65panr,t3_65panr,15
Blindseer99,riskofrain,kcsy6fg,-1082263413435050000,"Homie really bought and booted up rorr with no regard to the fact that it's fundamentally different then rorr2 and then proceeded to judge it on that criteria

Cope seeth and mald",t3_18f9cfc,t3_18f9cfc,32
CodyScriblyn,kurtisconner,h179sh8,-2535748478687593000,Carve a statue of her into one of the wooden beams of a bridge with your foot! She'll be flattered. Don't worry if the bridge falls.,t3_nw0csj,t3_nw0csj,26
Physical_lover_9330,NoFap,h1ds9nu,6390311661696539000,"Bro don't feel bad, it happens .... Acknowledge ur path ....n drink plenty of water it will cool ur brain..... N forget whatever happened....just think forward ...btw I relapsed last day after 10 days.....but now I'm feeling good....",t3_nx8rf4,t3_nx8rf4,38
jerkfirecracker,asoiaf,cipvrqp,-7292322309514928000,"I'm guessing that anyone who can read and respond to this comment won't have any trouble with reading the books in English, either.",t3_29z1sf,t3_29z1sf,23
seanrok,Fantasy,iqtlfyg,-5723539847519241000,"Dresden Files from first to last book they’re all great. 

Not hating on others’ opinions, I just never felt it lost quality or was fluffy.",t3_xu2b35,t3_xu2b35,25
2001serpent,CircleofTrust,dwtedsr,5733311461858460000,"[Hello sssir/ma'am, I'd like to join your cccircle, asss I'm trying to join asss many asss I can. If you could PM me the key, I would be forever grateful. Thanksss!](https://kek.gg/i/RyS3M.png)

   

^^p.sss., ^^join ^^/r/2001serpent ^^for ^^more ^^info ^^and ^^a ^^giveaway ^^:D",t3_89ti22,t3_89ti22,41
ChrdeMcDnnis,tf2shitposterclub,jwniaxt,-4485336786545926000,"(This)[https://www.alimed.com/softedge-corners.html?pid=169840&gclid=CjwKCAjwivemBhBhEiwAJxNWNzqpBvmtOX_duaN3x-fJNYIWB5dU8ap1jJj4Cx7YuXn1GiHWZNPP6hoCt8AQAvD_BwE&gclsrc=aw.ds] is pretty close to what you’re looking for, just… rather expensive.",t3_15twxkk,t3_15twxkk,12
ucancallmevicky,Atlanta,d3d97xh,7410356765061436000,"anyone know how likely it is there will be decent tickets available by August?

is it better to just buy the series early?",t3_4k3a96,t3_4k3a96,23
levitat0r,geometrydash,elon9de,3775174786503585000,"Tip: If you make the blocks less visible, you can add more Detail inside the block like chains, just if you want to.
Also, the glow shouldn't be so extremely ""showy"", again, try making it a bit less visible, and it'll look much better",t3_bglz1m,t3_bglz1m,44
RonnyDon,islam,fwdox0v,1095939278997393000,"Salaam Alaykum. I don't know if this is Muslim owned but it's supposed to be a Islamic bank. 

https://www.myuif.com/",t3_hi2g49,t3_hi2g49,19
DigRatChild,smashbros,ck3v74n,5975180648147123000,Honestly I'd be sad if he wasn't in the game somehow.,t3_2ewz1o,t3_2ewz1o,11
kkyoua,argentina,istwqml,-5969582758086908000,votar a alguien solo por decir lo que le haria bien al pais? pero si todos hacen lo mismo hasta que llegan a la presidencia jaja,t3_y6uf6g,t3_y6uf6g,26
DevilishRogue,MensRights,d6l1zgm,2283547312797268000,The irony! It's the author not getting it yet not realising that she doesn't get it!,t3_4y4r3x,t3_4y4r3x,16
EveryFkinNameIsTaken,AskReddit,dkohnj7,-1552303482927223000,"I would imagine that they would both understand their power, combine forces and then kill everything that isn't them because fuck it.",t3_6pdi1j,t3_6pdi1j,22
Jaffo73,homelab,js0596t,2487806544069210000,I am not giving away and or selling any equipment. I don’t know where that came from.,t3_14zgcpo,t3_14zgcpo,17
adm_JAVN,Philippines,id47qkc,-4801895780894145000,"Geologist at mga ibang fields ng science proffesion  na nga nagsabi l tapos sila pa malakas maka sabi na tanga sila? Nakakatanga na ang mga comments nila.


Idiocracy slowly becoming a documentary now because of these people.",t3_vgvh90,t3_vgvh90,37
KingMaldini,soccer,d4brm8b,-3582647635007911000,We did this yesterday. An American came in bad mouthing the English team and got 100 downvotes.,t3_4oe7q2,t3_4oe7q2,17
froot_loop_dingus_,gaybros,k54e33g,7923224238552610000,We’ve all wasted time on a boring straight guy because we “got a vibe”,t3_178hmoz,t3_178hmoz,14
yundot,AskReddit,c8ubiup,-3944415218753192000,"This isn't me but I have a friend who mispronounces frustrating as ""fustrating"". The worst part is he prides himself in speaking well, often with  obscure or sophisticated sounding words. It bugs me so much. It's so frustrating! One day I had to tell him it made him sound like a child.",t3_1a5jwt,t3_1a5jwt,52
crosby8000,AskReddit,e06zq8z,-164379168652841000,"Smile and engage with a stranger, give them a compliment, they'll remember it!",t3_8lix2z,t3_8lix2z,13
pup3x,amiugly,dc9qy90,6237721703652165000,If one is not going to post a pic on a sub for pic sharing then the answer is no.,t3_5n97zs,t3_5n97zs,20
rasengan_yo_ass,RoastMe,ezwrlkt,-8242005529567538000,You look like the retarded little brother of Slick sloth from Suicide boys,t3_d2om84,t3_d2om84,13
Thisguy203,millionairemakers,g2hkw15,-8269342351451482000,"Much love everyone, I'm trying to move out of my toxic household to focus on starting a life with my fiance in a place meant for us. I wish everyone here a good life !",t3_ie7dew,t3_ie7dew,35
suelinaa,RoastMe,cwoya2u,-1357846931569903000,Your mom was an alcoholic throughout pregnancy. You'll still manage to get a bid from a bottom tier frat though.,t3_3rk3oc,t3_3rk3oc,20
Conscious-Reserve-48,weddingdress,jv7v9qy,-3773249888912751000,"They’re both gorgeous but #2 suits you better imo, but go with your instincts of course. And congratulations!",t3_15kuj5j,t3_15kuj5j,18
TheBobzo,IAmA,c4dy8ww,7252484688754180000,"Anyone over at the offices into the ""Friday"" movies? Also (if answered yes to the first question), do any of you think they'll release another?",t3_sgek7,t3_sgek7,25
amazingcreators297,RedditSessions,gx8g2na,-594945175352830000,"Happy to see everyone making money with doge. But I’m on that XRP, LTX, and DAG :)",t3_n6oqil,t3_n6oqil,17
ninmuffin,pcmasterrace,cw4jpuw,-7661663434312951000,"At least I found this give away before it ended, unlike the last one that I found just as it closed.",t3_3p9k87,t3_3p9k87,21
Unable_Ad5430,CryptoCurrency,jw5bqeb,-6010431456232175000,O Canada! Our home and native land! True patriot love in all of us command. Love you Canada ❤️,t3_15quxrg,t3_15quxrg,19
Fancy_Chip_5620,MechanicAdvice,hvs6qz5,-4144470977611430000,The filters I would replace myself and the rest id ignore,t3_slaj9z,t3_slaj9z,11
Imalreadygone21,exmormon,izueb1a,3974901810697834000,"Is it just me, or does he remind anyone else of a black &amp; white Herr Schmidt?",t3_zjbb4v,t3_zjbb4v,17
_00307,EliteDangerous,fv5wk6y,-1475157917745910000,"This is happening to mine as well. I cant get on board because it keeps flying away. 
  
That even kind of looks like my FC...",t3_hazamt,t3_hazamt,25
Neko_shii,TWEWY,h638zoa,8388052935482064000,I hope everything is successful. I just pre-orded a physical copy today and I’m getting a magnet set of the pins with it! I can’t wait to play the game &lt;3,t3_op001y,t3_op001y,31
PhoenixWolfe1523,single,fukjg9s,7796365944228096000,funny not funny but thanks for trying. go home Thor. you're drunk. cut the mead boy.,t3_h7b4zo,t3_h7b4zo,16
CadenDATboss,deadbydaylight,jn2kxz5,7497484125325273000,Tunneling/camping as killer. It’s not fun for me or the survivor if I just chase the same person the entire match.,t3_141i2g7,t3_141i2g7,21
KreyPlayz,pokemon,cixe3mc,-5306732745815267000,"Pokemon Zeta/Omicron
Its not a rom but a still one of the best hacks out there imo",t3_2anizt,t3_2anizt,17
OGIVE,todayilearned,ds4f41k,2034409864093171000,Damn.  That kind of betrayal could drive someone to kill himself.,t3_7nqc7t,t3_7nqc7t,11
A_Hatless_Casual,ageofsigmar,k22ppk0,-5282693368700442000,It wont be delayed due to a new codex's release. World Eaters and Guard players only had a few months before the launch of 10th edition 40k.,t3_16r5a07,t3_16r5a07,27
fakingxan,india,cs835xh,-1943576569068444000,"&gt; ... all the goodies money can by and the expensive trips ...

I think a part of me is dead.",t3_39zhi8,t3_39zhi8,21
Asrylol,Spellbreak,ellv4th,-842006303645418000,A quick response AND fix like this is exceptional and should stand as great example for so many other game developers. Very impressive.,t3_bglm9u,t3_bglm9u,23
cancelingxmasonurass,TrueOffMyChest,jc81lv5,-6541962746217967000,I used to think that before. Before I got with my husband sex was painful and I didn't orgasm either and kinda mostly focused on the guys. Now I'm comfortable and orgasm all the time. I'm no longer in pain and can focus on my own pleasure as well.,t3_11r2cdp,t3_11r2cdp,49
Imaginary_Ad_3912,fuckcars,io2na7j,5934819715278514000,"There are no taxis, Uber or Lyft in your city? Wow. If you don't want a license and a car, then Jimmy is probably right.",t3_xbt3dw,t3_xbt3dw,25
CloudyySpeaks,STD,ibi6nx9,2289780712250440000,"Best bet is to calm down, despite what you think it is. Hyperventilating, stressing, or being anxious about it will most likely make it worse 💀
You’re most likely overreacting.",t3_v6r25s,t3_v6r25s,30
TenTonShoes,EpicSeven,g6hsbq6,-5032763312709526000,"[Luluca-sama.](https://i.imgur.com/vL3XuVi.jpg) Still a few improvements to make, hopefully with a new ring and the rest of her molas she'll break 200k.",t3_iz4gpw,t3_iz4gpw,21
Dense-Secret-8629,USCIS,gwfttkz,8971632557605654000,"fix the money order and send it again, but before you send it again also double check the paperwork 20 more times.",t3_n1wuks,t3_n1wuks,22
bulevoador,brasilivre,fpketa4,1198156413438059000,Ela se diz de direita mas só colocou gente ligada ao PSOL. Pq será?,t3_gdz8f9,t3_gdz8f9,14
rawpaak,billiards,g4r27xr,393381656499505000,"Careful grabbing them off the table , their claws will grab the cloth.  Also,  those cheap covers, there claws go right through.",t3_iq9e2x,t3_iq9e2x,22
run-the-joules,teslamotors,dxgg95m,2517572465080130000,It's currently hailing while my 3 is out in the parking lot at work. I am mortified and tempted to go see if it's getting hurt but know that if it is I can't do anything about it.,t3_88o8v0,t3_88o8v0,38
ovz123,BabyBumps,cgdk2jw,6009676533125082000,"Taken yesterday at 34w0d before an OB appointment. No dilation or effacement (thank gods!) but he did say baby's head is really low. Hoping I make it another 3 weeks, y'all!",t3_21hw01,t3_21hw01,31
roloathletics,crossfit,hahm050,2607247514762010000,Hell yeah!! Reach out if you need any advice! I have helped so many athlete crush their first comp!,t3_pb1x3v,t3_pb1x3v,19
jollous,teenagers,i0sb0sg,-5309736468872155000,Right Arrow Key Right Arrow Key Right Arrow Key Right Arrow Key,t3_tex4ko,t3_tex4ko,12
Scuh,Nicegirls,i9o2g3y,2515222141520761000,Wow poor you op. The person seemed to really need someone to vent too and you seemed to be the unlucky person,t3_uvm56s,t3_uvm56s,22
GroundbreakingCake13,drunk,go4proc,5437557595770747000,There’s so much more to this story I won’t share is you don’t want to  hear,t3_lo9oga,t3_lo9oga,16
BarracudaFluffy6625,fantasyfootball,k5c770e,-4247991149784611000,"I have both Lions and Eagles D but I'm considering cutting Eagles D because they have a gauntlet of Miami, Washington (Nice!) ,Dallas, Kansas City, Buffalo, San Francisco, Dallas, Seattle on deck.",t3_17abgsz,t3_17abgsz,32
galaxystarsmoon,ABraThatFits,g6cx1hg,-6420703288740305000,"In before you've added more info, but ThirdLove uses US sizing and you're a UK 34H. The bra is considerably smaller than you need, specifically by 2 cup sizes.",t3_iyiy9q,t3_iyiy9q,29
Project__Z,summonerschool,cc02wqf,4773531797141565000,It depends on the situation. Exhaust isn't just a slowing spell. The damage decrease can completely turn the tide of a fight for one side or the other. Using both at the same time isn't inherently wrong but that should not be a default reaction/combo.,t3_1lk9x8,t3_1lk9x8,45
GliLife,cfbmemes,c85fd9c,6972909631391705000,"Though it's true that most obnoxious fans are from there, in my area all the douchebags are Auburn fans.",t3_13vwz1,t3_13vwz1,19
frederik-the-terror,bloodborne,eruzhsm,2897607528212596000,Thank you for showing me this wonderful piece of art have a good day,t3_c3wjpx,t3_c3wjpx,14
kerouac-nin,superheroinesdefeated,k7z9i37,-5007466812725273000,"Liberty Star - ""Pleasure and Pain""  

Alex David as Liberty Star",t3_17olgwo,t3_17olgwo,11
Time-Net-4675,gonewild30plus,j5ssq39,-5587593131968620000,"Very much a sexy mommy. Love your posts too, you look fantastic",t3_10ku2xq,t3_10ku2xq,12
baserock_love,HermanCainAward,hbf6wpd,902902046630404000,"\*Drake holding hand up in rejection\*       Turning down free vaccine.  


\*Drake pointing in approval\*       Paying for a hole in your neck and a shiny big wooden box",t3_pguozs,t3_pguozs,27
DygmaBalls,DygmaLab,hr2zzwu,6400607997270289000,"Wow! 

That looks super cool! 

Congrats on the setup. Also, the explanation is great and helps a lot to understand how the layout works. Kudos on the great work! 

We get that you need more layers, you won't have to make the request 😉",t3_rsmobc,t3_rsmobc,44
FluffWhiskers,ancestors,fdhlk0a,3966578099517862000,"You need to go into the trees, use your senses and you’ll find other monkeys, when you first started did you click first time or survivor? With survivor you’re the only monkey at the start",t3_elfx9y,t3_elfx9y,35
E-rye,OmnibusCollectors,i398ify,7807598107082040000,I was so sad when I found out the Byrne Superman HCs were standard size with glued binding. Now I'm reconsidering getting them in case they collect them in a better format down the road.,t3_tv9ekl,t3_tv9ekl,35
MickeyK1991,polls,i20tik3,4099712124647065000,I live in Canberra and it is not a very big city so im fucked.,t3_tm64pn,t3_tm64pn,15
