author,subreddit,id,hash,body,parent_id,link_id,length
snowblind767,nursing,i72y0kw,5755919536316710000,"Go with the flow, learn from those who have expertise with those devices.  I’ve worked with people who have been nurses for decades who i have taught things to.  Just be open to learning and you’ll be fine",t3_uh0fzd,t3_uh0fzd,38
Blithon,nongolfers,c5jjpjh,4327048570803107000,I have decided to become an ateeist. All because of this brilliant man.,t3_x57y3,t3_x57y3,13
hoosiergage,IndianaUniversity,iy3olqu,-842211775690035000,Just give it a little while and you should be golden,t3_z6kx5k,t3_z6kx5k,11
luvmilky,AmazonDSPDrivers,k0i77bk,-7532275762542370000,"OK, hear me put, base wage don't mean anything if you also don't list your cost of living in you area. 20 dollars an hour goes a lot further in some areas and 25 an hour isn't even enough to get a 400 square foot apartment in some.",t3_16hz3nd,t3_16hz3nd,48
Weremutt2412,memes,gcsekfx,-265108126584709000,"I saw the pig first, then I saw a naked woman, then I think I saw the dog. Honestly, your mind can make you see anything you want to with *imagination*!  Or drugs.",t3_jwqiz9,t3_jwqiz9,33
theprophet2511,Judicial,jv4qlkf,1050209054143624000,Where can I sign up to dole out some punishment like this!,t3_15ixvpk,t3_15ixvpk,12
RedMercenary,minerapocalypse,cshrh9w,3918549727865342000,"Haven't been around Roma in a while, but the large sandstone structure was built by iminacatsuit and myself. 
Definitely odd to see it without the texture pack",t3_3az04z,t3_3az04z,27
AlwaysUpForPints,AskReddit,f3xu938,-957081322903382000,Not putting roads through certain trees because we believe fairies live in them.,t3_dimtei,t3_dimtei,13
olliepots,Teachers,cmx8khv,-6027300915275497000,I would suggest reading [Why Students Underachieve](http://www.amazon.com/Why-Students-Underachieve-Educators-Parents/dp/1578864402).  It really paints a picture of what this little dude is going through.,t3_2pien7,t3_2pien7,20
gregklumb,girlswearingstrapons,jlls0nj,6998058201133229000,"Mistress, I have no right to choose but I would beg to be taken no matter what you decide",t3_13rpz91,t3_13rpz91,19
bewarsi,whereintheworld,g3yddcc,-2172747296592086000,the other Korean couple was live streaming just 10 mins ago..,t3_ima6sb,t3_ima6sb,11
iCkerous,HowToHack,fe5bzil,-4978090158067788000,"Or, you could post your question and let the community help.",t3_enuge9,t3_enuge9,11
calebnscott,CHIBears,k8l6d08,845583359404744000,Will they ever call a penalty on a bears opponent again? Stay tuned!,t3_17rry4c,t3_17rry4c,13
Initial-Departure587,femalefashionadvice,jgeqzsd,-3024240613376551000,"I bought two items from them and was really surprised by the quality… nice fabric with a good drape, well proportioned, etc. I was wary because I’ve bought clothing from other oddly-named-showed-up-on-my-Facebook-page places and they were weirdly sized or made of weird see through fabric.",t3_rjck5v,t3_rjck5v,45
Uniquer_name,AskTeenGirls,gj60e6d,-2421978040905163000,"Literally everything about me, and I don't mean that in a good way",t3_kwqrvw,t3_kwqrvw,13
crlogic,pcmasterrace,jh0zd28,8728350000498719000,Glad I went 1080 Ti to 3080 Ti and not 3080.  First thing I played was the Dead Space remake and it used 9GB+ of VRAM the entire time… probably should’ve got a 3090,t3_12slb4h,t3_12slb4h,34
MajinOkabe,summonerschool,dln850u,776707661146527000,"https://euw.op.gg/summoner/userName=Congroo

Finding it really hard to develop consistency and also find it hard to do anything if I am ahead and my other lanes aren't. Hope to get some advice please.",t3_6ts76q,t3_6ts76q,31
blaze1234,CashApp,i0cjbk1,158351931352194000,"First off you cannot use CA as a minor, except getting a parent to sponsor you.

https://www.reddit.com/r/CashApp/comments/qkoffk/minors_now_allowed_to_use_cash_app

http://help.cash.app/6486",t3_tcbgqs,t3_tcbgqs,18
Reasonable-Intern,AskReddit,fggb09u,-390107312472018000,It would smell like popcorn and cotton candy being made during a mild summer day with a cent of far off beach along with a touch of arcade electronics smells from 1993.,t3_ey2of6,t3_ey2of6,32
StarkMaximum,PoppyMains,hjmm5p9,8053392871628487000,"gremlin

&amp;#x200B;

I like that her hammer isn't a giant maul anymore it's literally just a regular hammer you can get from Home Depot.",t3_qo7c8s,t3_qo7c8s,24
bck-,baseball,gzfjd9f,4119470267622114000,I always wanted a lobster roll and area codes on my baseball hat,t3_nkx7bh,t3_nkx7bh,13
VegaLyra,dunememes,iodon0t,-7926263671501853000,"Don't forget he must explicitly include ~~Moneto's~~ Moneo's name, even if he is the only other person in the room.

EDIT: what a weird autocorrect",t3_xdu7uk,t3_xdu7uk,25
Gobshite87,FilmTVBudgeting,du5eou2,8687857038899169000,This is amazing! I'm sure I'll be reading this over again.,t3_71q5dv,t3_71q5dv,11
sneaky00man,CryptoCurrency,gv1i2vp,-4917138103161850000,"It’s a shit coin in my opinion, but it hasn’t stopped me from riding the waves for a few thousand in profit the last week. I’m just trying to not get caught with my pants down with it. Jumping in and out of it fairly often.",t3_mtrr39,t3_mtrr39,46
SwattyP,nfl,jn45lf3,412160071794858000,Never understood what the big deal was. It’s a long game. Seems like he had to try to hide it.,t3_142e5m5,t3_142e5m5,20
shapu,politics,jyf07ll,-7905445995610284000,">During Monday’s hearing, Navarro testified that in conversations with Trump following the issuance of the committee subpoena on February 9, 2022, the former president made it known that he didn’t want Navarro to cooperate with the panel.

That's not executive privilege.  That's obstruction.",t3_165nvly,t3_165nvly,43
2boredtocare,crochet,i0mab8r,7584812261993275000,"Before I read your post I said ""oooooh! Pretty colors!"" 

So there you have it.  Lol",t3_tdx6fs,t3_tdx6fs,16
Your_client_sucks_95,Battlefield,jf7vbvi,7861762997322848000,I love how it takes 2042's utterly bad launch to make people remember Hardline in a more positive light.,t3_12bdsw3,t3_12bdsw3,19
Captaintruth200,talk_hunfluencers,jqvfx1a,7723994544340879000,Amúgy most jopofa lett a Norbi es parja video is ami amugy felvetett bennem tobb kerdest vajon Norbiek is poenkodnak? Vagy tenyleg ennyire gaz a kapcsolatuk? Vagy dancso poenkodja el? Nemtudom,t3_14rqyb5,t3_14rqyb5,31
marthini11,orangetheory,gyi3vpt,-1432595723094769000,"What’s “strong row”? How would that be different from all out or push?

I feel like they’re trying for variety on the rower because so many people are getting burned out on 3Gs, but I am tired of row cues that are subjective.",t3_net5by,t3_net5by,43
Illandarr,memeframe,ip0folv,1502189870858286000,"Idk, I just take voidrig and press 4, works like a charm",t3_xh0l3y,t3_xh0l3y,12
Sybertron,DotA2,do9mxr4,-198659444182628000,They make like 10 million a week off Dota.  Pretty inexcusable they have as many bugs and development issues as they do.,t3_75ona5,t3_75ona5,22
zegall,CryptoCurrency,hmlkjvf,-1690518411384347000,I'd like to play an NFT based Pokemon game where one shiny Bulbasaur doesn't cost 50 million dollars.,t3_r55ubf,t3_r55ubf,18
Thewhiff35,HotWifeLifestyle,heqrg4n,508989273119646000,Yikes! Seems like you may need to do some shadow work before getting involved in any relationship.,t3_pxwsxt,t3_pxwsxt,17
wknd_jones,buffalobills,dacx4gg,-4596541186039174000,This hacker doesn't know the difference of your vs you're. I have more faith in Dareus than that.,t3_5eh7uj,t3_5eh7uj,18
jaydoes,TwoXChromosomes,hsubvaa,-476738318929233000,"It's totally reasonable.  I stopped dating a lady for exactly the same reason. If you can't even go to the bathroom and come back without stopping to flirt with some guy you think is hot, I'm done. Have some respect for your date.",t3_s4v4uf,t3_s4v4uf,43
iamsander,AskEurope,e21uytx,1790294069517186000,"In Sweden you often get a glass of free tap water without asking. In the Netherlands they mostly give you mineral water. Some restaurants or cafes give you free tap water if you specifically ask for it, but others refuse and will only serve you paid mineral water.",t3_8x9rp8,t3_8x9rp8,48
Over-Instance8768,Depop,htcmv1k,6193948273973646000,Yes this exact same thing happened to me and I got my money back. Did you pay through PayPal? File a dispute through them and they will investigate.,t3_s7vv9a,t3_s7vv9a,28
LetHaywardPlayLoL,kings,ifmxv20,-5817630642399845000,Queta out and pacers are on a run. Max him out,t3_vvx5cf,t3_vvx5cf,11
Bonobo77,gaming,d4lppel,-8642844818952229000,What No golf course? When I started playing all I ever wanted was to build gold courses....,t3_4phpch,t3_4phpch,17
Redditor965,germanshepherds,cevh9ey,8784843845968747000,"Woah, my first German Shepherd was also named Smokey!
I have another one now, after a couple years, his name is Rocco! :D",t3_1vsd2c,t3_1vsd2c,23
creedxender,AskARussian,jg4uxet,6204663169196153000,"Try Proton, apparently that one works well in Russia. Plus their entire suite of services is quite good, and they're adding new features regularly.

ETA: The Stealth protocol in ProtonVPN is an interesting thing as well, it makes your VPN activity look like normal browsing. I can't say as to how effective it is, though.",t3_12kj5ep,t3_12kj5ep,55
superjerry,WheelchairJimmy,cbu7sud,6563122399004905000,Drake the type of nigga that licks his finger and fixes your eyebrows for you.,t3_1kwpip,t3_1kwpip,15
Common-Somewhere-746,Hololive,i8lc22j,-3238828054127526000,"GHOST still my all time fave.

But Tenkyuu tho must be like top 5 most important songs in Vtubing history.",t3_uoxnj4,t3_uoxnj4,20
ichabodguitar,HorrorClub,cr5frpk,2595196960177353000,"This video is going to piss off the Puppets. Bury me in Monroeville!

https://www.youtube.com/watch?v=kHmYIo7bcUw",t3_35juif,t3_35juif,14
shoe-veneer,ctbeer,d2vv7nz,-9053899457112937000,"Probably not gonna be a popular answer given the subreddit, but honestly, I'm sipping on a Sam Summer Ale right now. It's been a long week and the light touch of citrus is quite refreshing while I finally relax and look forward to the summer.",t3_4i7xcq,t3_4i7xcq,45
Yoni_nombres,ZeroPunctuation,feff883,8718090993961898000,"Check out Yahtzee´s Zero Punctuation if you havent yet, awesome show!!",t3_eogkzb,t3_eogkzb,11
pikes4pikeys,Cringetopia,hbvzy00,3398283661696374000,As cringe as this witch nonsense is. I kinda want a witch gf to go along with her spells and whatnot. It sounds like it could be fun.,t3_pjbvag,t3_pjbvag,28
GravityCat1,DotA2,cjf1hv1,4300312927095071000,"Yes all of them, but in the end it's up to you if you want to do it. You can't just pick which matches you've played that you want to show in your history :P",t3_2cfud9,t3_2cfud9,35
kendirect,nfl,cxhld58,-1874202357772889000,This is some of the most cooked reffing I've ever seen.,t3_3usb9s,t3_3usb9s,11
daizz1023,minnesota,ens5lkp,2781933784554998000,Give me a place and time and I will be there to protest this ridiculous crap,t3_bp1scw,t3_bp1scw,16
Last-Intention-2863,programacion,jjrcsve,6595902069905406000,"En wikipedia tienes la implementación de la mayoría de algoritmos que se dan en la uni en lenguajes como Python, C, C++... Y la verdad que a mí me.sirvio más una lectura de wikipedia lenta, y lenta te digo, muy lenta y entendiendo almenos la idea de cada algoritmo.",t3_13es52x,t3_13es52x,49
TheIditoicTroll,trans,hy8pod5,6920258507949810000,"Try looking for a inclusive well paying job in the morning, it’s not much advice but it will bring in some cash for food and rent I honestly wish you the best of luck.",t3_szu6a4,t3_szu6a4,34
Zoidberg33,subway,gqijhft,4149869540257398000,"probably half my meals in a week come from work so idk why they wouldn't let you have food. It sounds like they're just trying to overwork you for no reason, doesn't sound fun tbh",t3_m24pla,t3_m24pla,35
Wrggujjgtuhgrubg,SquaredCircle,ecq9hjj,8583119893850932000,"HOOK THE LEG

HOOK THE LEG

HOOK THE LEG 

HOOK THE LEG 

HOOK THE LEG 

HOOK THE LEG",t3_aa9qz9,t3_aa9qz9,18
radjammin,videos,iu6jn7u,-2759438959618266000,"If you won't take care of our kids, my electricity will. Green Energy.",t3_yfn29y,t3_yfn29y,13
MythicalFluffy,RoastMe,jpr3yei,1078301963675908000,"I thought black holes were a space thing, but there seems to be two of them where your eyes should be 🤔",t3_14k8zss,t3_14k8zss,22
Familiar_Criticism_7,MonopolyGoTrading,k5uivvw,4140087036770949000,i have a 4 star and couple 3 stars id give you for dive in,t3_17d62rv,t3_17d62rv,15
thegrumpy_art,HungryArtists,jx4a3qj,-180363463799540000,"Hello, I think I have what you need! I'm a freelance illustrator and oil painter, take a look at my works, please:  
  
Ig: thegrumpy\_art  
  
Artstation: artstation /marqueslucas  
  
If you have any questions, feel free to DM me, reach out via discord (lucas.mo #9549) or email (lucasmo.contact@gmail.com",t3_15tm79h,t3_15tm79h,46
Beebisbunk,retroid,jsx90ch,-6441094791981703000,"I own the game IRL, and I personally would like the convenience of playing it on my laptop. not saying i'll upload it, but is there anything i can do on my end to get it working for me personally on emulator? genuinely just curious",t3_k8ou9w,t3_k8ou9w,45
panpotter,namenerds,iaydxma,-3543005186219308000,"A Facebook friend has a daughter with this name born 8 months ago. It’s a good name but it’s super popular. James is the new Marie, every baby girl on my Facebook feed has either the middle name Grace or James. It’s popular for a reason though! If you love it go for it.",t3_uwx46h,t3_uwx46h,54
Art_pog,TwoSentenceHorror,ies8jzp,5525230363272663000,"How??? Isn’t strangling pretty easy to identify, or am I wrong / gen",t3_vqn84e,t3_vqn84e,13
AlexNanNSFW,WouldYouFuckMyWife,e22yplw,8257109091900009000,"I definitely would. Id love to slide my dick between her asscheeks, maybe shed wake up to that",t3_8xfxr6,t3_8xfxr6,18
ChasingFlavors,FortNiteBR,ge5gtmb,2766326886563069000,You can cook minute rice in 55 seconds? must be a god then...  go ahead and drive,t3_k3wqx1,t3_k3wqx1,17
michalczechch,AskReddit,ergodvt,1078924478494570000,*loud knocking* FBI OPEN UP *the door breaks as the police starts swarming your house*,t3_c202eg,t3_c202eg,15
PapaStalinPizza,oneplus,fp23ttz,-8188162887483286000,i'm wondering the same thing. I was really excited to buy it but saw the 8 Pro was out of stock.,t3_gaqvq2,t3_gaqvq2,21
DISNYLND,Moissanite,j26f952,5820170077337498000,I bought my boyfriend's from this store and it's great quality. Highly recommend.,t3_zyijac,t3_zyijac,13
TrialBasilisk75,Brawlstars,hdxhbfl,5027459417963546000,"Low power league, and you bought lvl4 piper on heist -_-",t3_pthib0,t3_pthib0,11
newsdk,newsdk,f1qrbjq,6877522280326404000,Posted article with title 'Real deler med Atlético i lokalderby og tager førsteplads' and URL 'http://www.fyens.dk/artikel/3383911?rss',t3_bl8abq,t3_bl8abq,16
pineapple_pants,CFB,d80ohiv,4366634681447311000,"Can't help but think that if we have the same play calling we had in most of the third quarter for the entire game, that we might have kept that a lot closer. 

Of course if Boise wanted to, they could have just ran the ball 50 times and ground us into dust.",t3_54bdp7,t3_54bdp7,53
Monchi83,Eldenring,hspq08w,-3463021965924411000,"I could see one as it’s open world, but they aren’t in the habit of doing DLC just to milk games.",t3_s2h10n,t3_s2h10n,21
BoomBada8432,marvelstudios,dwt3zrn,395043583522349000,This is a comic book tattoo done right nice job dude!!👍,t3_89r2b0,t3_89r2b0,11
IdhaveaPuppers,AmItheAsshole,eqbyxyq,4811361980982567000,"NTA 10pm is a pretty commonly accepted (and often legal) ""quiet time.""

Then again, 7am is when it ends, and anyone mowing at 7am on the weekend is definitely the asshole, so rules mean nothing.",t3_by2ho6,t3_by2ho6,35
DarkSideOfTheNuts,gundeals,i38v0u2,-5064978968249053000,"I ordered some of these to practice cutting mags. I think I may order the 40rd pack as well. 

The pack I ordered last week still has not shipped",t3_tve5cw,t3_tve5cw,29
AM-64,Machinists,iuu9f4i,8892101669994951000,"Nice, I have the 8"" version and it's just as accurate and repeatable.

(I also have 3 pairs of the 6"" non-coolant proof ones)",t3_ykbaos,t3_ykbaos,24
DaSneakiKawiki,ipad,cbphrz5,93474615881981000,There is an app called Skyfire I use to live stream UFC events on my ipad.,t3_1kim6y,t3_1kim6y,16
vihawks,RedditInTheKitchen,gi0igsk,6660365623639244000,"i get takeout every week, and it lasts 4 days (8 meals) and costs about $25",t3_kpw6wd,t3_kpw6wd,16
Brendanawesome,Invisalign,j48ztcl,4586448238868952000,Nice work!   I’m 13 months in and waiting in refinement scan.  Almost done too I hope,t3_10ahwib,t3_10ahwib,16
step-lego-wat-u-doin,Superstonk,hrhzdm9,-1726367411517419000,"The buying pressure pushes the price down. 

It's market manipulation 101.",t3_rxgbru,t3_rxgbru,11
Peterisr32,IdiotsInCars,e9o3ae9,-5939293741878004000,I hope you get Winter tires! A must in a winter!,t3_9wv6fc,t3_9wv6fc,11
Raz0rBlaz0r,FortNiteBR,e98ivwx,4985966013798438000,Please add Asia servers to Xbox or add middle East servers in general I can't stand 200 ping,t3_9uzbia,t3_9uzbia,18
et5291,buildapc,cnsngza,5394695343320063000,I run duals with my 970 bit also with a 560. Dual is easy,t3_2sta25,t3_2sta25,14
ItachiCat,RocketLeague,f2ez510,-1862533688626467000,Seeing this kind of thing makes me want to just delete the game. I'll never be on that level,t3_dd50vx,t3_dd50vx,19
cool_username2020,Bossfight,glcpw7l,-4176223914214508000,"Try on r/itemshop, this isn't quite fitting bc it isn't a boss",t3_l8gj21,t3_l8gj21,12
nottoodrunk,Enough_Sanders_Spam,jwdcfl0,2056330470854373000,"My hottest take is if you primarily WFH for a company where the majority are in the office, you're just setting yourself up to get jettisoned whenever layoffs come around. Yeah some people accommodations due for medical / personal needs, etc., but despite what reddit thinks, building in-person relationships is still super important.",t3_15rl1jr,t3_15rl1jr,53
Raidernationprez,TaylorSwift,ioaoyt6,-8428585767014313000,Thanks! Bought the vinyl! Now I just need a signed version! Any idea when those come out!,t3_xcxhex,t3_xcxhex,17
matthewjpb,baseball,dnsz08d,4600204671468954000,What about HBP? Not a TTO but also doesn't involve the defense.,t3_73swde,t3_73swde,12
stanhhh,windowsphone,d0ordr9,-4621990230395946000,"Nope. I love my phone. It doesnt even feel big anymore, even a little small at times.",t3_493hv3,t3_493hv3,17
NonRangedHunter,Millennials,kf4ixo5,-1988816730797619000,"I never watched it, but I rarely watched much of childrens TV growing up. I watched turtles on my birthdays (I had to pick a movie for my guests to watch). According to my girlfriend I had a terrible childhood since I didn't watch so many of the classics, like land befor time or all the Disney movies.",t3_18rqqw9,t3_18rqqw9,58
IAmGiff,BasketballGM,gnt83jz,8285957018527588000,Lol this is like Giannis' strength progression... check out that before and after: [https://www.reddit.com/r/nattyorjuice/comments/a8n9ql/giannis\_says\_hes\_put\_on\_51\_pounds\_of\_muscle\_since/](https://www.reddit.com/r/nattyorjuice/comments/a8n9ql/giannis_says_hes_put_on_51_pounds_of_muscle_since/),t3_llzmy0,t3_llzmy0,14
National-Idea-4776,Construction,j6ioxpw,5582733272161118000,Carhartt will fix it free. They put a new zipper in mine and shipped it back,t3_10ogo02,t3_10ogo02,16
aviara_detra,cosplaybutts,fe7mk3h,2164780692819695000,"She is my best friend, and prefers to go by Alice. She is an accomplished cosplayer. If you like her content, she has her own subreddit if you want to see anymore of her work.

/r/Caticornplay",t3_eo354t,t3_eo354t,36
Crowtaclysm,MurderDrones,jni9vxl,2664092390265797000,"Me hopin for J merch


The Nuzi shippers concerned for the crow's purple Solver eye bc crows in media more often than not represent death


People loosin sleep on the 24hs leadin to it",t3_144fsoe,t3_144fsoe,34
sherlockskates,starbucks,e3ihqrg,-3081242924819294000,Mmmm six plastic cups of caramel-flavored diabetes with a side of asshole behavior- my favorite!,t3_942zn0,t3_942zn0,15
SoberKRS,stopdrinking,jyvqn1a,8974889365688315000,I understand this totally 😬you’re not alone and we can do this ❤️ indulge in everything else cozy and remember not to romanticize alcohol itself. Find some NA options that you love,t3_168fq3t,t3_168fq3t,32
professor_tappensac,GameSale,ivrslt7,-8384691186144848000,"Could I have pics of Amazing Spider-Man vs. The Kingpin and Toe Jam and Earl: Panic on Funkotron, please?",t3_yr3cye,t3_yr3cye,19
xaesthetic,FemFragLab,gwt5t30,-9221490072150801000,"Stash by SJP is one of my favorite scents, celebrity or otherwise. Its not floral, gourmand, aquatic, or citrus! It’s mostly woody and resinous but complex and almost creamy- a stunner",t3_n41aj8,t3_n41aj8,31
DeliberateIntention,DreamlightValley,jeeppzv,-247725372548264000,There’s literally so much space idk how people aren’t utilising it better,t3_127cc7q,t3_127cc7q,12
Agitated-Anything-33,AskReddit,hzce73n,-3681419066770975000,Red Santa Claus - made by Coca Cola in the early 1900’s I believe (originally green!),t3_t6nh48,t3_t6nh48,16
madmsk,mathpuzzles,f8z708c,-8066233495341413000,"It takes one minute. Instead of modeling each ant as colliding, you can model the ants walking by each other. This means that they don't really interact with each other at all. So it takes at most 1 minute to leave the meterstick",t3_e2w3z2,t3_e2w3z2,43
Baby_Hippos_Swimming,FinancialPlanning,ix27986,6133069099733059000,r/personalfinance has an excellent wiki that will tell you all the basics. This sub is a little more advanced than what you need.,t3_yzud4r,t3_yzud4r,23
manonamoambo,EpicSeven,ek5t94b,3261343700871319000,"try it out first and report back to us please. Hear some player have their knight as 5 star doing w11 so maybe as long as you hit the hp and def threshold and your healer are fast enough to keep up the heals, there's no need in 6\* him just yet(or ever even).",t3_b9ns2v,t3_b9ns2v,54
professordns,lordofheroes,gfzn6sd,5595426543154199000,"Leirei is my nuker with Helga, although they are 2A/1A respectively. I also have Mei Ling with full burst potential which helps the balance and Earth Charlotte. As others said, it's about the balance. Also remember to upgrade the skills of your main characters in use. You can get Leirei's ultimate using only 2 spirit.",t3_kdtfxw,t3_kdtfxw,55
Fetchwell,AskReddit,d79tzyr,-2936590647223150000,"I am 23. Just found out my dog has a cancerous mass, and I am not taking it well.",t3_51371j,t3_51371j,19
seamartin00,gaming,gj8pq8q,1767554435378243000,It's a darn shame they weren't able to keep the epicness of that trilogy up in the future installments.  It seems like it's gone a bit stale lately.,t3_kx5ppv,t3_kx5ppv,28
TasteCicles,interestingasfuck,jbdfsnw,3609811614245411000,Is he really a 26 handicap or was that a joke?,t3_11lkb11,t3_11lkb11,11
horrorlover2,TrueOffMyChest,g6udult,-5759451355433394000,He deserves it. I'm glad karma took care of him. I wish there was divine justice like this all over the world. Repay him for everything he did to you all your life.,t3_j0mdl4,t3_j0mdl4,33
TheDemoRat,HazbinHotel,f7dbiy4,8338054382339740000,Was wondering how long it would take before this turned into a format.,t3_dvkipm,t3_dvkipm,13
Dancetown,PokemonHome,h60zm8x,2629384887615132000,Hi! Could you tell me the ot and number of the darumaka and archen? Thanks!,t3_oootmn,t3_oootmn,15
THECyberStriker,splatoon,jb36upg,-5085760907243841000,Got 89 twice I am definitely not crying into my pillow right now,t3_11jl3e1,t3_11jl3e1,13
darkrider400,forza,dx86ovj,5069073419847980000,"Also yes, I may or may not have a slight obsession with Need For Speed's BMW M3, lol",t3_8bnj5m,t3_8bnj5m,18
aidensmash,DBZDokkanBattle,dld398t,8482489862573698000,"I feel ya bud. Need one more node for ss4 vegeta.

http://imgur.com/1NzjzB0.jpg",t3_6sid1y,t3_6sid1y,12
wideglide256,trees,d22kr2c,1363321397858501000,I love a good wake and bake! Today will be a good day!,t3_4eqxs9,t3_4eqxs9,13
psullynj,Superstonk,i7wnm4y,5461282978204757000,Yeah I mean if you do enough digging on bill gates you see how many toxic entities he funds/ is connected to,t3_ulk0f1,t3_ulk0f1,22
zeels,france,hceu5o2,-6959442672726109000,Camus pour l'Algérie et rien pour la Tunisie. Je suis déçu.,t3_pltb3b,t3_pltb3b,11
blowonmybootiehole,TrueOffMyChest,i7p6nak,-3819052085752432000,Jesus christ. I am so sorry. I have no words but I will pretend squeeze your hand in a sweet way through the internet. We can even pretend sit on a cool ole stoop silently together.,t3_ukfg95,t3_ukfg95,36
FultonHomes,AskReddit,ebhjk1y,8227166546947399000,"*""I stopped being afraid after my first venture failed and the sky didn't fall down.""*",t3_a4tzuk,t3_a4tzuk,15
MAGEPIRATE,Showerthoughts,djj6p0g,6511298972689957000,Why don’t you use cars inside games to kill other players instantly,t3_6k46ko,t3_6k46ko,12
rikuchiha,Metroid,hfgzi2d,7965793834008296000,EMMI is hell to evade. Thank god it's from the last door and not last save room.,t3_o4ql0y,t3_o4ql0y,17
Accurate-Pay-3234,MarriedandTakencock,j3r4j00,23416268312339000,"Please cum empty those inside me , need to be bred and filled with cum",t3_1082em2,t3_1082em2,15
Interesting_Rub6477,distantsocializing,gc2xs0t,-7152784819975780000,Does your mum still rub your belly to help you fall asleep at night.,t3_jt22tc,t3_jt22tc,14
candy855,relationship_advice,fx8ybvf,-3863840267792838000,Suck it up and come clean with Megan. Don’t be an asshole,t3_hn3l6m,t3_hn3l6m,12
risico,vim,c3b0s7z,-2621267234124327000,"Terminus has a very nice feel to it, although I don't see it to stick for me. I've switched to Fixedsys (the old Windows console font)(from Inconsolata) because I couldn't get Arch to display the fonts the way I want and heck, I quite like it.

Any Fixedsys users around? I don't want to be the wired one.",t3_npiph,t3_npiph,58
