author,subreddit,id,hash,body,parent_id,link_id,length
HRoch55,Jesser,ftio9n8,-6296664219776737000,it’s just all different types of meat that taste and look good. y’all childish as fuck,t3_gzlg4h,t3_gzlg4h,16
AimeePlaysMSM,MySingingMonsters,hk3t8xy,4150616206501480000,"No, not possible. Saving the track for the Monster and then Pasting it to each Monster individually is as good as it gets.",t3_qr1wom,t3_qr1wom,23
MrEvers,swtor,gk8m065,-5542351201680286000,The armour makes it look like his belly is popping out from under the chest piece,t3_l2nsxp,t3_l2nsxp,16
LearnfromChrist,backpain,k6c33iw,-9187147068472794000,"No foraminal or canal stenosis. So overall good. My report also mentions arthropathy, so I do not arch my back. No McKenzie exercises for me. Only McGill big 3.",t3_17fslfa,t3_17fslfa,29
klupsio,buccos,cqhotac,-2995491190780472000,"I think it's really great that the pirates are doing a day for autism, just wish it didn't benefit autism speaks",t3_334jbo,t3_334jbo,21
PeeEssDoubleYou,AskReddit,e28zm7v,8511706423569097000,Not very? Now if they tried to implement robust gun control....,t3_8y90v0,t3_8y90v0,11
dalnee,PoliticalMemes,jy0abh2,-5181067347199320000,Why did he get to fill in the height and weight? Why wasn’t he processed like anyone else would’ve been? Above the law??,t3_1629nxh,t3_1629nxh,23
Atulin,Warframe,cwwrayy,872720711140436000,"Reading the sidebar and the Wiki.

There's no way of getting good fast, no magical trick. You have to grind your way to the top.",t3_3sfmj3,t3_3sfmj3,25
model70,PipeTobacco,kejw2ny,2139793000383710000,"Sometimes it's the engineering of the chamber, draft tube, and bit. Sometimes its the tobacco you're putting in it. Sometimes it's technique. Sometimes it's a weird relationship between that pipe and you. But sometimes the briar is just crappy, too young, poorly cured and therefore nasty.",t3_18or9y2,t3_18or9y2,46
My_Dad_Bod_25,Stacked,in967o7,-2544938330087913000,Oh I do!  I just want to bury my face in that ass and pussy 🤤🥵,t3_x6w9ox,t3_x6w9ox,16
Heterozizekual,redscarepod,ftdrh3i,-518877550746730000,The shitmunching inhabitants of the U.K. love the royal family and would probably support this new fucking yacht.,t3_gz1b31,t3_gz1b31,18
Vondi,gaming,c1q4zik,-4968128250329482000,"I've played plenty of scary games, all by my self in a dark room for full effect, but this is the first time I've been disturbed just watching someone playing a game. Definitely got to try this game myself, or just watch your play-though. The latter is safer I think.",t3_gta9m,t3_gta9m,50
throwawayBS82BG,DeadBedrooms,hb4oko6,-1734439781910458000,"Been there done that got the depression t-shirt.

It's totally rational. Despair and loneliness when you are supposed to be feeling connection and intimacy with your spousal unit but there you are alone by yourself. Totally rational.",t3_pfg3rh,t3_pfg3rh,37
suxesspool,baseballcards,dpq832o,5438024873903932000,"I want that card, didn't even know the rookie cups had autos!",t3_7cikdi,t3_7cikdi,12
ArshartUn,gwent,e8k8ezo,-5477168381865784000,I try to search the whole night and cannot get the third hidden map. Is there a choice I make wrong?,t3_9qwx3t,t3_9qwx3t,21
OnlyTwoPlanks,AskReddit,gddp3hs,883962642899930000,"I always go to October Sky as my movie of choice when I want to feel creative or pull myself out of a slump. The movie starts off slow and builds up to the boys success, gets me every time. It also helps that it's based on the story of the real Rocket Boys of NASA at the time.",t3_jzni4c,t3_jzni4c,59
FrostedFluke,Gunners,ghl6khs,-1315509268979835000,"Is this real? is this recent?

edit: nvm, yes it is!",t3_knjnuh,t3_knjnuh,11
SwimNationalChamps21,ucla,griy09d,108738889338043000,"Man I hope UCLA accept 10,000 students this year. That way UCLA could have an 8% acceptance rate, which would lead to more competitiveness with Stanford. Stanford getting all the elite, top 10 recruits for every sport and it’s fucking pissing me the fuck off.",t3_m8pbrm,t3_m8pbrm,45
HippyGeek,AskReddit,d1re76n,-730160535960072000,"Hacker that steals sensitive information from Corporate and Medical information systems, then disassemble those systems so they can never be used again.",t3_4dgiyw,t3_4dgiyw,22
Uridoz,AskVegans,gsptil2,1858614583901469000,"I do bring up halal meat, in fact, and I don't think secular countries should allow it when stunning before killing is otherwise mandatory. Bullshit religious beliefs, whether halal or kosher, should not be an excuse for animal abuse.

But hey, animals shouldn't be slaughtered at all in the first place.",t3_mfd4n3,t3_mfd4n3,51
ChaseBears,LancerRPG,jv26qo2,7237686187540351000,"too real  


literally, this is actually a plausible chain of reactions",t3_15jvkah,t3_15jvkah,11
chameleondoesitagain,Pixel6,in2gqqx,7113490532185693000,delete the file app so that it deletes all the update patches and then try to redownload it.,t3_x5d8zg,t3_x5d8zg,18
FocusOnThePie,Texans,fd5uenk,-5175799550610096000,Someone please tell me what we would have to lose by firing crennel?,t3_ek2252,t3_ek2252,13
EmmaNovela2017,52weeksofcooking,gzi75kl,-9165042780897804000,We have an Aracauna rooster 🐓 . He's called Huevos Rancheros 🤗,t3_nl8623,t3_nl8623,12
FLTDI,Millennials,jl1w9yz,-4252275300927106000,I'm old enough to be your dad..... And I'm right in the middle of the millennial generation,t3_13nzvdn,t3_13nzvdn,17
Thorskull69,interestingasfuck,iksvdvh,2383026178945596000,I think this is where you use the I lost my parking ticket routine,t3_wrgzvd,t3_wrgzvd,14
roundsquare12345,wholesomememes,g6vonpd,-4844672084560265000,"What is this meme template called? Its one of my favorites, but I don't know its name.",t3_j05end,t3_j05end,17
mime454,90DayFiance,iqtndk8,-1127972985495909000,Liz being raised by her grandparents partly explains why she's with someone 30 years older than her,t3_xtwhgc,t3_xtwhgc,17
Lil_Puddin,todayilearned,fny5le8,6642994687146611000,So they're capable of counting and remembering steps? They're more advanced than most humans. They must be stopped.,t3_g4hvnp,t3_g4hvnp,18
Heavy-Difference-437,LadyCocks,j4vjels,-7275048130319707000,"Shes gorgeous… but no, i gag easily. That monster down my throat and i would die. But take it in my ass? Yes - that i would :)",t3_10f4m2t,t3_10f4m2t,28
Muck777,electronic_cigarette,cijy8cf,490308466270676000,"Most tobacco juice tastes fairly bad. You should try these people. 

http://www.houseofliquid.com/",t3_29dsoh,t3_29dsoh,12
CCityinstaller,hardwareswap,gn4w1ih,-7590145502278938000,Wish you were  closer (97103).  I'd sell you one for $1350 cash. Not really worth it for me to ship with the PP fee and insurance costing so much.,t3_lis1tq,t3_lis1tq,29
IridescentCrackPipe,malta,hp9v398,-2764995081025372000,"there will be clubs and you need to apply for membership like a shooting range, they will also only allow a certain number of members so tourists wont even be allowed to buy it.",t3_rkh36y,t3_rkh36y,34
tomytronics,nes,ijed397,1397087088331751000,NES version of Game Genie can be stacked to get more than 3 codes.  I had 3 total at one time.  Long ago I destroyed one to build a Famicom adapter using the adapter board found in early NES games. Back then Game Genie were under $5 each off eBay.,t3_wism2c,t3_wism2c,50
Heididjfnfn,teenagers,jelf0cy,2840262071810633000,Show me the place where he inserted the blade - black country new road,t3_128tb62,t3_128tb62,14
y333zy,Mcat,dctu5wo,-5930436835021822000,I garbled water + vinegar and it worked wonders. Yes you will gag from the awful taste but it coats your throat and you won't have that terrible feeling,t3_5prudi,t3_5prudi,29
No-Explanation-1982,amcstock,jaovtm3,-3887563334551457000,"One is an adjusted EPS. One isn't. The -.14 / share was a beat for this Qtr. It should increase strongly now that we have MORE MOVIES again getting through the covid era, people enjoying being out again, seeing friends, family, date nights ... the movies are going to do excellent in 2023 and 2024 🍿 🎬",t3_11gio6i,t3_11gio6i,57
MaxDamage1,AskReddit,g3zwuzl,-8927376155055328000,"Consultant. If you have any natural expertise, you can charge to consult others who don't. A few successful consultations will give you references to help find other people who need you. Money rolls in.",t3_imhikl,t3_imhikl,34
BlazeBitch,AskReddit,jqbqtx9,-9063322780873112000,"Walking across hot concrete, through snow, or on sharp objects [ usually some sorta combination  ] because you don't think whatever you're doing is gonna take long enough to be worth the effort of putting on shoes.",t3_14o2cl0,t3_14o2cl0,37
Burrex1,Osaka,f0ra19m,-3201679717912324000,"If you're around your twenties and don't mind drinking join me and my friends this Saturday ! 

P.m me!",t3_d504dx,t3_d504dx,19
GAPYEARBABY,stopdrinking,fk9wmg3,4631303624314237000,"Beautiful description of your journey, which fully resonates with my own experience. You sound exactly like the kind of kindred sober soul I wish I has IRL.",t3_f3te6i,t3_f3te6i,27
Theoretical_Phys-Ed,funny,j47m020,-8376726530778495000,"It's almost as if us women do what we want, how we like it, and don't give a shit about what guys think!",t3_10at2nh,t3_10at2nh,23
keptfloatin707,nissanleaf,dntgg6p,-2720457471068689000,It should be illegal how they justify it's mileage or range when they advertise it I got duped into a leaf because I didn't do my own research and 5 minute search would have provided all the red flags I needed better luck next time,t3_73v56v,t3_73v56v,45
monkeya37,AskReddit,dfwk2a3,303462289042537000,"Dressing up in bat suits and beating up the economically disenfranchised in a twisted pursuit for ""justice"".",t3_63n1it,t3_63n1it,17
Sublissimo,AskReddit,fxaclwh,-5725104372442038000,"The titanic, it would be a horrifying experience even if it was just a mini-titanic in a pool or something.",t3_hnbp7g,t3_hnbp7g,20
dcredneck,terriblefacebookmemes,j6gtyjf,1712478623703985000,I’m 50 and only know them as Brazil nuts. And my dad was kinda racist.,t3_10oahmi,t3_10oahmi,15
Real_Ask62,TeamfightTactics,jij4y96,1733749094561261000,"That's really sad, don't worry you can always contact the support team they LL help you",t3_134xk4j,t3_134xk4j,16
Extension-Magician44,CornerGas,jwwmiy7,-8547778243222231000,"You're lucky Wanda is a fictional character, or she'd kill you for even implying that.",t3_10sqwjt,t3_10sqwjt,15
houghi,SatisfactoryGame,hau2vc6,-8913578399614815000,"There is an in-game photo mode (Press P) which places screenshots in the following folder by default: “Documents\My Games\FactoryGame\Screenshots”.

And you can select high quality, making the image 4 times your screen resolution.",t3_pdzlle,t3_pdzlle,33
Old-AF,funny,ieahrel,6720023694465202000,"Jenny From the Block didn’t get recognized on her own block? Damn, that’s some shade.",t3_vnhumv,t3_vnhumv,15
_--00--_,mildlyinfuriating,jacatzf,-4069053084189307000,"I say something after the first round. I don't care. If you're going to be rude and not care about others, I won't hold myself to be polite",t3_11dxzzj,t3_11dxzzj,28
Slainte042,CryptoCurrency,jmg6jhn,-8427766143548445000,You know things are slow when we have articles like this.,t3_13x9k5g,t3_13x9k5g,11
Pleasant_Matter2951,EbonyThroatQueens,k9gtb2a,4696711599988195000,Her daughter was in my passenger seat watching coco Mellon on my phone while her mom was eating this dick 😭,t3_17v3mp0,t3_17v3mp0,21
risen87,MarvelStudiosSpoilers,hl02601,-4262302990696733000,"Please feel free to put this in one of the No Way Home megathreads 
https://www.reddit.com/r/MarvelStudiosSpoilers/comments/qvcium/discussion_spiderman_no_way_home_trailer_release/

https://www.reddit.com/r/MarvelStudiosSpoilers/comments/np6w3j/spiderman_no_way_home_trailer_date_speculation/

https://www.reddit.com/r/MarvelStudiosSpoilers/comments/padnjm/spiderman_no_way_home_official_teaser_trailer/",t3_qw0bxo,t3_qw0bxo,17
minminsaur,soccer,dcpn3jl,6249527055153233000,"For some perspective:

Highest earner at Milan - Carlos Bacca at €3.5 million

Highest earning Italian - Daniele De Rossi at €6.5 million

Highest earner in Serie A - Gonzalo Higuaín at €7.5 million

Highest earning goalkeeper - David De Gea at €12 million

Highest earning teenager - Marcus Rashford at €1.5 million",t3_5pa7us,t3_5pa7us,53
SexHaver420_69,unpopularopinion,h70ouvp,-159870254570660000,Anybody who disagrees with this has never experienced the horror of taking an hour long nap and waking up in a panic thinking you were asleep for 13 hours.,t3_ou26il,t3_ou26il,29
lewishtt,rangersfc,k0vhb4b,1198440102125234000,"Bunch of Tory loving yoons on the night. Cunts making it impossible to support your national team and your local team, due to bigots always referring to Religious wars that happened hundreds of years ago. Keep anything that’s not to do with football out of it.",t3_16k7j3f,t3_16k7j3f,46
Mimics-,languagelearningjerk,jxwci5w,8851280859845466000,"Be drafted into the Ukrainian army, get captured, be tortured in the gulag. 100% immersion.",t3_162b35k,t3_162b35k,15
wadu3333,PokemonGoFriends,ihwz9n4,6795738500844909000,Dialga!!! Adding 10 be patient add = raid 8750 0259 1060,t3_w7dlby,t3_w7dlby,11
Synsane,TheYouShow,h1amb71,-7489146306570679000,I don't think I could take on one cattle without a weapon lol,t3_nwq5nw,t3_nwq5nw,13
some_idiot_throwaway,gundeals,gv1jv2k,2631881453430331000,Who makes the most reliable metal AR mags? I heard of geissele and their overpriced mags but wasn’t sure what was the better alternative,t3_mts1m1,t3_mts1m1,24
SmilingBuddha22,The_Donald,d997zfw,983095393809357000,"I'm a straight guy, but man. If there's such a thing as ""turn gay"", then it might be for this guy. It's not just looks either. He is smart, kind, soft-spoken and calm.  
Pardon me for saying this, but Mike Pence in his youth was more handsome than even Trump in his youth, hands down.",t3_59kpgn,t3_59kpgn,55
onefoot19toes,depression,hnxazp1,-3937031674531583000,"It will get better eventually,I was on both of those at the same dose but there very sedating at that dose so you would feel tired, could you try asking your doctor to maybe up the mertazepine dose so it won't be as sedating and use the quietapine at night before bed,might help with the tiredness aspect",t3_rcvqwp,t3_rcvqwp,57
Chaemera,KerbalSpaceProgram,coddf76,9070712533279853000,That notifies you when you've completed Contracts and nothing else in vanilla. Mods might change how it behaves.,t3_2v0lvv,t3_2v0lvv,18
chetmcomnom,neoliberal,jjg99og,-4507560774710508000,"I'm not sure if I'd dreamed the whole ""fridge will kill you if you break eye contact with it"" thing in the video game I've been playing recently",t3_13ci5xz,t3_13ci5xz,28
Professsor_Q,TwitchGoneWild,el0cght,2685052356432693000,i was in her stream like 10 mins ago just to see what she was doing. as you'd expect it was nothing,t3_bds7gb,t3_bds7gb,22
SlammedRides,paintball,ig9dfq8,8062144448283430000,"Dunno but after getting my i5, I LOVE IT. After trying to pull out the lens once, I'm getting something else.",t3_vz4k16,t3_vz4k16,21
mydogsarebrown,CoronavirusDownunder,hokxkt6,787222632859639000,"How dare the Queensland government attempt to reduce the transmission of a global viral disease. For shame.

Well done shitty news writers, you ""slammed"" them good.",t3_rgkuxh,t3_rgkuxh,26
StatelessRich,The_Donald,e9q6kgr,-1839673977536077000,How surprising that a man who tries to publicly overthrow a democratically elected president is a scumbag in his private life,t3_9x54tm,t3_9x54tm,21
sportsfan93,baseball,cgxvc4n,3486773783629296000,Abreu and Colon on the same team sounds like a gold mine for funny baseball gifs,t3_23jp1c,t3_23jp1c,16
sportsarefun918,AskReddit,eyw5czx,2095253792274088000,"Nope, no chance. Someone needs to be pretty stable and self sufficient for me to consider a relationship",t3_cz546l,t3_cz546l,18
Agirlisarya01,90DayFiance,fq8d05h,-7869773569859012000,Lana looks soooooooo uncomfortable.  David’s too busy geeking out to even notice,t3_gh0qne,t3_gh0qne,12
soulofmind,mildlyinteresting,ihnrujv,8082616151463398000,"One of these things killed my uncle’s high school girlfriend in the 80’s, it was tragic. They’re truly terrible.",t3_w7rspu,t3_w7rspu,19
mweagIe,Dirtybomb,ctwrov9,2611656593257347000,"2nd idea... Pretty damn bad. I really don't need to explain why it is terrible, do I?",t3_3gc4zs,t3_3gc4zs,17
luckyponcho,buffy,h21a0s1,5117725797171150000,I just watched it! I’m in the middle of episode 4 right now. That was actually the first time I noticed. Super weird coincidence I’m seeing the post right now! Trippy,t3_o0rafs,t3_o0rafs,31
JWestfall76,AskLE,hmpkcsp,6582343677690253000,Go down to your resident stationhouse and ask to speak to a an officer in the public liaison units,t3_r5x5zd,t3_r5x5zd,19
onemanlan,CFB,dqks2u5,8070884315114928000,Goddamn I’ve cut my work productivity in half due to this cluster fuck. Worth it,t3_7gp4kh,t3_7gp4kh,15
Ill_Transition_3882,funnyvideos,jgtuxjt,8509363571835748000,It offed itself because it concluded The logical choice would be shutting off its circuits and shutting down code. It couldn't handle the same thing repeatedly and made the smartest move to end it's suffering. This was after about 15 minutes of repeated work.,t3_12qm3dq,t3_12qm3dq,44
Suspicious_Camel894,dating,kc4gtpr,6152269514405397000,I say if they’re old enough to be your parent like they were teen parents (14-19) that’s too much keep it like or under that,t3_18bij77,t3_18bij77,25
whats_that_do,politics,dn0v91v,-8033727883680392000,"&gt; ""Trump gets eviscerated.""

I'd be ok with just that as a headline.",t3_706fqe,t3_706fqe,13
diamari90,gaymers,jvq06ok,4403333971192968000,Im 32. Me too… its five finger romance daily for me atp,t3_15nnwul,t3_15nnwul,12
ChangelingFox,DarkTide,jna5b4b,1967845657528710000,"Four surge staff psykers. Probably the lowest pressure damnation-hi run I've ever done. Even pox walker hordes were just melted under that much lightning, to say nothing of the damn near instant vaporization of anything in armor.",t3_143e94s,t3_143e94s,37
elhomerjas,Art,fr8gid1,-7097972853434114000,the flow and motion of your work is very relaxing to admire,t3_gn9t7d,t3_gn9t7d,12
r2k398,unpopularopinion,e7mu4pn,2026534296225700000,They will do anything not to get caught like murder a girl who said she would call the cops on them because they were harassing her.,t3_9njtj2,t3_9njtj2,26
nameif,Christianity,ij781eh,436312720116852000,You are 100% correct. I'm totally supporting what you've written here.,t3_whrbsa,t3_whrbsa,11
jimjamnspoon,Vaping,jnfdew4,7120086591807853000,Yeah when they refer to cooling means that the juice will have an icy feel,t3_1447qud,t3_1447qud,15
Kissmyfibro,CICO,jq4j89e,-4837113098581290000,Aw I love that. I love your enthusiasm and I love how proud you are. Hold onto that. It'll get you over the line,t3_14mz2d7,t3_14mz2d7,24
swflkeith,atheism,dtk1805,-4471307491527891000,I always get the two sons mixed up. Ones really stupid and the other is really ugly,t3_7ualo0,t3_7ualo0,17
kate_koala,nutrition,f6dos2v,1095437431963373000,"Yes, eating the whole fruit is definitely better because you get the fiber too.",t3_dr1f2l,t3_dr1f2l,14
justadude1414,confession,eb4qlla,9201358729254983000,Dude you are a jerk. Your wife deserves way better than you. Go eat some twinkies and a lot of them because the person you became is disgusting.,t3_a3a4p6,t3_a3a4p6,28
tugnasty,oculus,cik6on5,-3530401690799342000,"For individual videos no way.

But for entire concert experiences sure.",t3_29e3k6,t3_29e3k6,11
gnollcandy,OnePiece,coqaz0r,1197792331931468000,"I wonder if Pica usually follows up that bite attack with Pica Chew...

Definitely pumped to see how Zoro handles his plan!",t3_2weubd,t3_2weubd,22
Besca,Catholicism,dky4pg9,9219932291615595000,"Talk to your doctor about possible sleep apnea.  Several years ago I was having weird dreams, waking up gasping, sweaty, and we did a sleep study and found out I had severe sleep apnea...they can treat it.",t3_6qiyfl,t3_6qiyfl,37
bowlsfordays,ZonaEnts,iprlsro,4338451620700463000,"All these bomb ass food places already recommended, so i just wanna throw out dulce de churro as a GREAT dessert spot. Best churros I've ever had, and I get them every single time i see them on a menu",t3_xn39jc,t3_xn39jc,40
keybrah,CryptoCurrency,hnlsmik,4520056427174060000,"so i succumbed to the shills here and bought a few bucks of VVS to to toss in the glitter mines. feels sketchy af and like I'm gonna get rugged

also feels like where Zoolander would work

![gif](giphy|X9RBixlR36Uco)",t3_ralimn,t3_ralimn,38
Mitch_from_Boston,boston,dnt9zpn,8715539188259348000,"I usually just leave it on the curb, and some guy in a beat up pickup truck comes by and hauls it away.",t3_73u5ii,t3_73u5ii,23
SVPPB,uruguay,fndkorm,-3116029534279683000,Hasta este momento pensaba que lo único bueno del Coronavirus era que ya no pasábamos todo el día discutiendo esas pelotudeces.,t3_g15fjq,t3_g15fjq,21
TheBerg123,AvatarLegendsTTRPG,jip65e9,-814797621861886000,The Shimmers. Might be weird but it would be like the affect you see heat has on the air.,t3_135zo0o,t3_135zo0o,19
xenacoryza,AskReddit,el37he5,6278606763069502000,I have a 4 inch scar on my knee from climbing in between two metal buildings to look at some stray kittens.,t3_be3zo8,t3_be3zo8,22
The_Lost_King,NotHowGirlsWork,jhzmdbt,5325455330310417000,"I’m gunna be so lonely with only having my wife, friends, and family. 🙄",t3_1318bff,t3_1318bff,14
quantum_entanglement,FantasyPL,ebdiqap,9059617977884415000,"Legit going to need a brace from Richarlison this week, I hope he's eaten his Spinach",t3_a47bxe,t3_a47bxe,16
opn2opinion,patientgamers,ey5fmlr,-7386112150864292000,"Prey and horizon zero dawn are two somewhat recent titles that has me hooked. Both had a combination of solid gameplay, excellent sorry, and immersive atmosphere. Prey has such a good edge of your seat feeling the whole way through. Horizon was a more interesting story.",t3_cvjg4j,t3_cvjg4j,46
TreeLovingLittle,LifeProTips,jin1d7v,-2281040796574989000,Is swimming in clothes really that bad? I’ve gone swimming in cargo shorts and shit before and it didn’t seem to make any real difference. Then again maybe it was because my fat ass floats easily.,t3_135esxd,t3_135esxd,36
LeoLeChat,pussy,gcvvmod,8337762849776732000,Love your hairy pussy 😘 kisses from a French dad 💋,t3_ja3ovk,t3_ja3ovk,11
Ter551,teslamotors,dvlg5tt,-1051206416230378000,They should promise him six to eighteen billion. And give him nothing.,t3_83tklj,t3_83tklj,12
Galaxie5002012,note10plus,j8fx5fb,-5835078248052995000,"No suggestions, but I've had the same problem on my Note5 and S10e since Saturday morning.  I've spent hours investigating.",t3_11111lo,t3_11111lo,20
intagliopitts,grandrapids,imkfmsr,-1272299332351089000,Why is every chipotle I’ve ever been in dirty and gross? Is it my fault somehow or is this just normal chipotle ambiance?,t3_x2h61b,t3_x2h61b,23
McDowell14PCHD,Deji,h4nmxul,7170620845281433000,"Because KSI fanboys stay fighting with Deji fans because they ""want them to understand why deji lost to vinnie"" when in all actuality they don't have enough karma to post on the KSI subreddit. So what if Deji lost? I honestly don't don't give a shit. Why should you?🤷🏾‍♂️",t3_ogqhcp,t3_ogqhcp,49
criticallycrucial,nextfuckinglevel,iilpx0e,3225066227574622000,"Aside from the dogs and epic wrist action.. this bike bath looks awesome, where is this ?",t3_we07hp,t3_we07hp,17
shank6510,LiverpoolFC,cphz4a1,5074139042187775000,"Seems like a nice enough guy who's run across a patch of bad form. Too bad. Don't think he's getting a fair shot at LFC. Hope to see him in a red shirt next season, honestly.",t3_2zdrbr,t3_2zdrbr,36
TutSolomonAndCo,CK3AGOT,jj26ytu,3310580515958888000,"Every one of house celtigar's treasures, the horn of winter, glass candles, a sword for Rhaegar to match Bobby's hammer",t3_139c00a,t3_139c00a,20
jimicus,talesfromtechsupport,c5o0lx2,-8889207223823370000,Reminds me of the time I looked after 120 windows 9x machines. Only I was doing it for a year.,t3_xn8cj,t3_xn8cj,20
Glitter-Herpes,britishproblems,cg9ozlr,-780912315054705000,The only time I've commented on an item from a customer's shopping is when she had an issue of The Writer's Forum magazine. We had a lovely chinwag about writing short stories as she was packing her shopping in the bags.,t3_214s4f,t3_214s4f,41
Biscuits4u2,gaming,ivf7ja5,-5155695274151648000,Why wouldn't I? Are there people who wish for games to suck?,t3_yokqyl,t3_yokqyl,12
aspectofdoom,bladeandsoul,d1msvpt,-7249987164170248000,Speaking of which does anyone have a translation of what each class is saying when theyre using their skill? Especially curious to fm,t3_4cy9cj,t3_4cy9cj,23
Rndomguytf,Cricket,gtbi8or,365527029423100000,Remember a few months ago when people were laughing at calling Green's bowling a bonus? I don't think he's even gotten 10 wickets the whole summer. When was the last time he even took a wicket?,t3_mjko2t,t3_mjko2t,36
goodguy1994,soccer,cgppgh4,5832951839258051000,"Sometimes when i see his goals like this, i think what could have been?",t3_22q3v6,t3_22q3v6,14
idontknowwhatsthat,Stims,f01v3wo,-1494035770333239000,I stay around 190 but I’ve dropped to 170ish from not eating on binges (6’5),t3_d322kn,t3_d322kn,15
AHSWeeknd,hernameisbanks,hyj47ov,-4574434147502059000,"The Devil gave me Gemini Feed and Gimmie vibes, in the sense that it’s unconventionally good.

But I also love Holding Back, it’s such a great direction for Banks",t3_t20myn,t3_t20myn,29
Miserab13andMagical,fourthwing,kate3xs,-3559780705571844000,"I interpreted this as Xaden has been having similar dreams as Violet w/ the venin speaking to him, & therefore somehow he knew the leader wanted to try to draw him into one on one battle.   But she left it intentionally vague & mysterious in IF & we will find out more in Bk3!",t3_1840k2w,t3_1840k2w,54
