author,subreddit,id,hash,body,parent_id,link_id,length
englishinnewyork,stupidslutsclub,djrnesc,4953745733835226000,"Sounds like an amazing time, oh to be a fly on the wall of that house :P.

I wonder and hope Gwen can top that experience for you... she's got big boots to fill!",t3_6l6rr8,t3_6l6rr8,34
zanmatoXX,FinalFantasy,k50akdf,-808882793692310000,"I don't miss that, I enjoy these games for what they are",t3_1788sb5,t3_1788sb5,12
MarbledFUPA,fatpeoplehate,cpb5yfj,8742378141296003000,"&gt; vows to take care of her body

More like vows to just sit and laze around like the ham she is so as to not injure her back.",t3_2yl9u2,t3_2yl9u2,29
whippetshuffle,antiMLM,dw30x65,-6735273366629341000,I know a girl who posts with this many emojis [all the time](https://imgur.com/a/6dftw) and isn’t shilling anything. It’s bizarre and whenever she’s in my newsfeed I’m surprised it’s not an MLM pitch since it’s so clearly in the same format.,t3_867wa2,t3_867wa2,40
-Matti,FireEmblemHeroes,dflewrq,-198154077586341000,"Klein, he can kill almost every unit (except Hector, maybe Male Robin and no one else I believe, since I gave him Luna) with a hone/rally Atk and the support of a dancer.",t3_62btfj,t3_62btfj,33
Token_est_broken,TorontoMetU,ka32qzu,-4849798875154029000,"Hi what's up I'm 19M in Comp Eng  
Not sure if I'm too late to this thread but I'm super down to meet friends outside of my program  
Hit me up on IG, I'm more active there: @ aronnodunno",t3_xfenx5,t3_xfenx5,39
kesawulf,steelseries,h4lq39q,-8645199724491264000,"If you have a soldering iron, a screwdriver, and some time you can. You need to look up what type of battery is inside and order it -- I was able to replace my Arctis 7 battery with no issues.

I think this is even the same guy that had a video for my headset. https://www.youtube.com/watch?v=_AsoYBUUhTM",t3_ogrbbv,t3_ogrbbv,56
SNEAKYdoodLE11,GetMotivated,hpv7pht,1933379096661282000,For how many terrible things we humans put dogs and other animals through we OWE them this much.,t3_rnyc98,t3_rnyc98,18
jvdbization,LiverpoolFC,c5z87h4,6661677774478240000,One day he'll be a butterfly.  I've never seen a butterfly walk.,t3_yvhf5,t3_yvhf5,12
FortPhoenix,LSD,g5jthkz,7492909507604340000,"Hey man, I’d be confident in saying those gel tabs aren’t 250ug. While it is possible, every seller says 250ug for some reasons. I’d be willing to bet they’re between 100-150ug",t3_iuafyg,t3_iuafyg,31
Stormdancer,subnautica,dgt3id7,4934498662326395000,"Yeah, the lockers and the duffle bags are both bugged this way. 

I got REALLY lucky, apparently, because I used the floaty-lockers to store a TON of stuff in, before I realized just how easy it actually is to build a base and put proper storage in it.",t3_67s1a8,t3_67s1a8,48
jay_jay63,BBW,gerarc5,-1461671407711463000,Definitely picking 1 i want to pull those off myself 😈🥵,t3_k7ja3a,t3_k7ja3a,11
that_one_guy37559,perfectlycutscreams,ixy4gwp,-9090108961106185000,This is one of the most pussy moves I've ever seen,t3_z57svt,t3_z57svt,11
dirtysoccer,BuddyCrossing,gqnslbc,-7870205506495630000,I have all that in my bank I will trade it 1 for 1 of whatever you will part with,t3_m3aca4,t3_m3aca4,20
4vrf,stopsmoking,jflk57v,2037716312474031000,"Oldest trick in the book! Congratulations on trying again. Just remember, there IS an ""other side""",t3_12gl54m,t3_12gl54m,16
sarcasm_is_coming25,Reduction,k1h1lw2,2680540008306669000,My surgeon told me I could have full range with my arms right away as long as it was comfortable! I was messing with my hair right after surgery and it was fine.,t3_16n67ku,t3_16n67ku,33
NotMeNorMyself,prettyaltgirls,eh8qn30,-8848953641980296000,"Weren't the best of times, but they had their charm for sure.",t3_aukyds,t3_aukyds,12
MantraProAttitude,bicycling,j2sqxqv,-2438292129668813000,That’s some BS right there. I know where I would file those.,t3_102ef3d,t3_102ef3d,12
happssss,PokemonGoFriends,gekomvw,-6487796452494335000,"Please send gift to us when you add us!!!

735206163687 - happsss

408414677104 - Laughs

045989258428 - wei8888jian

089748946267 - Vallywallyyy

157609783931 - Pal8592

756712762986 - Zhenjie90

578873125516 - Juayhung",t3_k3e3ul,t3_k3e3ul,30
padraigharrington2,neoliberal,hgfnffp,806627682585844000,"have decided to make a new political party with one policy platform slash demand:  


# 1. EUTHANIZE FIVEY",t3_q6gc6f,t3_q6gc6f,18
Pikkutuhma,ArkhamHorror,fwpouhw,369638403048506000,"If you mean 2nd edition, then yes. Remember to draw until you get the right color other world card.",t3_hk02hd,t3_hk02hd,19
Splatter_1,pcmasterrace,fr9iukd,-8933231404285144000,"That stuff is only needed for 30fps. Consoles should have them on.  But we running on high frames so off.  Now picture grain.  Should not even be an option, period.",t3_gng20f,t3_gng20f,30
gallope,Games,c56df7g,-4552111951981911000,"TL;DR: r/games mods making thinly veiled steam advertisement

I wonder how much and whom Valve actually pays around here to turn every gaming subreddit into a big Steam marketing project.",t3_vp0a7,t3_vp0a7,30
Wyguy2087,SMG4,g3g7p5r,-4955474470157917000,while were giving side characters arcs where my heavy weapons guy arc? or my peach arc? or my bowser arc?,t3_ijt6p3,t3_ijt6p3,20
KanyesMirror,NYYankees,ih51ckw,-7907409621807099000,Man we just have not felt like the yanks were used too over the past 10 games,t3_w4y86w,t3_w4y86w,17
PatchouliTea,habbo,jmtcqge,5514848035218336000,Might be safer to not click it and log onto your habbo account directly from the habbo site and check security settings from there,t3_13za9h4,t3_13za9h4,24
Michkov,Austria,dqo4u79,589429671496386000,"Jeder Tequila taugt für das, wichtig is nur das du statt Salz Zimt und Orangen statt Zitronen mitkaufst.
Die letzteren gibts in der Obstabteilung, Zimt meist bei dem Gewürzen, da willst du den gemahlenen.",t3_7h3jd9,t3_7h3jd9,34
yaosio,BethesdaSoftworks,e0p7qfu,1877519127900574000,It depends on how popular the game is. If it's super popular we can expect it to get constant updates and last for a long time. WOW started in 2004 and is still going strong today.,t3_8r6y2s,t3_8r6y2s,36
scilRS,IdiotsInCars,h94ugeh,730012997405317000,Curious…. What would the law say if you drove through and essentially let him hit you? He’d be at fault yea? Sounds like it’d be worth it to give the ass hat a reality check.,t3_p54pil,t3_p54pil,35
Cock-u-cum-ber,memes,gjax6ak,5834373154542780000,"Grampa, 80 years later comes back as a ghost and unplugs my life support

         You just got vectored! Uno reverse edition",t3_kx94dx,t3_kx94dx,21
Real_Monger,r4rplus,ft0tl0j,8699937502323388000,I hear good things about the last kingdom. What are your ethnic backgrounds?,t3_gxd51l,t3_gxd51l,13
onionbananajuice,TheLastAirbender,gijozh4,1881786829793492000,He really doesn’t to me. Could be the black clothes though maybe? I don’t think we ever really saw someone in all black like that before,t3_kt40n8,t3_kt40n8,26
Mood_Lifting_Meals,cookingvideos,gsw80mb,-6345697655272954000,Looks really great! And I am pretty sure it is tasty too :),t3_mh0qtl,t3_mh0qtl,13
ArcticJew666,gaming,ewpkv40,-515384915961477000,"But it's worth it for the Boots of Blinding Speed, right?
RIGHT‽",t3_cpg7h2,t3_cpg7h2,12
egzon27,running,kd26824,-8665857743705623000,"Air quality is absolutely awful where I live in the winter. Tonight it says its 154 AQI

Is it recommended to run in this kind of air?",t3_18ge4ng,t3_18ge4ng,27
angi2021,piercing,i6z327l,950244485964429000,"I have the same placement! I’m just worried that the bar might b too short. There needs to be space so when the conch inevitably swells, your skin won’t consume the back.",t3_ug43zz,t3_ug43zz,32
GrimaceGrunson,SquaredCircle,eht5aau,-346229041935404000,"Random aside: for as burly a dude as he is, always though Batista’s smart-casual style was on point.",t3_axf2dc,t3_axf2dc,18
New-Tomato-5676,DnD,h7dtb6r,4066882950385085000,Help me I’ve taken 50 damage this round… I could use some TLC ;),t3_ow1095,t3_ow1095,14
AstunisWWW,books,dycaipk,-5116747507617319000,Mine is the Dark is Rising sequence. I reread them every winter. No idea why but I love them!,t3_8gin5l,t3_8gin5l,19
SeaNitroWolf_,AbsoluteUnits,ia14eeq,-8045595419521739000,And completely harmless to literally everything because there are some herbivores that will fuck you up if you're not careful,t3_uxdijh,t3_uxdijh,20
hannah-ollies,gradadmissions,j6pk6f2,-1634417229359768000,A lot of schools offer alumni email addresses! It'll still end in an .edu if you're worried about getting sucked into a spam filter.,t3_10qa9nq,t3_10qa9nq,24
NeilOhighO,gijoe,c9kw3pw,-4512277254020667000,"I don't know of any specific weapons being produced with the process right now, but I do know the process itself is called Vac-Metal or Vacuum-Matallizing. I saw a guy who was redoing Destro heads on one of the forums using this process, but I can't remember which.  But there are customisers out there doing this.",t3_1cx46c,t3_1cx46c,56
ShareTheLoadMrFrodo,CelebNudeDebut,ev2t8lt,6445773574885399000,"One of the best posts on there, I would say this almost merits a crosspost to r/extramile",t3_ci385o,t3_ci385o,17
zlotv0r,DotA2,cycjfpg,1337324121630018000,"the thing is... THE NOOBS DON'T WANT TO BUY DETECTION! so, u know, he kill them or do hard dmg and ghost walk, see u later :)",t3_3ybv5h,t3_3ybv5h,27
Ballsohardstate,nfl,hcw81qw,6212281143787794000,That our pass rush is bad.  Our rookie edge defender led the rookie edges in pressures and did so on limited snaps.  Oweh will be a very good edge defender by years end and will make our pass rush good.,t3_pobvbe,t3_pobvbe,40
Andrewescocia,JoeRogan,fhxz5rb,-8382843917328922000,"but David is in front of things being driven, is he going to be destroyed?",t3_f54pip,t3_f54pip,15
ic33joe,RPClipsGTA,k92n8za,-7759721222321636000,The SDSO was like Reno 911 in my eyes. But dear god they are some of the best cops.,t3_17u63et,t3_17u63et,19
Fernan4527,AskRedditespanol,flu6q6i,5901891765762318000,"Ve con la primera, ya que la conoces más y ya existe confianza",t3_fr28zz,t3_fr28zz,13
soupyquinn,HistoryPorn,czlvytc,2139336326804647000,I'm a bit confused as to what's going on here. Are all those people on top of his tank?,t3_43xdmj,t3_43xdmj,19
Zefla,Fantasy,dvob1g3,8097200406357850000,"Looks visually stunning, but I can't say anything about the movie quality. I'm happy that the laughing fat guy is in there, but we don't know if we'll get more of Newt's shy badassery or the other great characters that made the first movie so good.",t3_848cws,t3_848cws,46
AlissonHarlan,TrollXChromosomes,i474nte,-6348602913892161000,"Me and my sis deserve to exist to be ourselves.
Be who you are, and be who you are for yourself, sisters!",t3_u0a4ct,t3_u0a4ct,22
Mai4eeze,GenZedong,gb8opc6,2474665791496560000,"poverty 538 - 0 equality

big pharma  538 - 0 free healthcare

war 538 - 0 peace

rapists 538 - 0 everyone else

money 538 - 0 human lives

police violence 538 - 0 justice",t3_joi56d,t3_joi56d,35
byehaveabeautifultim,AirForce,eyak4hl,7515236992707950000,"Not to steal your thread, but my recruiter told me if I don’t accept the job they offer me I am barred from entering the Air Force for 2 years was just wondering how accurate that is",t3_cwf7ti,t3_cwf7ti,37
lucasfain,BMW,ehyew1p,-7697365504241893000,"I saw one of these in the same exact color, on my way home from school",t3_ay2trp,t3_ay2trp,16
nikgrid,DC_Cinematic,jng0fdd,-6364927115307773000,They won't do him as good as Zack Snyder did him.,t3_144b5r4,t3_144b5r4,11
docbadfish,aww,dxgtk96,-4907597790518779000,"Jump around, jump around, jump up, jump up and get down",t3_8cfuau,t3_8cfuau,11
Im6fut3,blunderyears,ecz1gqz,-18626372736725000,"Ok I looked very similar to you at that age too. Lucky for me, for my 7th birthday, my aunt took me to get my ears pierced, ""so people will see that I'm a girl!"" Thanks Auntie!",t3_ab84c7,t3_ab84c7,37
hellish0098,PersonalFinanceCanada,k3w5xv4,8109820447391341000,"I am not where you are getting your info - ‘wages not keeping up with inflation’….

The data reported yesterday stated the opposite - wages are in fact growing and keeping up with inflation",t3_172depc,t3_172depc,34
I_MildlyLikeNature,CozyPlaces,irmsm7n,3294087833169121000,I already posted this last night and then went to bed but forgot to put the “OC” thing and it got removed 😭,t3_xzl2fm,t3_xzl2fm,23
Alexodf,Quebec,j6mobb7,2528566623894060000,La spatule du Dollarama qui se split en deux quand elle va dans le lave-vaisselle.,t3_10pxsb9,t3_10pxsb9,15
nad1988,DrMartens,kbnw50o,1128413790658004000,Mines still haven’t even been dispatched 😭 when did you order? I was the 27th. I can’t wait to get them they look stunning 😍😍,t3_188myct,t3_188myct,25
BlueHot808,ThailandTourism,kf3041m,3534744376243974000,The fireworks at Icon should fit that bill perfectly. I thinks going to be a bit crowded (to say the least).,t3_18p7bwq,t3_18p7bwq,21
Urmomsays_hi69420,HolUp,gtyutlu,-7076442132735676000,Who is the guy on bottom right? (Askin because I need to take a wank),t3_mnczcg,t3_mnczcg,15
BenjaminLawsky,Bitcoin,cle5kdp,-3760480809623889000,This is another bullet for my Regulation Gun. *It's fully loaded.*,t3_2jq12e,t3_2jq12e,11
R-Weeb,wholesomememes,givt6rl,-5824264532384728000,It is my experience that the relationships don’t have to be healthy and supportive to help,t3_kus7bz,t3_kus7bz,16
linziboo,Rateme,cl98530,-3520786173058988000,"Nice gains but you have to work on the rest of you as well. You just look misshapen because your arms are way bigger than the rest of you and it looks kind of whack. 

Like your arms literally look bigger than the rest of your body. And your legs should be the biggest (stop skipping leg day)",t3_2j7u1z,t3_2j7u1z,58
Void-splain,polyamory,g0tlvyu,1130218173011223000,"Some asexual people are kinky, just to chime in on that. I don't like that they're being weird and cagey with you about this.",t3_i65dca,t3_i65dca,24
comicsnerd,Tinder,k56jzhc,5747731258709621000,"Speaking from experience, the putting catheters in is not such a problem. Getting them out is also not a big problem. Having to pee after the catheter was removed, is a BIG issue.",t3_179a0vx,t3_179a0vx,33
blue4029,BokuNoHeroAcademia,gmvsn29,-8082445448300720000,kaminari and jiro are pretty much already a couple at this point,t3_lgq9lh,t3_lgq9lh,12
SteriotypicalMerican,Rainbow6,g40vf36,-6273506094121340000,I don’t play pc but I’m pretty sure its normal because I’ve seen it in a lot of pc youtubers videos,t3_imlrmb,t3_imlrmb,21
bananapanther,bodybuilding,j0o5s9n,-6641130338362040000,They treat this like a fucking awards show where they jerk each other off instead of a competition.,t3_zo5tbc,t3_zo5tbc,18
Blazener,HFY,hj55725,-7149464369484682000,Minnesota’s important 🥺. Great story though!!  Coming from a dude who weathered -70 round these parts!,t3_qllilk,t3_qllilk,16
MeaMaxima_Culpa,AFCNorthMemeWar,ipq3ily,-2356327498052782000,You guys had to completely scheme around him and dedicate three blockers to him on any given pass play. Dan Moore’s contribution was (1) getting embarrassingly pancaked as an OL somehow and (2) serving as 1/3 of what was needed to block Garrett.￼,t3_xlzk2b,t3_xlzk2b,43
elsa002,trans,igmnohj,-6639398170001150000,"Didn't measure it, but 5.5 months hrt and it seems to be smaller",t3_w1rsr3,t3_w1rsr3,13
AgusTrickz,leagueoflegends,e8x3m0u,3888890607077245000,It was nice while it lasted. We'll see you all next year,t3_9tldkc,t3_9tldkc,12
Inner_Department3,nextfuckinglevel,gd5d8xt,-5647190331880334000,"I find him to be completely unbelievable and I'll tell you why...

&amp;#x200B;

He's too articulate.",t3_jyi4d1,t3_jyi4d1,16
AndShlav,PostMalone,eovpvcf,2839186504568253000,"This is from an instagram post or story from a long time ago, I remember this I wanna say it was right around the time rockstar or pshyco came out.",t3_bt9054,t3_bt9054,30
Ok_Championship9073,AskReddit,k2o515e,-1641422993283606000,Chapter “who knows at this point”:How the hell did this go wrong,t3_16ubyn7,t3_16ubyn7,12
FREE-AOL-CDS,Futurology,keo3zdc,8291878070497563000,"I’ve had an idea similar to this for YEARS, but I don’t have bottomless university funding to make it happen.",t3_18pfszf,t3_18pfszf,20
RevenantPenguin,ReBBRL,e5ro3ba,-2503200557462677000,"/u/shock4ndawe when are you available? I'm a bit behind on getting you a message, but I'm currently PST (i.e., it's 9:43 PM at time of this posting)",t3_9difyh,t3_9difyh,27
Pretend-Run571,GuysFromBehind,hiu5v8g,3877147889888818000,Fuck bro I wanna eat your ass the slide inside and pound you,t3_qjwytj,t3_qjwytj,13
kendrahawk,cactus,i3pkgnm,-4576653601176809000,This is so amazingly beautiful! I could sketch these all day,t3_txtt4m,t3_txtt4m,11
Harkxium,pkmntcgtrades,jori72b,-408722946006285000,Anything in my recent of interest? i like the towering perfection boxes and some of the trainer singles.,t3_14dt8uy,t3_14dt8uy,18
EzraIm,memes,hq7fetj,-2511266023060898000,My hand works fine aint gotta worry about kids that way,t3_rpwt6c,t3_rpwt6c,11
sois-memo,PlantsVSZombies,fyzp0ut,-5112112842555560000,Is it a video or not because if it is a video it’s not starting,t3_hw6t90,t3_hw6t90,15
Triantaffelow,AskReddit,cakaxuy,-6844440351199798000,"A really fancy, lavish and old gothic style mansion/estate. after everything property-wise is set I'd spend lots and lots of money on learning pretty much whatever I want. Stuff like martial arts, language tutors. Stuff like that. And then... I would become a freelance international super spy/adventurer for hire.",t3_1gg8n0,t3_1gg8n0,49
Old_Understanding325,AskReddit,jef3wey,-1304168991127885000,"The Prey (1983). It mainly consists of a bunch of random nature shots to prolong what is supposed to be a horror slasher film. The makeup effects, acting and kills are also subpar.",t3_127oweh,t3_127oweh,33
Shady-85,Visible,ft0xlmh,2567016345934643000,"Neither I nor my family have had any adverse issues with Visible thus far. However, Visible is a no-contract carrier, so jumping ship to another carrier that provides better service is a simple matter.",t3_gx3m9v,t3_gx3m9v,34
Pizzanomnommer,The_Donald,d77k5wf,-4765231496638257000,"The media would sure like some war...

""My argument is that War makes rattling good history; but Peace is poor reading.""

 - Thomas Hardy, English novelist and poet",t3_50vefn,t3_50vefn,28
Traditional_Regret67,awfuleverything,imv58vj,3560833238602424000,"Hey Jong, how's that retirement plan looking?

Fuck you Zeng (Sob) fuck you...",t3_x41vv4,t3_x41vv4,13
twwwy,cursedcomments,fxrh0mt,-226564459379840000,A fat-ass princess just prancing around on a 1st-class ship shoved the guy who saved her off a plank with enough space for the both of them. HOW FUCKING ROMANTIC!,t3_hpf6gl,t3_hpf6gl,30
Puzzled_Put,nonmonogamy,h9t3zlb,1871255910368001000,"Of course. Why would you not? 

I suspect the answer is that people are less likely to want to have sex with you. Which is true, but intentionally concealing information that someone would turn you down for if they knew it is really not okay.",t3_p8ss4s,t3_p8ss4s,45
1upIRL,pokemontrades,cfg4byz,-4375821499910220000,"I have a living dex, minus Poliwrath, Machoke, Kadabra, and Graveler. I can long-trade you everything else. note: Not all of my Pokemon are Kalos-bred.",t3_1xzsdu,t3_1xzsdu,25
HardcoreKaraoke,SquaredCircle,hdwo1j1,7087951517712174000,"That match was fucking incredible. I get why they ended it the way they did but man I wanted a definitive finish.

I'm so excited to see them run it back though. Which I guess is the point of the finish lol.",t3_ptiii3,t3_ptiii3,42
Jgpilot78,awfuleverything,if06l1t,9066332823302024000,"Go speak to your republican friends, family and politicians if you want change. They are leading the charge for mass shootings. The shooter was a huge trump supporter.",t3_vrugjm,t3_vrugjm,28
THICC_Viking,gaming,hn9jkjf,-3250173475121707000,"The ending of Assassin's Creed Black Flag. The parting glass starts to be sung, you see all of the friend you lost along the way sitting at a table while Edward greets his daughter. It nearly brought me to tears",t3_r92buf,t3_r92buf,40
joeyramone09,GreenBayPackers,g7j27wf,6386508294684740000,"""Nach links raus und der findet Jared Cook der macht die prima Ballerina auf den Fußspizen da!!""  Beautifully said",t3_j4hb37,t3_j4hb37,19
Inevitable_Base_6058,AutoZone,ht000fc,-677733257568636000,All the time. Very rarely get less. Once had 75 and once even had none. But mostly more then 250.,t3_s5oyz7,t3_s5oyz7,20
AnthoZero,SpoiledDragRace,eytnwau,3415809977866990000,i am *obsessed* with olive oil. omg i can’t believe i just said that out loud.,t3_cx1qn9,t3_cx1qn9,16
LickyBoy,ExpectationVsReality,ihh29rx,-4315254504379379000,"I saw a commercial for this yesterday. Looked so good I actually went to a real restaurant for a chicken sandwich. Was a great night. 

Glad you posted this so I dont try the actual one.",t3_w6w6fk,t3_w6w6fk,36
dumbdude545,pcmasterrace,gpdprgx,-4960452996558182000,Dont worry. Better than psu exploding. I'm still amazed it's happened to me 3 times. Last time though had to pull out the fire extinguisher. Poor fucking board still works. It's amazing. PC was literally on fire.,t3_lvskd2,t3_lvskd2,37
Mayor_Of_Furtown,mildlyinteresting,ia9ztfv,-8723253902825801000,"If it makes you feel better, it probably did even more damage to the goose. 
BTW have you seen their tongues? Weird shit",t3_uz1mnp,t3_uz1mnp,23
prbroo,CompetitiveHS,jfzj5ix,701901250304888000,"Hit legend today after being 1 win away 10 times between yesterday and today.

I climbed with the VS pure control pally list and switched to Meati's list today to hit legend.

&#x200B;

AAECAZ8FBIbiBKHiBISWBYWlBQ3rnwTJoATi0wS/4gTy7QSrkwWBlgWDlgXAxAXBxAXKxAW6xwW1ngYA",t3_12ioeck,t3_12ioeck,34
ArcherMB,gaming,chfkwou,8795750788611560000,"I find it odd that The order was included as the only exclusive game there... Related, there's a lot more upcoming games that look great in 2014/15",t3_25b7ym,t3_25b7ym,27
frank999999999999,GreatBritishMemes,j0cdj1s,5409086100941933000,yup literally minus 6 and this guy whos in shorts say he isnt cold. wtf u lier,t3_zm3w4p,t3_zm3w4p,17
IlLatoOscuro,Hotwife,dur176o,2793305578888656000,"There's something quite special and super sexy with a beautiful woman sucking cock like that (and especially with those ear pearls) while getting fucked at the same time. 

10/10.",t3_7ztrx4,t3_7ztrx4,29
Dakanza,2asians4u_irl,keq9wlk,-8329664055623997000,Mother tongue… Indonesia? Huh? Are you sure? The people make these map sure don't know the stuff.,t3_18po9ck,t3_18po9ck,17
rainman002,psychology,c7ja7a7,-4229304299304901000,"Extroversion:        11%
    Agreeable:           05%
    Conscientiousness:   41%  
    Emotional Stability: 93%  
    Openness:            72%
    Cognitive:           16/16",t3_152qnq,t3_152qnq,13
Rndomguytf,Cricket,g8o6shw,-3335504364994726000,Bowled him 2 balls into the over. Fair effort by Tasmania to get so close to drawing the match,t3_ja86zx,t3_ja86zx,19
tman1500,FinancialCareers,h7gzb75,3611001001795109000,"can u go back in time, study harder, get better grades?",t3_owi6vy,t3_owi6vy,11
drdava,masterduel,i82mjkb,-3195933010470320000,Yugiboomer don’t even know that chaos is old vanilla Beatdown &amp; mirrorwall ftw,t3_umlwft,t3_umlwft,13
Doom_Lorkhan_Drum,NonCredibleDefense,iri2eh2,286373199021700000,"A POWERFUL TRUCK, A POWERFUL ROCKET ADD TO THAT A BRIDGE AND PRECISE COORDINATES AND THE FORMULA IS COMPLETE.",t3_xyo9c2,t3_xyo9c2,19
iNapForALiving,NASCAR,fraytpv,944355235312051000,Officials: if the track is still dry we will finish the race,t3_gnk3s1,t3_gnk3s1,12
Denkt,harrypotter,dbzmfzk,-4001291770476666000,"McGonagall did play quidditch while she was a student at Hogwarts but that long before James was even born.

Also 1970 don't make to much sense for James as he was born in 1960 so he would not even be a student 1970 however the movies may have changed their age a bit to make them older.",t3_5lx6ni,t3_5lx6ni,57
Firpoint,AnimalCrossing,hyac464,-7764157249234563000,I get that urge too. And I'm not even done with remaking mine. But then I remind myself that I'll need to do so much stuff over again and it just ain't worth it. All the tutorial crap...collecting bugs...etc.,t3_t0in2g,t3_t0in2g,39
Dwayne2kasdfjkl,FortNiteBR,es5kf7r,3596339777624865000,I got toy trooper but might never use it after the first game the feet just bothered me,t3_c5y9ql,t3_c5y9ql,18
EmbarrassedLock,pcmasterrace,g9f818t,-7717900310200326000,"if my keyboard doesn't blow my eardrums, its a bad keyboard. I am not joking rnow, I love my loud af keyboard",t3_jeivtc,t3_jeivtc,22
Ornery-Swimming-4841,Sneakers,hzlkkox,-4425089166448152000,"I personally think all of these are 🔥, except the Yeezys, no hate or anything, just not my taste",t3_t7hckq,t3_t7hckq,19
xxcapricornxx,MortalKombat,fduxrkw,7474291813813951000,I find the Sonya vs Geras match-up to be the only bad match up for Sonya. Jade vs Frost and Shang Tsung are pretty rough for Jade. There are definitely bad match-ups but I think it's variation dependent in most cases.,t3_en4sg2,t3_en4sg2,41
_programmeKid,im14andthisisdeep,es8t62z,7244018668521862000,i don't know if i should be mad at the person who made this for shitting on an actual problem or not.,t3_c6hlmr,t3_c6hlmr,22
damn_yank,AskReddit,day9s5d,5433000097352643000,"Loose Fur's ""Hey Chicken""

""I'm livin' rent-free in the back of your head.""",t3_5h6puz,t3_5h6puz,13
KP67s,SWGalaxyOfHeroes,dciznx3,115496743200181000,"FYI, I think someone on the main forums did the math on potency and Fett's leadership and apparently it's a boost based on FETT'S health, not the health of the character. This is probably a break in his leadership, but it's been tested. Check out the pictures one poster shows and his math:

https://forums.galaxy-of-heroes.starwars.ea.com/discussion/85952/how-much-health-does-boba-lead-give-bounty-hunters",t3_5fanb5,t3_5fanb5,54
