author,subreddit,id,hash,body,parent_id,link_id,length,comment_dimension
yundot,AskReddit,c8ubiup,-3944415218753192000,"This isn't me but I have a friend who mispronounces frustrating as ""fustrating"". The worst part is he prides himself in speaking well, often with  obscure or sophisticated sounding words. It bugs me so much. It's so frustrating! One day I had to tell him it made him sound like a child.",t3_1a5jwt,t3_1a5jwt,52,conflict
National-Idea-4776,Construction,j6ioxpw,5582733272161118000,Carhartt will fix it free. They put a new zipper in mine and shipped it back,t3_10ogo02,t3_10ogo02,16,conflict
Synsane,TheYouShow,h1amb71,-7489146306570679000,I don't think I could take on one cattle without a weapon lol,t3_nwq5nw,t3_nwq5nw,13,knowledge
Altruistic_Wish_5557,phinvest,ik3tpjm,-4192577657822007000,For critical illness coverage di na pwede yung pre-existing condition ng mama mo e=(.. ang option na lang ay ikuha sya ng HMO na macocover pre-existing condition nya after a year (depende sa policy ng HMO provider).,t3_wn7lw7,t3_wn7lw7,37,knowledge
TDplay,assholedesign,eemuztn,79253494535380000,"I'd unblock YouTube on my Adblock, but what REALLY gets me is when it puts an advert in the middle of the video.",t3_ai2r07,t3_ai2r07,23,conflict
AnthoZero,SpoiledDragRace,eytnwau,3415809977866990000,i am *obsessed* with olive oil. omg i can’t believe i just said that out loud.,t3_cx1qn9,t3_cx1qn9,16,fun
TasteCicles,interestingasfuck,jbdfsnw,3609811614245411000,Is he really a 26 handicap or was that a joke?,t3_11lkb11,t3_11lkb11,11,conflict
whats_that_do,politics,dn0v91v,-8033727883680392000,"&gt; ""Trump gets eviscerated.""

I'd be ok with just that as a headline.",t3_706fqe,t3_706fqe,13,conflict
crlogic,pcmasterrace,jh0zd28,8728350000498719000,Glad I went 1080 Ti to 3080 Ti and not 3080.  First thing I played was the Dead Space remake and it used 9GB+ of VRAM the entire time… probably should’ve got a 3090,t3_12slb4h,t3_12slb4h,34,conflict
superjerry,WheelchairJimmy,cbu7sud,6563122399004905000,Drake the type of nigga that licks his finger and fixes your eyebrows for you.,t3_1kwpip,t3_1kwpip,15,conflict
joshhear,Gunners,e0pd415,3250521784151747000,Eventhough we have LBs i would love Alaba in an arsenal shirt.,t3_8r6f6w,t3_8r6f6w,12,social_support
PeeEssDoubleYou,AskReddit,e28zm7v,8511706423569097000,Not very? Now if they tried to implement robust gun control....,t3_8y90v0,t3_8y90v0,11,respect
chameleondoesitagain,Pixel6,in2gqqx,7113490532185693000,delete the file app so that it deletes all the update patches and then try to redownload it.,t3_x5d8zg,t3_x5d8zg,18,knowledge
R-Weeb,wholesomememes,givt6rl,-5824264532384728000,It is my experience that the relationships don’t have to be healthy and supportive to help,t3_kus7bz,t3_kus7bz,16,knowledge
y333zy,Mcat,dctu5wo,-5930436835021822000,I garbled water + vinegar and it worked wonders. Yes you will gag from the awful taste but it coats your throat and you won't have that terrible feeling,t3_5prudi,t3_5prudi,29,knowledge
GravityCat1,DotA2,cjf1hv1,4300312927095071000,"Yes all of them, but in the end it's up to you if you want to do it. You can't just pick which matches you've played that you want to show in your history :P",t3_2cfud9,t3_2cfud9,35,knowledge
Wild_Meeting1428,cpp_questions,kccy5bo,6654261703385465000,"Yes, we started to use vs2022 with clang15 at my job. It's pretty neat. The only thing is, that you must compile all external libraries which use coroutines also with llvm/clang. Since the ABI is officially not stable/ not compatible.",t3_18cizk9,t3_18cizk9,40,conflict
soulofmind,mildlyinteresting,ihnrujv,8082616151463398000,"One of these things killed my uncle’s high school girlfriend in the 80’s, it was tragic. They’re truly terrible.",t3_w7rspu,t3_w7rspu,19,conflict
NicoNicoPink,thomastheplankengine,iapm0kb,3637176741681937000,you did not have to write the Kanga porn that well.,t3_v1wq9a,t3_v1wq9a,11,conflict
FortPhoenix,LSD,g5jthkz,7492909507604340000,"Hey man, I’d be confident in saying those gel tabs aren’t 250ug. While it is possible, every seller says 250ug for some reasons. I’d be willing to bet they’re between 100-150ug",t3_iuafyg,t3_iuafyg,31,knowledge
abba77,keto,dttgyly,6588438693356740000,you look awesome. love the 6 photo set progress pic. can really see the changes.,t3_7vkgbd,t3_7vkgbd,15,social_support
manonamoambo,EpicSeven,ek5t94b,3261343700871319000,"try it out first and report back to us please. Hear some player have their knight as 5 star doing w11 so maybe as long as you hit the hp and def threshold and your healer are fast enough to keep up the heals, there's no need in 6\* him just yet(or ever even).",t3_b9ns2v,t3_b9ns2v,54,knowledge
etds3,AmItheAsshole,gjat6l0,-8883005092456004000,NTA if you keep the door locked. Not for protection from snooping: she gets what she deserves if she snoops. But sometimes you get turned around in an unfamiliar home and go in the wrong door. You should lock the door to prevent accidental entry.,t3_kxkltl,t3_kxkltl,45,conflict
ninmuffin,pcmasterrace,cw4jpuw,-7661663434312951000,"At least I found this give away before it ended, unlike the last one that I found just as it closed.",t3_3p9k87,t3_3p9k87,21,respect
Spider__Jerusalem,battlefield_one,diqh4pe,3079242542054842000,"""And free DLC!

Just kidding, go fuck yourselves!""

**EA. Because fuck you, pay me.**",t3_6ghr83,t3_6ghr83,14,conflict
Timely_Zone9718,GregDoucette,jlqxx96,-5119669457355862000,"I’m around 175 and look pretty similar to you, so I say somewhere between 170-180lbs",t3_13sn5oj,t3_13sn5oj,15,knowledge
Thisguy203,millionairemakers,g2hkw15,-8269342351451482000,"Much love everyone, I'm trying to move out of my toxic household to focus on starting a life with my fiance in a place meant for us. I wish everyone here a good life !",t3_ie7dew,t3_ie7dew,35,respect
ClashTenniShoes,AskReddit,dlsljgv,6250038581911356000,Maybe they are talking on the phone and like to have both hands on the wheel but have an older vehicle that doesn't have Bluetooth,t3_6uh5wa,t3_6uh5wa,25,knowledge
tomytronics,nes,ijed397,1397087088331751000,NES version of Game Genie can be stacked to get more than 3 codes.  I had 3 total at one time.  Long ago I destroyed one to build a Famicom adapter using the adapter board found in early NES games. Back then Game Genie were under $5 each off eBay.,t3_wism2c,t3_wism2c,50,knowledge
J4H4FunWmore,CarolinaCouples,jk6rhuu,4415246995388030000,What a view. I’d love to pull those panties to the side,t3_136tffj,t3_136tffj,12,conflict
IridescentCrackPipe,malta,hp9v398,-2764995081025372000,"there will be clubs and you need to apply for membership like a shooting range, they will also only allow a certain number of members so tourists wont even be allowed to buy it.",t3_rkh36y,t3_rkh36y,34,knowledge
psullynj,Superstonk,i7wnm4y,5461282978204757000,Yeah I mean if you do enough digging on bill gates you see how many toxic entities he funds/ is connected to,t3_ulk0f1,t3_ulk0f1,22,knowledge
NeilOhighO,gijoe,c9kw3pw,-4512277254020667000,"I don't know of any specific weapons being produced with the process right now, but I do know the process itself is called Vac-Metal or Vacuum-Matallizing. I saw a guy who was redoing Destro heads on one of the forums using this process, but I can't remember which.  But there are customisers out there doing this.",t3_1cx46c,t3_1cx46c,56,knowledge
r2k398,unpopularopinion,e7mu4pn,2026534296225700000,They will do anything not to get caught like murder a girl who said she would call the cops on them because they were harassing her.,t3_9njtj2,t3_9njtj2,26,conflict
Omegacore31,DCcomics,e1kzw1e,6536880497372463000,I was the same too back then. It was only when I actually read some comics and then some thinking that I realized he's a lot more than what he looks.,t3_8v4qrl,t3_8v4qrl,31,similarity
Khantoro,leaves,ghasd57,1853395283953712000,"If you are on this sub already and asking this question the answer is yes you are addicted but you reached out and on the right path. You also already struggling with quitting, it starts like that, weed becomes your gf/wife/mistress/best friend and after few years you look around and you are alone in real life.",t3_klnzdi,t3_klnzdi,56,social_support
TenTonShoes,EpicSeven,g6hsbq6,-5032763312709526000,"[Luluca-sama.](https://i.imgur.com/vL3XuVi.jpg) Still a few improvements to make, hopefully with a new ring and the rest of her molas she'll break 200k.",t3_iz4gpw,t3_iz4gpw,21,respect
Brendanawesome,Invisalign,j48ztcl,4586448238868952000,Nice work!   I’m 13 months in and waiting in refinement scan.  Almost done too I hope,t3_10ahwib,t3_10ahwib,16,similarity
Neko_shii,TWEWY,h638zoa,8388052935482064000,I hope everything is successful. I just pre-orded a physical copy today and I’m getting a magnet set of the pins with it! I can’t wait to play the game &lt;3,t3_op001y,t3_op001y,31,respect
JaysusTheWise,40kLore,itff0ax,7978636983041465000,"The black dragons refused to send their geneseed and were going to be investigated hy the inquisition shortly before the great rift happened.

Now everyone is just too busy to care.",t3_yavmts,t3_yavmts,31,conflict
ArcadianBlueRogue,NintendoSwitch,dy3it9n,4232918560012482000,Where were you a year ago when I spent far more than I shoulda on that Shiekah Slate case?! HUH?!,t3_8fds1q,t3_8fds1q,20,conflict
ucancallmevicky,Atlanta,d3d97xh,7410356765061436000,"anyone know how likely it is there will be decent tickets available by August?

is it better to just buy the series early?",t3_4k3a96,t3_4k3a96,23,social_support
elhomerjas,Art,fr8gid1,-7097972853434114000,the flow and motion of your work is very relaxing to admire,t3_gn9t7d,t3_gn9t7d,12,respect
Yekwol_Yatsi,AskReddit,jbfcrp6,-2374361716104448000,"Having inbreed children with my sister, poor child has 3 eyes",t3_11m244i,t3_11m244i,11,knowledge
Saniiro,Maplestory,eqjueqk,-2717728045290082000,If my weapon got destroyed during Star Force enhancement how many stars do i start from again? Planning to try attempt 22*,t3_bxx396,t3_bxx396,22,social_support
s34nd0ugh,researchchemicals,eb3rdpp,-5589421900502989000,200mg? High purity? Goddamn lol i was tweaking hard off of 70 mg,t3_9dw9uv,t3_9dw9uv,13,respect
xenacoryza,AskReddit,el37he5,6278606763069502000,I have a 4 inch scar on my knee from climbing in between two metal buildings to look at some stray kittens.,t3_be3zo8,t3_be3zo8,22,respect
jerkfirecracker,asoiaf,cipvrqp,-7292322309514928000,"I'm guessing that anyone who can read and respond to this comment won't have any trouble with reading the books in English, either.",t3_29z1sf,t3_29z1sf,23,conflict
minminsaur,soccer,dcpn3jl,6249527055153233000,"For some perspective:

Highest earner at Milan - Carlos Bacca at €3.5 million

Highest earning Italian - Daniele De Rossi at €6.5 million

Highest earner in Serie A - Gonzalo Higuaín at €7.5 million

Highest earning goalkeeper - David De Gea at €12 million

Highest earning teenager - Marcus Rashford at €1.5 million",t3_5pa7us,t3_5pa7us,53,knowledge
Me2Brah,PurplePillDebate,fcwc3pl,524364780144013000,"You are assuming all Chads are high value but that simply isn’t true.

Also a lot of Chads with many options see women as objects so this doesn’t work either.",t3_ej4z6p,t3_ej4z6p,30,conflict
donkeydickcam,CLOV,h3chtj5,8645183415645169000,IM PISSED. This price drop happening and I don’t have any money left to buy. I guess I’m just stuck holding while I see you guys buying up all the discounted shares 😔,t3_o9mzxx,t3_o9mzxx,33,conflict
Bonobo77,gaming,d4lppel,-8642844818952229000,What No golf course? When I started playing all I ever wanted was to build gold courses....,t3_4phpch,t3_4phpch,17,respect
elliemff,HPfanfiction,f05a32h,1277210873220299000,Check out Enchanting the Bookworm on Facebook. They’ve been busy collecting lost stories from the Hermione-centric sites that went down and have thousands of stories.,t3_d3of4s,t3_d3of4s,25,social_support
ArcticJew666,gaming,ewpkv40,-515384915961477000,"But it's worth it for the Boots of Blinding Speed, right?
RIGHT‽",t3_cpg7h2,t3_cpg7h2,12,knowledge
bowlsfordays,ZonaEnts,iprlsro,4338451620700463000,"All these bomb ass food places already recommended, so i just wanna throw out dulce de churro as a GREAT dessert spot. Best churros I've ever had, and I get them every single time i see them on a menu",t3_xn39jc,t3_xn39jc,40,trust
ArshartUn,gwent,e8k8ezo,-5477168381865784000,I try to search the whole night and cannot get the third hidden map. Is there a choice I make wrong?,t3_9qwx3t,t3_9qwx3t,21,knowledge
nevertruly,AskWomen,hm5eje6,9103175089341489000,Removed for specifying majority demographics. If you have any questions please message the moderators through the link on the sidebar.,t3_r2mjos,t3_r2mjos,20,social_support
Middle-Magician-8077,cats,idr68t9,-7220170870970954000,It was on bare skin i chose to make my biscuits.,t3_vkpccl,t3_vkpccl,11,power
Raz0rBlaz0r,FortNiteBR,e98ivwx,4985966013798438000,Please add Asia servers to Xbox or add middle East servers in general I can't stand 200 ping,t3_9uzbia,t3_9uzbia,18,conflict
Rivkerfuffle,oddlysatisfying,g1b8l7o,-6129774503970870000,"Very (non)handy. The only thing I don't understand is why it doesn't have a handle to guide it more easily?
ETA that we have these in The Netherlands as well.",t3_i8wx2f,t3_i8wx2f,30,conflict
stinkeebong,fionnaandcake,k12lcp2,4472570212538836000,obviously the jake tattoo is so badass that it just needs to bust through the fabric of finn’s shirt. obviously.,t3_16lbrop,t3_16lbrop,20,knowledge
JakesThoughts1,PLTR,hjxtila,7726104262853170000,"Fuck wish I had extra cash, would buy some more on this dip",t3_qpx83n,t3_qpx83n,13,knowledge
BurnerAccount209,manga,jl05k6k,-728828346321667000,"Inb4 Childhood friend is some yandere who rejected him for a reason that makes no sense and advances the plot.

Seriously though, writing was actively poor on an already generic trope filled story.

Followed.",t3_13ndp3q,t3_13ndp3q,34,trust
Crowtaclysm,MurderDrones,jni9vxl,2664092390265797000,"Me hopin for J merch


The Nuzi shippers concerned for the crow's purple Solver eye bc crows in media more often than not represent death


People loosin sleep on the 24hs leadin to it",t3_144fsoe,t3_144fsoe,34,fun
nightbeef,3Dprinting,jgfzrq5,8178747228453531000,"Is there a compendium somewhere of fixes for common printing problems sorta like the troubleshooting guide that comes in the manual for many advanced power tools?

Just asking the universe in general. Not expecting OP to have all the answers.",t3_12nojn8,t3_12nojn8,40,social_support
I_live_in_a_trashcan,nfl,c6ech1m,-2729236025728669000,"WE HAVE A BYE SO I SAY FUCK ALL OF YOU. ESPECIALLY FUCK THE RAVENS, BENGALS, AND BROWNS. YEAH I SAID IT, FUCK THE BROWNS.",t3_10khl3,t3_10khl3,25,conflict
DISNYLND,Moissanite,j26f952,5820170077337498000,I bought my boyfriend's from this store and it's great quality. Highly recommend.,t3_zyijac,t3_zyijac,13,power
siinana719,Unemployment,fmwzljl,-6684802928568309000,"This is happening to me too but the offer is for less hours. 30 vs the 40, I was working before. Will your hours be the same?",t3_fxx87q,t3_fxx87q,27,knowledge
padraigharrington2,neoliberal,hgfnffp,806627682585844000,"have decided to make a new political party with one policy platform slash demand:  


# 1. EUTHANIZE FIVEY",t3_q6gc6f,t3_q6gc6f,18,respect
AstunisWWW,books,dycaipk,-5116747507617319000,Mine is the Dark is Rising sequence. I reread them every winter. No idea why but I love them!,t3_8gin5l,t3_8gin5l,19,similarity
Ok_Championship9073,AskReddit,k2o515e,-1641422993283606000,Chapter “who knows at this point”:How the hell did this go wrong,t3_16ubyn7,t3_16ubyn7,12,knowledge
raphrs,FFBraveExvius,dgc8oed,5424218511756737000,"Tilith, Rikku and Ashe. All 4* base units, so won't be THAT difficult to pull.",t3_65panr,t3_65panr,15,social_support
Andrewescocia,JoeRogan,fhxz5rb,-8382843917328922000,"but David is in front of things being driven, is he going to be destroyed?",t3_f54pip,t3_f54pip,15,social_support
Simmyho,soccer,i4lrup7,-8653789268776467000,Theyve plucked this ref straight out of the 60s. Unless you've broken something it's not a foul,t3_u2xdmz,t3_u2xdmz,17,conflict
Real_Ask62,TeamfightTactics,jij4y96,1733749094561261000,"That's really sad, don't worry you can always contact the support team they LL help you",t3_134xk4j,t3_134xk4j,16,knowledge
Agirlisarya01,90DayFiance,fq8d05h,-7869773569859012000,Lana looks soooooooo uncomfortable.  David’s too busy geeking out to even notice,t3_gh0qne,t3_gh0qne,12,knowledge
Sentient545,LearnJapanese,fo9bgv0,-1610801836807730000,"草 is generally just くさ.

w・笑・（笑）depend on the person, similar to how 'lol' can be read as 'laugh out loud', 'el-oh-el', or 'lawl. The most common are わら, わらい, or わらう but the kanji can also be read as しょう and when you include the brackets you can read it as かっこわら, かっこわらい, かっこわらう, or かっこしょう.",t3_g6f45l,t3_g6f45l,56,knowledge
Familiar_Criticism_7,MonopolyGoTrading,k5uivvw,4140087036770949000,i have a 4 star and couple 3 stars id give you for dive in,t3_17d62rv,t3_17d62rv,15,respect
to11,arizona,g01wd5l,4786848047217721000,I moved here from CA and.... it's way too hot! :),t3_i22sjl,t3_i22sjl,11,social_support
OnlyTwoPlanks,AskReddit,gddp3hs,883962642899930000,"I always go to October Sky as my movie of choice when I want to feel creative or pull myself out of a slump. The movie starts off slow and builds up to the boys success, gets me every time. It also helps that it's based on the story of the real Rocket Boys of NASA at the time.",t3_jzni4c,t3_jzni4c,59,knowledge
eightofnine,gallifrey,c5wc1h2,-8304770130018271000,aaarrgh!  Don't they WANT us to plan our lives around their show?  What are they thinking?,t3_yjjls,t3_yjjls,16,conflict
HornHonker69,politics,hlcyyvs,-8262053841762033000,Elizebeth Warren is bong: Biden can make the spliff decision to cancel student debt and legalize marijuana with a ‘dab on two different pieces of rolling paper’,t3_qxob2l,t3_qxob2l,27,conflict
Art_pog,TwoSentenceHorror,ies8jzp,5525230363272663000,"How??? Isn’t strangling pretty easy to identify, or am I wrong / gen",t3_vqn84e,t3_vqn84e,13,knowledge
LuckyRabbit4353,fnia_,k5uqak2,-1419764298751724000,"There is something different about you, I just can’t put my finger on it. Did you get a new outfit",t3_179pnbk,t3_179pnbk,20,conflict
